id,artist,title,album_title,artist_type,album_year,genre,mood,tempo
456239140,Apocalyptica,Sacra,7th Symphony,Male/Male Group,2010,Rock/Metal/Progressive Metal,Somber/Enigmatic / Mysterious,Medium Tempo/Medium/60s
456239138,30 Seconds To Mars,End Of All Days,Love Lust Faith + Dreams,Male/Male Group,2013,Alternative a Punk/Emo a Hardcore/Emo,Brooding/Dreamy Brooding,Medium Tempo/Medium/60s
456239137,Broods,Everytime,Evergreen,Mixed/Mixed Duo,2014,Alternative a Punk/Synth Pop/Synth Pop,Defiant/Heavy Brooding,Medium Tempo/Medium/70s
456239132,James Arthur,Recovery,James Arthur,Male/Male,2013,Pop/Western Pop/Pop Vocal,Brooding/Dreamy Brooding,Medium Tempo/Medium/70s
456239134,Big Moe,Purple Stuff (Remix) (Featuring Project Pat Big Pokey D-Gotti and Ronnie Spencer),Purple World (Explicit),Male/Male,2002,Urban/Western Hip-Hop/Rap/Southern Rap,Energizing/Edgy / Sexy,Medium Tempo/Medium/80s
456239131,Apocalyptica Feat. Adam Gontier,I Don't Care,I Don't Care,Male/Male Group,2007,Rock/Metal/Progressive Metal,Brooding/Energetic Melancholy,Medium Tempo/Medium/80s
456239123,Don Sebesky,"Ex. 16 Page 156 ""Firebirds/Birds Of Fire"" - Don Sebesky",The Contemporary Arranger,"",0,Jazz/Bebop a Modern Jazz/Modern Jazz,Yearning/Bittersweet Pop,Medium Tempo/Medium/70s
456239108,Sunrise Avenue,Fairytale Gone Bad (Acoustic Version),On The Way To Wonderland,Male/Male Group,2007,Alternative a Punk/Alternative/Alternative Rock,Gritty/Sober / Determined,Medium Tempo/Medium/60s
456239103,Bring Me The Horizon,Deathbeds,Sempiternal (Deluxe Edition),Male/Male Group,2013,Alternative a Punk/Emo a Hardcore/Hardcore,Yearning/Energetic Yearning,Medium Tempo/Medium/80s
456239100,Rammstein,Sonne,Mutter,Male/Male Group,2001,Rock/Metal/Industrial Metal,Aggressive/Aggressive Power,Medium Tempo/Medium/70s
456239110,Азамат Пхешхов,Теперь для меня ты чужая,От рассвета до заката,"",2016,Traditional/Other Traditions/General World,Gritty/Strumming Yearning,Medium Tempo/Medium/70s
456239076,Plazma,Love Is In Your Eyes (fly global trance mix),Lonely,Male/Male Duo,2001,"",Fiery/Fiery Groove,Medium Tempo/Medium/80s
456239074,Bring Me The Horizon,Hospital For Souls,Sempiternal,Male/Male Group,2013,Alternative a Punk/Emo a Hardcore/Hardcore,Brooding/Alienated / Brooding,Medium Tempo/Medium/60s
456239073,EGOIST,The Everlasting Guilty Crown,The Everlasting Guilty Crown,Mixed/Mixed Group,2012,Soundtrack/Animation/Animation,Defiant/Heavy Brooding,Medium Tempo/Medium/80s
456239071,The Glitch Mob,Bad Wings,Drink The Sea,Male/Male Group,2010,Electronica/Dubstep/Dubstep,Brooding/Dreamy Brooding,Medium Tempo/Medium/60s
456239070,The Neighbourhood,A Little Death,I Love You.,Male/Male Group,2013,Alternative a Punk/Indie Rock/Indie Pop,Defiant/Heavy Brooding,Medium Tempo/Medium/80s
456239067,Motörhead,God Was Never On Your Side,Kiss Of Death,Male/Male Group,2006,Rock/Metal/Speed Metal,Urgent/Energetic Anxious,Medium Tempo/Medium/80s
456239042,Archive,Bullets,Controlling Crowds,Mixed/Mixed Group,2009,Electronica/Downtempo Lounge a Ambient/Trip Hop,Brooding/Evocative / Intriguing,Medium Tempo/Medium/80s
456239022,Aaron Schweinberg,You Are Holy-Revelation Song,Deeper Places,"",2012,Other/Religious/Christian Inspirational,Romantic/Heartfelt Passion,Medium Tempo/Medium/60s
456239019,Ludovico Einaudi,Ora,Una mattina,Male/Male,2014,Classical/Classical Crossover/Classical Crossover Instrumental,Somber/Solemn / Spiritual,Medium Tempo/Medium/60s
397958363,Hi Power Soldiers,Bring The Drama feat. Malow Mac a Lady Pink's,Hi Power 2007,"",2007,Urban/Western Hip-Hop/Rap/General Hip-Hop/Rap,Defiant/Attitude / Defiant,Medium Tempo/Medium/70s
392000020,IAMX,S.H.E,The Alternative,Male/Male Group,2006,Alternative a Punk/Indie Rock/Post-Punk Revival,Brooding/Evocative / Intriguing,Medium Tempo/Medium/80s
351914166,James Arthur,Impossible,James Arthur,Male/Male,2013,Pop/Western Pop/Pop Vocal,Yearning/Energetic Yearning,Medium Tempo/Medium/80s
366390491,Ed Sheeran,I'M A Mess,×,Male/Male,2014,Pop/Western Pop/Adult Alternative Pop,Sensual/Soft Soulful,Medium Tempo/Medium/60s
363258945,RAIGN,Empire Of Our Own,Empire Of Our Own [Single],Female/Female,2015,Electronica/Electronica Mainstream/Pop Electronica,Brooding/Dreamy Brooding,Medium Tempo/Medium/80s
355639001,Stereophonics,Maybe Tomorrow,You Gotta Go There To Come Back,Male/Male Group,2003,Alternative a Punk/Brit Rock/Brit Rock,Gritty/Strumming Yearning,Medium Tempo/Medium/80s
355263161,Lana Del Rey,Born To Die,Born To Die,Female/Female,2012,Electronica/Electronica Mainstream/Pop Electronica,Brooding/Energetic Melancholy,Medium Tempo/Medium/80s
353755413,I am waiting for you last summer,Through the Walls,In Eternal Lines,Male/Male Group,2014,Rock/Mainstream Rock/General Mainstream Rock,Brooding/Dreamy Brooding,Medium Tempo/Medium/70s
353273145,David Nevue,Overcome,Overcome,Male/Male,2005,Other/New Age/New Acoustic,Melancholy/Wistful / Forlorn,Medium Tempo/Medium/70s
351911500,Andrew Belle,Pieces,Black Bear,Male/Male,2013,Alternative a Punk/Alternative/Alternative Singer-Songwriter,Yearning/Sensitive / Exploring,Medium Tempo/Medium/60s
347634732,Within Temptation,What Have You Done,The Heart Of Everything,Mixed/Mixed Group,2007,Rock/Metal/Gothic Metal,Defiant/Heavy Brooding,Medium Tempo/Medium/80s
346891794,The Moody Blues,Lunch Break: Peak Hour,Days Of Future Passed,Male/Male Group,1967,Rock/70's Rock/Classic Prog,Brooding/Evocative / Intriguing,Medium Tempo/Medium/80s
342877703,Myrkur,Why,Why / Lament - EP,Male/Male,2008,Electronica/Dubstep/Dubstep,Sensual/Dreamy Pulse,Medium Tempo/Medium/60s
339158762,Linkin Park,Final Masquerade,The Hunting Party,Male/Male Group,2014,Rock/Metal/Rap Metal,Yearning/Energetic Yearning,Medium Tempo/Medium/80s
338566410,Midnight Hour,Running Away,Midnight Hour,"",2014,Alternative a Punk/Alternative/Alternative Rock,Empowering/Powerful / Heroic,Medium Tempo/Medium/70s
337488142,Hillsong,Mighty To Save,Mighty To Save,Mixed/Mixed Group,2006,Other/Religious/Hymns a Spirituals,Empowering/Powerful / Heroic,Medium Tempo/Medium/70s
328144033,Lifehouse,Broken,Who We Are,Male/Male Group,2007,Rock/Adult Alternative Rock/Adult Alternative Rock,Empowering/Powerful / Heroic,Medium Tempo/Medium/60s
323698632,John Murphy,Don Abandons Alice,28 Weeks Later,Male/Male,2007,Soundtrack/Original Film/TV Music/General Film Music,Brooding/Alienated / Brooding,Medium Tempo/Medium/70s
321227615,Jeremih,Fuck U All The Time Featuring Natasha Mosley,Late Nights with Jeremih,Male/Male,2012,Urban/Contemporary RaB/Soul/Urban Crossover,Sensual/Dreamy Pulse,Medium Tempo/Medium/70s
320627447,Gavin DeGraw,I Don't Want To Be,Chariot,Male/Male,2003,Pop/Western Pop/Adult Alternative Pop,Defiant/Heavy Brooding,Medium Tempo/Medium/70s
314205132,Lil Wayne,Lollipop,Tha Carter III,Male/Male Duo,2008,Urban/Western Hip-Hop/Rap/General Hip-Hop/Rap,Cool/Wary / Defiant,Medium Tempo/Medium/70s
311461715,Fall Out Boy,Centuries,American Beauty / American Psycho,Male/Male Group,2015,Alternative a Punk/Emo a Hardcore/Emo,Urgent/Energetic Anxious,Medium Tempo/Medium/80s
311459933,Nickelback,What Are You Waiting For?,No Fixed Address,Male/Male Group,2014,Alternative a Punk/Alternative/Alternative Rock,Yearning/Energetic Yearning,Medium Tempo/Medium/70s
299796451,30 Seconds To Mars,Attack,A Beautiful Lie,Male/Male Group,2005,Alternative a Punk/Emo a Hardcore/Emo,Urgent/Energetic Anxious,Medium Tempo/Medium/80s
289931850,John Ottman,Hope (Xavier's Theme),X-Men: Days of Future Past (Original Motion Picture Soundtrack),Male/Male,2014,Soundtrack/Original Film/TV Music/General Film Music,Somber/Enigmatic / Mysterious,Medium Tempo/Medium/60s
288301904,Linkin Park,Breaking The Habit,Meteora,Male/Male Group,2003,Rock/Metal/Rap Metal,Sophisticated/Smoky / Romantic,Medium Tempo/Medium/60s
287633510,Ashes Remain,Right Here,What I've Become,Male/Male Group,2011,Other/Religious/Christian Alt-Rock,Empowering/Powerful / Heroic,Medium Tempo/Medium/70s
254837711,Staind,All I Want,The Illusion Of Progress,Male/Male Group,2008,Rock/Metal/Nu-Metal,Empowering/Powerful / Heroic,Medium Tempo/Medium/80s
211266836,Kanye West,Runaway (Ft. Pusha T),My Beautiful Dark Twisted Fantasy,Male/Male,0,Urban/Western Hip-Hop/Rap/General Hip-Hop/Rap,Cool/Wary / Defiant,Medium Tempo/Medium/80s
240379622,30 Seconds To Mars,A Beautiful Lie (Single Shot Version),To The Edge Of The Earth [EP],Male/Male Group,2008,Alternative a Punk/Emo a Hardcore/Emo,Defiant/Heavy Brooding,Medium Tempo/Medium/80s
235794441,Ellie Goulding,Burn,Halcyon Days,Female/Female,2013,Electronica/Electronica Mainstream/Pop Electronica,Energizing/Edgy / Sexy,Medium Tempo/Medium/80s
213037284,Nickelback,How You Remind Me,Silver Side Up,Male/Male Group,2001,Alternative a Punk/Alternative/Alternative Rock,Defiant/Heavy Brooding,Medium Tempo/Medium/80s
208875652,2 Chainz a Wiz Khalifa,We Own It (Fast a Furious),The Fast And The Furious Soundtrack Collection,Male/Male Duo,2015,Urban/Western Hip-Hop/Rap/General Hip-Hop/Rap,Cool/Wary / Defiant,Medium Tempo/Medium/80s
201838139,My Darkest Days,Come Undone,My Darkest Days,Male/Male Group,2010,Alternative a Punk/Alternative/Alternative Rock,Empowering/Powerful / Heroic,Medium Tempo/Medium/80s
201835904,Ashram,Maria and the Violin's String,Shining Silver Skies,Male/Male Group,2006,Other/New Age/New Acoustic,Melancholy/Wistful / Forlorn,Medium Tempo/Medium/70s
201835715,Three Days Grace,I Hate Everything About You,Three Days Grace,Male/Male Group,2003,Alternative a Punk/Alternative/Alternative Rock,Defiant/Heavy Brooding,Medium Tempo/Medium/80s
191168123,Hinder,Bliss (I Don't Wanna Know),Extreme Behavior,Male/Male Group,2005,Alternative a Punk/Alternative/Alternative Rock,Empowering/Powerful / Heroic,Medium Tempo/Medium/70s
181015535,Tykwer Klimek a Heil,Cloud Atlas Opening Title,Cloud Atlas,Male/Male,2012,Soundtrack/Original Film/TV Music/General Film Music,Somber/Enigmatic / Mysterious,Medium Tempo/Medium/70s
180258156,Tykwer Klimek a Heil,Cloud Atlas Opening Title,Cloud Atlas,Male/Male,2012,Soundtrack/Original Film/TV Music/General Film Music,Somber/Enigmatic / Mysterious,Medium Tempo/Medium/70s
158570079,Joel a Luke,Love's To Blame,A Tale Of Two Towns - The EP,Male/Male Duo,2008,Rock/Adult Alternative Rock/Adult Alternative Rock,Empowering/Dramatic Emotion,Medium Tempo/Medium/60s
158569102,Kevin Rudolf,Gimme A Sign,In The City [Explicit],Male/Male,2008,Pop/Western Pop/Urban Crossover: Pop,Fiery/Passionate Rhythm,Medium Tempo/Medium/60s
155034832,David Arnold a Michael Price,SHERlocked,Sherlock: Series Two,"",2012,Soundtrack/Original Film/TV Music/General Film Music,Serious/Thrilling,Medium Tempo/Medium/60s
143097456,Clint Mansell,Leaving New York,World Traveler OST,Male/Male,2002,Soundtrack/Original Film/TV Music/General Film Music,Sensual/Dreamy Pulse,Medium Tempo/Medium/60s
127502334,Craig Armstrong,Main Title,The Incredible Hulk,Male/Male,2013,Soundtrack/Original Film/TV Music/General Film Music,Serious/Thrilling,Medium Tempo/Medium/60s
109953558,Austrian Death Machine,T2 Theme,Double Brutal [Disc 2],Male/Male Group,2009,Rock/Metal/Thrash Metal,Defiant/Heavy Brooding,Medium Tempo/Medium/80s
105800320,Various Artists,E.T.,Now That's What I Call Music! 78 [Disc 2],Mixed/Mixed Duo,2011,Pop/Western Pop/Dance Pop,Energizing/Edgy / Sexy,Medium Tempo/Medium/70s
104870163,Backstreet Boys,Incomplete,Never Gone,Male/Male Group,2005,Pop/Western Pop/Teen Boy Band,Yearning/Energetic Yearning,Medium Tempo/Medium/60s
106630039,Marcelo Zabros,Craig Worries,Remember Me (Original Motion Picture Score),"",2010,Soundtrack/Original Film/TV Music/General Film Music,Peaceful/Reverent / Healing,Medium Tempo/Medium/60s
91481981,DJ Paul,Twist It Hit It Lite It,Underground Vol. 16 For Da Summa,Male/Male,2002,Urban/Western Hip-Hop/Rap/Mixtape,Cool/Wary / Defiant,Medium Tempo/Medium/60s
84504502,Carter Burwell,I Know What You Are,Twilight: The Score,Male/Male,2008,Soundtrack/Original Film/TV Music/General Film Music,Somber/Enigmatic / Mysterious,Medium Tempo/Medium/60s
166899389,Dash Berlin,Man On The Skyfire,#musicislife,Mixed/Mixed Group,2012,Electronica/Trance/Trance,Yearning/Energetic Yearning,Medium Tempo/Medium/60s
