id,artist,title,album_title,artist_type,album_year,genre,mood,tempo
456239102,Lost Frequencies,Reality,Less Is More,Male/Male,2016,Electronica/House/Deep House,Energizing/Edgy / Sexy,Medium Tempo/Medium Fast/120s
456239088,OQJAV,Джек,Окуджав,"",2014,Alternative a Punk/Indie Rock/General Indie Rock,Energizing/Edgy / Sexy,Medium Tempo/Medium Fast/100s
456239064,Epolets,Мелодія,Cult,"",2016,Alternative a Punk/Alternative/Alternative Rock,Energizing/Arousing Groove,Medium Tempo/Medium Fast/110s
434345029,Various Artists,Ace Of Base - Alle The She Wants,Take No Crap: Alle Tiders 90'er Hits [Disc 2],"",2006,Pop/Western Pop/Dance Pop,Energizing/Edgy / Sexy,Medium Tempo/Medium Fast/90s
402622074,Panivalkova,Crazy Nikita,Панівалькова,"",2014,Pop/Western Pop/Pop Vocal,Energizing/Edgy / Sexy,Medium Tempo/Medium Fast/100s
392891574,Various Artists,Осінь блукає в садах,На коня Ukrainian Folk,"",2014,Traditional/Folk/Traditional U.S. Folk,Energizing/Edgy / Sexy,Medium Tempo/Medium Fast/100s
386828908,Lana Del Rey,High By The Beach,Honeymoon,Female/Female,2015,Electronica/Electronica Mainstream/Pop Electronica,Energizing/Abstract Beat,Fast Tempo/Fast/130s
376928048,Hollywood Undead,Comin' In Hot,American Tragedy [Explicit Version],Male/Male Group,2011,Rock/Metal/Rap Metal,Energizing/Edgy / Sexy,Medium Tempo/Medium Fast/90s
375648348,Gotye,Thanks For Your Time,Like Drawing Blood,Male/Male,2006,Alternative a Punk/Alternative/Alternative Singer-Songwriter,Energizing/Edgy / Sexy,Medium Tempo/Medium Fast/100s
373947543,Gotye Feat. Kimbra,Somebody That I Used To Know (Gang Colours Remix),Somebody That I Used To Know (Remixes),Mixed/Mixed Duo,2012,Alternative a Punk/Alternative/Alternative Singer-Songwriter,Energizing/Abstract Beat,Medium Tempo/Medium Fast/120s
355364806,Various Artists,Где Ты,Сборник Русской Музыки,"",2005,Pop/Western Pop/Pop Vocal,Energizing/Edgy / Sexy,Medium Tempo/Medium Slow/60s
352418193,Yelawolf,Back To Bama,Arena Rap EP,Male/Male,2008,Urban/Western Hip-Hop/Rap/Midwestern Rap,Energizing/Abstract Beat,Fast Tempo/Fast/140s
351427827,Bahroma,Не дави,Внутри,Male/Male Group,2014,Rock/Mainstream Rock/General Mainstream Rock,Energizing/Edgy / Sexy,Fast Tempo/Fast/130s
350060514,Various Artists,Bad guy (Wanna-Make-U-Dance Mix),Rain's Drama Soundtrack,"",0,Soundtrack/Original Film/TV Music/General TV Music,Energizing/Edgy / Sexy,Medium Tempo/Medium Fast/100s
347017494,Cappella,The Big Beat [Special Crazy Mix],The Big Beat,Mixed/Mixed Duo,1995,Electronica/Dance a Club/Club Dance,Energizing/Abstract Beat,Fast Tempo/Fast/130s
345052059,Prince,Kiss,The Hits/The B-Sides [Disc 2],Mixed/Mixed Group,1993,Urban/Classic RaB/Soul/Funk,Energizing/Arousing Groove,Medium Tempo/Medium Fast/110s
344707198,Cream Of Underground House,Keep The Jam Going (Live At The OPL Mix),The Cream Of Underground House Vol. 5,"",1995,Electronica/House/Deep House,Energizing/Heavy Beat,Medium Tempo/Medium Fast/120s
336870493,Maroon 5,Kiwi,It Won't Be Soon Before Long,Male/Male Group,2007,Pop/Western Pop/Adult Alternative Pop,Energizing/Edgy / Sexy,Medium Tempo/Medium/70s
334182017,Madonna,Music (Deep Dish Dot Com Remix),Music [Single],Female/Female,2000,"",Energizing/Heavy Beat,Medium Tempo/Medium Fast/120s
328096617,Tomas N'evergreen,Since You`ve Been Gone,Since You`ve Been Gone,Male/Male,2003,Pop/European Pop/Euro Pop,Energizing/Edgy / Sexy,Medium Tempo/Medium Fast/120s
298555031,Example,One More Day (Stay With Me),Live Life Living [Deluxe Edition],Male/Male,2014,Urban/Western Hip-Hop/Rap/General Hip-Hop/Rap,Energizing/Arousing Groove,Medium Tempo/Medium Fast/120s
295573860,Taco,Puttin' On The Ritz,After Eight,Male/Male,2008,Pop/Western Pop/Dance Pop,Energizing/Arousing Groove,Medium Tempo/Medium Fast/90s
279919736,Глюкоза,Аста Ла Виста,Глюк'oza Nostra,Female/Female,2003,"",Energizing/Arousing Groove,Medium Tempo/Medium Fast/110s
272595255,Armin Van Buuren,Tears (Aurosonic Progressive Remix),A State Of Trance Year Mix 2011 [Disc 1],Male/Male,2011,Electronica/Trance/Trance,Energizing/Heavy Beat,Fast Tempo/Fast/130s
270976539,Haddaway,Fallen Angel,Pop Splits,Male/Male,2011,Electronica/Dance a Club/Club Dance,Energizing/Arousing Groove,Medium Tempo/Medium Fast/120s
262105535,Various Artists,sheke,Fiesta Mix 2,"",2006,Alternative a Punk/Alternative/Alternative Rock,Energizing/Edgy / Sexy,Medium Tempo/Medium Fast/90s
240529233,Гудімов,Будем разом,Монополія,"",2015,Pop/Western Pop/Pop Vocal,Energizing/Edgy / Sexy,Medium Tempo/Medium/70s
220876848,SOUL'd OUT,CLONE AS A FUNNY CREATURE PREACHER,To All Tha Dreamers,Male/Male Group,2005,Urban/Asian Hip-Hop/Rap/Japanese Hip-Hop/Rap,Energizing/Edgy / Sexy,Medium Tempo/Medium/80s
213232596,Dr. Dre,Lil' Ghetto Boy,The Chronic,Male/Male Group,1992,Urban/Western Hip-Hop/Rap/Gangsta Rap,Energizing/Arousing Groove,Medium Tempo/Medium Fast/90s
210071114,Gorillaz,Feel Good Inc.,Demon Days,Male/Male Group,2005,Alternative a Punk/Indie Rock/Post-Modern Electronic Pop,Energizing/Edgy / Sexy,Fast Tempo/Fast/130s
209974617,Дима Билан,Я Твой Номер Один,Против Правил,Male/Male,2008,"",Energizing/Edgy / Sexy,Medium Tempo/Medium Fast/110s
209967140,Мері,Місто,Меридіани,"",0,Pop/Western Pop/Pop Vocal,Energizing/Edgy / Sexy,Medium Tempo/Medium Fast/90s
209245193,DJ Half,Numb(Featuring Elunaya Project)(Linkin Park Cover),Numb(Featuring Elunaya Project)(Linkin Park Cover),"",2014,Pop/Western Pop/Pop Vocal,Energizing/Heavy Beat,Medium Tempo/Medium Fast/120s
208383680,Чи-Ли,Не ангелы,Преступление,Mixed/Mixed Duo,2006,Pop/European Pop/Eastern European Pop,Energizing/Edgy / Sexy,Medium Tempo/Medium Fast/100s
207354940,Dimitri From Paris,Thirteen (LP Mix),Dimitri From Paris In The House [Disc 2],Male/Male,2003,Electronica/House/General House,Energizing/Heavy Beat,Medium Tempo/Medium Fast/120s
206511871,Fallulah,I Lay My Head,The Black Cat Neighbourhood,Female/Female,2010,Alternative a Punk/Indie Rock/General Indie Rock,Energizing/Edgy / Sexy,Medium Tempo/Medium Fast/100s
206434260,Éléphant,Rien,Collective mon amour,Mixed/Mixed Duo,2013,Pop/European Pop/French Pop,Energizing/Edgy / Sexy,Medium Tempo/Medium Fast/100s
206362148,Дима Билан,Ночь Без Тебя,На Берегу Неба,Male/Male,2004,Pop/European Pop/Eastern European Pop,Energizing/Edgy / Sexy,Medium Tempo/Medium Fast/100s
202448158,Жанна Агузарова,Мальчик В Теннисных Туфлях,Back 2 Future,Female/Female,2003,"",Energizing/Arousing Groove,Fast Tempo/Fast/140s
201820591,Various Artists,А что я такого сказала?,Союз,"",2008,Pop/Western Pop/Pop Vocal,Energizing/Edgy / Sexy,Medium Tempo/Medium Fast/120s
196152626,Pentatonix,Aha!,PTX Vols. 1 a 2,Mixed/Mixed Group,2014,Pop/Western Pop/Other Pop,Energizing/Edgy / Sexy,Medium Tempo/Medium/80s
194326205,王力宏,杜U ♥ Me,十八般武藝,Male/Male,2010,Pop/Chinese Pop/General Chinese Pop,Energizing/Edgy / Sexy,Medium Tempo/Medium Fast/90s
193545118,Jacques Lu Cont,Eurolove,FabricLive.09,Male/Male,2003,Electronica/House/Euro House,Energizing/Heavy Beat,Medium Tempo/Medium Fast/120s
187316859,The Hoosiers,Squeeze,Bumpy Ride EP,Male/Male Group,2014,Alternative a Punk/Indie Rock/Indie Pop,Energizing/Abstract Beat,Medium Tempo/Medium Fast/120s
184346376,Fischerspooner,Never Win,Odyssey,Mixed/Mixed Group,2005,Electronica/Electronica Mainstream/Electroklash,Energizing/Edgy / Sexy,Medium Tempo/Medium Fast/110s
182526611,Various Artists,Обійми мене Feat. Діля,Найкращі українські пісні Ч. 2,"",2014,Pop/Western Pop/Pop Vocal,Energizing/Edgy / Sexy,Medium Tempo/Medium/80s
181098429,Royal Crown Revue,Hey Pachuco!,Mugzy's Move,Male/Male Group,1995,Alternative a Punk/Swing Revival/Swing Revival,Energizing/Arousing Groove,Fast Tempo/Fast/130s
180413470,Various Artists,Камикадзе,Союз 45,"",2009,Pop/Western Pop/Pop Vocal,Energizing/Edgy / Sexy,Medium Tempo/Medium Fast/120s
178049206,Различные Исполнители,Если Бы Не Ты,Фабрика Звезд Виктора Дробыша: Звездные Дуэты,"",2006,Pop/Western Pop/Pop Vocal,Energizing/Edgy / Sexy,Medium Tempo/Medium/80s
177856010,Groove Armada,Chicago,Vertigo,Male/Male Duo,1999,Electronica/Electronica Mainstream/Big Beat,Energizing/Heavy Beat,Medium Tempo/Medium Fast/120s
177308347,Любовь Успенская,Сильней чем прежде Feat. Сосо Павлиашвили,Горький шоколад,Female/Female,2016,Pop/European Pop/Eastern European Pop,Energizing/Edgy / Sexy,Medium Tempo/Medium Fast/120s
177113738,Михей и Джуманджи,Дорога К Морю,Сука Любовь,Male/Male Group,1999,Urban/Contemporary RaB/Soul/Urban Crossover,Energizing/Edgy / Sexy,Medium Tempo/Medium/80s
176159725,Любовь Успенская,Сильней чем прежде Feat. Сосо Павлиашвили,Горький шоколад,Female/Female,2016,Pop/European Pop/Eastern European Pop,Energizing/Edgy / Sexy,Medium Tempo/Medium Fast/120s
155912597,Maroon 5,Give A Little More,Hands All Over,Male/Male Group,2010,Pop/Western Pop/Adult Alternative Pop,Energizing/Arousing Groove,Medium Tempo/Medium Fast/110s
136023962,Святослав Вакарчук,Адреналін,Брюссель,Male/Male,2011,Pop/European Pop/Eastern European Pop,Energizing/Arousing Groove,Medium Tempo/Medium Fast/90s
125047140,Александр Марцинкевич И Группа Кабриолет,Без Тебя,Цыганский Танец,Mixed/Mixed Group,2004,"",Energizing/Heavy Beat,Fast Tempo/Fast/130s
123141903,Vacuum,Icaros,Culture Of Night,Male/Male Duo,2002,Alternative a Punk/Synth Pop/Synth Pop,Energizing/Edgy / Sexy,Medium Tempo/Medium/70s
119233371,Incognito a Rice Artists Remixed,Everything Your Heart Desires (Bluey's Black Sunshine Remix),Feed Your Soul [Disc 2] - Incognito Remixed,Mixed/Mixed Group,2006,Electronica/Downtempo Lounge a Ambient/Acid Jazz,Energizing/Abstract Beat,Medium Tempo/Medium Fast/110s
117091995,Григорий Лепс,Я Тебя Не Люблю,Водопад,Male/Male,2009,Pop/European Pop/Eastern European Pop,Energizing/Edgy / Sexy,Medium Tempo/Medium Fast/100s
