id,artist,title,album_title,artist_type,album_year,genre,mood,tempo
456239159,Max Richter Daniel Hope Konzerthaus Kammerorchester Berlin André De Ridder,Spring 0,Recomposed By Max Richter: Vivaldi The Four Seasons,"",2014,Classical/Other Classical/General Classical,Somber/Dark Cosmic,Slow Tempo/Very Slow/20s
456239138,Egor Grushin,Essential,Once,"",2016,Classical/Other Classical/General Classical,Brooding/Dreamy Brooding,Medium Tempo/Medium/60s
456239042,Камиль Сен-Санс,Пляска Смерти Соч. 40,Золотая Коллекция Мировой Классики,"",0,Classical/Other Classical/General Classical,"",""
435425140,Various Artists,Водопад (Allegro),Малыш у реки,"",1999,Classical/Other Classical/General Classical,Other,Slow Tempo/Slow/40s
369427667,Lorraine Hunt Drew Minter Etc. Nicholas McGegan: Philharmonia Baroque Orchestra UC Berkeley Chamber Chorus,Handel: Theodora HWV 68 - Act 1: Racks Gibbets Sword a Fire,Handel: Theodora [Disc 1],"",2006,Classical/Other Classical/General Classical,Stirring/Invigorating / Joyous,Medium Tempo/Medium Fast/120s
244169869,Joshua Bell John Williams: London Symphony Orchestra,Gershwin: Our Love Is Here To Stay,Gershwin Fantasy,Mixed/Mixed Group,1998,Classical/Other Classical/General Classical,Tender/Refined / Mannered,Medium Tempo/Medium/70s
93205233,Daniel Hope André De Ridder: Konzerthaus Kammerorchester Berlin,Richter: Vivaldi The Four Seasons - Autumn 1,Recomposed By Max Richter - Vivaldi: The Four Seasons,Mixed/Mixed Group,2012,Classical/Other Classical/General Classical,Tender/Awakening / Stately,Medium Tempo/Medium Fast/110s
