id,artist,title,album_title,artist_type,album_year,genre,mood,tempo
456239032,Various Artists,Cold,The Twilight Saga: Breaking Dawn Part 1,Mixed/Mixed Duo,2011,Alternative a Punk/Brit Rock/Brit Rock,Melancholy/Wistful / Forlorn,Slow Tempo/Slow/40s
289519796,Various Artists,Сломанное фортепиано,Вечер вдвоем-лучшие инструментальные мелодии-10,"",0,Alternative a Punk/Alternative/Alternative Rock,"",""
98641062,Various Artists,Someone To Fall Back On,Bandslam,Mixed/Mixed Group,2009,Soundtrack/Original Film/TV Music/Musical Film/TV Music,Empowering/Powerful / Heroic,Medium Tempo/Medium Fast/100s
105800320,Various Artists,E.T.,Now That's What I Call Music! 78 [Disc 2],Mixed/Mixed Duo,2011,Pop/Western Pop/Dance Pop,Energizing/Edgy / Sexy,Medium Tempo/Medium/70s
96459682,Various Artists,Gonna Wanna,Les Chevaliers Du Ciel,"",2005,Soundtrack/Original Film/TV Music/General Film Music,Aggressive/Chaotic / Intense,Medium Tempo/Medium Fast/100s
133457921,Various Artists,Белые Лошади,Русская Дискотека Vol. 5,"",2007,Pop/Western Pop/Pop Vocal,Empowering/Dramatic Emotion,Slow Tempo/Very Slow/30s
