id,artist,title,album_title,artist_type,album_year,genre,mood,tempo
456239190,Leighton Meester,Heartstrings,Heartstrings,Female/Female,2014,Pop/Western Pop/Dance Pop,Yearning/Energetic Yearning,Medium Tempo/Medium Fast/100s
456239189,Max Richter,Organum,The Blue Notebooks,Male/Male,2014,Classical/Contemporary Era/Contemporary Era Instrumental,"",""
456239188,The Rasmus,First Day Of My Life,Dead Letters,Male/Male Group,2003,Alternative a Punk/Alternative/Alternative Rock,Defiant/Heavy Brooding,Medium Tempo/Medium Fast/100s
456239187,The Rosebuds,Boxcar,Birds Make Good Neighbours,Mixed/Mixed Duo,2005,Alternative a Punk/Indie Rock/Indie Pop,Yearning/Energetic Yearning,Medium Tempo/Medium/60s
456239186,Florence + The Machine,Hurricane Drunk,Lungs,Mixed/Mixed Group,2009,Alternative a Punk/Alternative/Alternative Singer-Songwriter,Empowering/Dramatic Emotion,Slow Tempo/Slow/40s
456239185,The Rasmus,Immortal,Hide From The Sun,Male/Male Group,2005,Alternative a Punk/Alternative/Alternative Rock,Defiant/Heavy Brooding,Medium Tempo/Medium/70s
456239184,The Rasmus,Night After Night (Out Of The Shadows),Hide From The Sun,Male/Male Group,2005,Alternative a Punk/Alternative/Alternative Rock,Defiant/Heavy Brooding,Medium Tempo/Medium Fast/100s
456239183,The Rasmus,Lucifer's Angel,Hide From The Sun,Male/Male Group,2005,Alternative a Punk/Alternative/Alternative Rock,Defiant/Heavy Brooding,Medium Tempo/Medium/70s
456239182,The Beatles,Here There And Everywhere,Revolver,Male/Male Group,1966,Rock/60's Rock/Psychedelic Rock,Sentimental/Tender / Sincere,Slow Tempo/Slow/40s
456239181,Apocalyptica Feat. Adam Gontier,I Don't Care,I Don't Care,Male/Male Group,2007,Rock/Metal/Progressive Metal,Brooding/Energetic Melancholy,Medium Tempo/Medium/80s
456239180,Sarah McLachlan,Path Of Thorns,Mirrorball [Live],Female/Female,1999,Pop/Western Pop/Adult Alternative Pop,Empowering/Dramatic Emotion,Slow Tempo/Slow/40s
456239179,R.E.M.,Bittersweet Me,New Adventures In Hi-Fi,Male/Male Group,1996,Rock/Adult Alternative Rock/Adult Alternative Rock,Brooding/Energetic Melancholy,Medium Tempo/Medium Fast/120s
456239178,Linkin Park,Given Up,Minutes To Midnight,Male/Male Group,2007,Rock/Metal/Rap Metal,Aggressive/Aggressive Power,Medium Tempo/Medium Fast/100s
456239177,Florence + The Machine,Girl With One Eye,Lungs,Mixed/Mixed Group,2009,Alternative a Punk/Alternative/Alternative Singer-Songwriter,Sophisticated/Smoky / Romantic,Medium Tempo/Medium/60s
456239175,Florence + The Machine,Hardest Of Hearts,Lungs: The B-Sides,Mixed/Mixed Group,2009,Alternative a Punk/Alternative/Alternative Singer-Songwriter,Sensual/Dreamy Pulse,Medium Tempo/Medium/60s
456239174,ウォン・ウィンツァン,旅のはじめに,光の華 [Disc 2] PianoaStrings Version,Male/Male,2009,Other/New Age/Adult Alternative New Age,Tender/Romantic / Lyrical,Medium Tempo/Medium Slow/50s
456239173,Ringo Starr,You're Sixteen,Ringo a His New All-Starr Band,Male/Male,2002,Pop/Western Pop/Singer-Songwriter,Rowdy/Ramshackle / Rollicking,Medium Tempo/Medium/60s
456239172,Misty Miller,Evergreen Love,Misty Miller,Female/Female,2011,Pop/Western Pop/Adult Alternative Pop,Easygoing/Friendly,Slow Tempo/Slow/40s
456239171,Flunk,Cigarette Burns,This Is What You Get,Mixed/Mixed Group,2009,Electronica/Downtempo Lounge a Ambient/Trip Hop,Yearning/Energetic Yearning,Medium Tempo/Medium Fast/110s
456239170,Blonde Redhead,Elephant Woman,Misery Is A Butterfly,Mixed/Mixed Group,2004,Alternative a Punk/Indie Rock/Noise Pop,Brooding/Energetic Melancholy,Medium Tempo/Medium/80s
456239169,New Young Pony Club,Architect of Love,The Optimist,Mixed/Mixed Group,2010,Alternative a Punk/Indie Rock/Indie Pop,Urgent/Dark Pop Intensity,Medium Tempo/Medium Fast/120s
456239168,Luigi Rubino,Before Love,A Theme for the Moon,Male/Male,2009,Other/New Age/New Acoustic,Romantic/Dramatic / Romantic,Medium Tempo/Medium Slow/50s
456239167,Luigi Rubino,Last Dance,A Theme for the Moon,Male/Male,2009,Other/New Age/New Acoustic,Romantic/Dramatic / Romantic,Medium Tempo/Medium Slow/50s
456239166,Muse,Butterflies a Hurricanes,Absolution,Male/Male Group,2003,Alternative a Punk/Alternative/Alternative Rock,Somber/Enigmatic / Mysterious,Medium Tempo/Medium Slow/50s
456239165,Paper Route,Real Emotion,Real Emotion,Male/Male Group,2016,Alternative a Punk/Synth Pop/Synth Pop,Brooding/Dreamy Brooding,Medium Tempo/Medium/70s
456239164,Daniel O'Donnell,The Moon Of Love Medley: Dream Lover Single Girl I'm A Believer Bobby's Girl When Don't Go Breaking My Heart Shoop Shoop Song Da Doo Ron Ron Then I Kissed Her Under The Moon Of Love,The Rock 'n' Roll Show [Disc 2],Male/Male,2006,Pop/Western Pop/Pop Vocal,Lively/Showy / Rousing,Fast Tempo/Fast/130s
456239163,Gene Michael Productions,GM_339_13 New Heights - Theme,GM_339 Techtronica ( Electronic / Industrial / Techno ),Mixed/Mixed Group,2007,Other/Sound Effects a Ringtones/General Sound Effects,"",""
456239162,a-ha,Don't Do Me Any Favours,Analogue,Male/Male Group,2005,Alternative a Punk/New Wave Pop/New Wave Pop,Brooding/Energetic Melancholy,Medium Tempo/Medium Fast/90s
456239161,a-ha,A Fine Blue Line,Analogue,Male/Male Group,2005,Alternative a Punk/New Wave Pop/New Wave Pop,Empowering/Dramatic Emotion,Slow Tempo/Slow/40s
456239160,Echo a The Bunnymen,Lost On You,What Are You Going To Do With Your Life,Male/Male Group,1999,Alternative a Punk/Indie Rock/Original Post-Punk,Empowering/Powerful / Heroic,Medium Tempo/Medium Slow/60s
456239159,Max Richter Daniel Hope Konzerthaus Kammerorchester Berlin André De Ridder,Spring 0,Recomposed By Max Richter: Vivaldi The Four Seasons,"",2014,Classical/Other Classical/General Classical,Somber/Dark Cosmic,Slow Tempo/Very Slow/20s
456239157,London Grammar,Hey Now,If You Wait,Mixed/Mixed Group,2013,Alternative a Punk/Indie Rock/Dream Pop,Excited/Euphoric Energy,Medium Tempo/Medium Fast/120s
456239156,Один в каное,Пообіцяй мені,Один в каное,"",2016,Other/Data a Other/Data a Other,"",""
456239155,Ellie Goulding,Still Falling For You,Still Falling For You [Single],Female/Female,2016,Electronica/Electronica Mainstream/Pop Electronica,Empowering/Dramatic Emotion,Slow Tempo/Slow/40s
456239154,The Pretty Reckless,Kill Me,Going To Hell [Bonus Tracks],Mixed/Mixed Group,2014,Alternative a Punk/Alternative/Alternative Rock,"",""
456239152,Abel Korzeniowski,Dance For Me Wallis,W.E. - Music From The Motion Picture,Male/Male,2012,Soundtrack/Original Film/TV Music/General Film Music,Serious/Melodramatic,Medium Tempo/Medium/80s
456239151,Christina Perri,The Lonely,Lovestrong.,Female/Female,2011,Pop/Western Pop/Adult Alternative Pop,Melancholy/Wistful / Forlorn,Slow Tempo/Slow/40s
456239150,Kanye West,Breathe In Breathe Out,The College Dropout,Male/Male Duo,2004,Urban/Western Hip-Hop/Rap/Conscious Hip-Hop/Rap,Cool/Wary / Defiant,Slow Tempo/Slow/40s
456239149,M83,Do It Try It,Junk,Mixed/Mixed Group,2016,Alternative a Punk/Indie Rock/Dream Pop,Yearning/Energetic Yearning,Medium Tempo/Medium Fast/110s
456239148,M83,Go! (Featuring Mai Lan),Junk,Mixed/Mixed Group,2016,Alternative a Punk/Indie Rock/Dream Pop,Brooding/Dreamy Brooding,Medium Tempo/Medium Slow/60s
456239147,Ingrid Michaelson,Die Alone,Girls And Boys,Female/Female,2006,Pop/Western Pop/Adult Alternative Pop,Yearning/Sensitive / Exploring,Medium Tempo/Medium Fast/110s
456239145,Whitey,People,Saturday Night Ate Our Lives,Male/Male,2012,Alternative a Punk/Indie Rock/Post-Punk Revival,Cool/Dark Groovy,Medium Tempo/Medium Fast/110s
456239144,Fool's Garden,Reason,25 Miles To Kissimmee,Male/Male Group,2004,Pop/Western Pop/Adult Alternative Pop,Brooding/Evocative / Intriguing,Medium Tempo/Medium/80s
456239143,The Kinks,Sunny Afternoon [Stereo],Face To Face [Disc 2],Male/Male Group,1966,Rock/60's Rock/British Invasion,Urgent/Dark Urgent,Medium Tempo/Medium Fast/120s
456239142,Panivalkova,Крейзі Нікіта,Панівалькова,"","",Alternative a Punk/Alternative/Alternative Rock,Energizing/Edgy / Sexy,Medium Tempo/Medium Fast/100s
456239141,Manowar,Die For Metal,Gods Of War,Male/Male Group,2007,Rock/Metal/Power Metal,Aggressive/Aggressive Power,Medium Tempo/Medium/70s
456239140,Katie Melua,If You Were A Sailboat,Pictures,Female/Female,2007,Pop/Western Pop/Adult Contemporary,Empowering/Dramatic Emotion,Slow Tempo/Slow/40s
456239139,Katie Melua,All Over The World,Secret Symphony,Female/Female,2012,Pop/Western Pop/Adult Contemporary,Sensual/Soft Soulful,Medium Tempo/Medium/60s
456239138,Egor Grushin,Essential,Once,"",2016,Classical/Other Classical/General Classical,Brooding/Dreamy Brooding,Medium Tempo/Medium/60s
456239137,Christian Education Publications,I Will Be With You,Connect - Infants B1,"",2011,Other/Children's/General Children's Music,Empowering/Dramatic Emotion,Slow Tempo/Very Slow/30s
456239136,Esthetic Education,Crucify,Werewolf,"",2007,Rock/Mainstream Rock/General Mainstream Rock,Urgent/Energetic Anxious,Medium Tempo/Medium Fast/90s
456239135,Egor Grushin,Kaisermarsch,Dominicano,"",2015,Alternative a Punk/Alternative/Alternative Rock,Melancholy/Wistful / Forlorn,Medium Tempo/Medium Slow/60s
456239134,Egor Grushin,Beginning,Dominicano,"",2015,Alternative a Punk/Alternative/Alternative Rock,Melancholy/Light Melancholy,Medium Tempo/Medium/60s
456239133,KRUT,I Wanna Fly,Arche,"",2016,Jazz/Bebop a Modern Jazz/Modern Jazz,"",""
456239132,Визбор V.S. Хутас,Мюнхгаузен,Земляника,"",2015,Pop/Western Pop/Pop Vocal,Cool/Dark Groovy,Medium Tempo/Medium/80s
456239131,Red Hot Chili Peppers,The Getaway,The Getaway,Male/Male Group,2016,Alternative a Punk/Alternative/Alternative Rock,Yearning/Sensitive / Exploring,Medium Tempo/Medium Fast/110s
456239130,Zee Avi,Honey Bee,Zee Avi,Female/Female,2009,Alternative a Punk/Indie Rock/Indie Pop,Sentimental/Tender / Sincere,Medium Tempo/Medium/80s
456239128,Stateless,Bloodstream,Stateless,Male/Male Group,2007,Alternative a Punk/Indie Rock/Post-Modern Art Music,Sensual/Intimate,Medium Tempo/Medium/70s
456239125,Neele Ternes,Dad (#heimkommen),Dad,Female/Female,2015,Pop/Western Pop/Adult Alternative Pop,Empowering/Dramatic Emotion,Slow Tempo/Very Slow/30s
456239124,Red Hot Chili Peppers,Johnny Kick A Hole In The Sky,Mother's Milk,Male/Male Group,1989,Alternative a Punk/Alternative/Funk Metal,Excited/Loud Celebratory,Medium Tempo/Medium Fast/120s
456239122,Kadebostany,Walking With A Ghost,Pop Collection,Mixed/Mixed Group,2013,Alternative a Punk/Indie Rock/Indie Pop,Sophisticated/Smoky / Romantic,Medium Tempo/Medium Slow/60s
456239121,Mychael Danna,Delhi.com,Monsoon Wedding,Male/Male,2002,Soundtrack/Original Film/TV Music/General Film Music,Energizing/Abstract Beat,Fast Tempo/Fast/150s
456239119,Snow Patrol,The Weight Of Love,Fallen Empires,Male/Male Group,2011,Alternative a Punk/Brit Rock/Brit Rock,Brooding/Alienated / Brooding,Medium Tempo/Medium Fast/120s
456239118,Jamie-Lee Kriewitz,Ghost,Ghost,Female/Female,2016,Pop/Western Pop/Pop Vocal,Urgent/Dark Pop Intensity,Fast Tempo/Fast/160s
456239117,Rich Aucoin,Brian Wilson Is A.L.i.V.E. (All Living Instantly Vanquish Everything),We're All Dying To Live (Public Publication EP/Over The Top LP),Male/Male,2011,Alternative a Punk/Indie Rock/Indie Pop,Urgent/Dark Pop,Medium Tempo/Medium Fast/120s
456239116,f(x),좋아해도 되나요 (...Is It OK?),Hot Summer,Female/Female Group,2011,Pop/Korean Pop/K-Pop,Yearning/Energetic Yearning,Medium Tempo/Medium Fast/120s
456239114,Low Roar,I'Ll Keep Coming,0,Male/Male Group,2014,Alternative a Punk/Indie Rock/Post-Modern Art Music,Brooding/Dreamy Brooding,Medium Tempo/Medium/70s
456239113,Theatre Of Tragedy,City Of Light,Musique,Mixed/Mixed Group,2000,Rock/Metal/Gothic Metal,Defiant/Heavy Brooding,Fast Tempo/Fast/140s
456239111,The Puppini Sisters,Wuthering Heights,Betcha Bottom Dollar,Female/Female Group,2006,Jazz/Jazz Vocals/Jazz Vocals,Sophisticated/Suave / Sultry,Medium Tempo/Medium Slow/60s
456239110,Material,Life Vest,Everything I Want To Say,Male/Male Group,2013,Alternative a Punk/Indie Rock/No Wave,Defiant/Heavy Brooding,Medium Tempo/Medium/80s
456239109,Nerina Pallot,Someday Soon,Dear Frustrated Superstar,Female/Female,2001,Pop/Western Pop/Adult Alternative Pop,Empowering/Dramatic Emotion,Slow Tempo/Very Slow/30s
456239108,Florence + The Machine,Seven Devils,Ceremonials,Mixed/Mixed Group,2011,Alternative a Punk/Alternative/Alternative Singer-Songwriter,Defiant/Heavy Brooding,Medium Tempo/Medium Slow/50s
456239107,Florence + The Machine,What The Water Gave Me,Ceremonials,Mixed/Mixed Group,2011,Alternative a Punk/Alternative/Alternative Singer-Songwriter,Brooding/Dreamy Brooding,Medium Tempo/Medium Slow/60s
456239106,Florence + The Machine,You've Got The Love,Lungs,Mixed/Mixed Group,2009,Alternative a Punk/Alternative/Alternative Singer-Songwriter,Empowering/Powerful / Heroic,Medium Tempo/Medium Fast/110s
456239105,Lynyrd Skynyrd,Free Bird,(Pronounced 'Lĕh-'nérd 'Skin-'nérd),Male/Male Group,1973,Rock/70's Rock/Southern Rock,Excited/Loud Celebratory,Fast Tempo/Fast/150s
456239104,KC a The Sunshine Band,Get Down Tonight,The Best Of KC a The Sunshine Band,Male/Male Group,1990,Electronica/Disco/Disco,Cool/Dark Groovy,Medium Tempo/Medium Fast/110s
456239103,Yann Tiersen,Summer 78,Good Bye Lenin!,Male/Male,2003,Soundtrack/Original Film/TV Music/General Film Music,Brooding/Dreamy Brooding,Medium Tempo/Medium Slow/50s
456239102,1st BLOOD',Live Like Legends,Live Like Legends,"",2014,Urban/Western Hip-Hop/Rap/General Hip-Hop/Rap,Cool/Wary / Defiant,Slow Tempo/Slow/40s
456239101,Alina Orlova,"Голуби (OST ""Он-Дракон"")","Голуби (OST ""Он-Дракон"")",Female/Female,2015,"","",""
456239100,Hailee Steinfeld,Rock Bottom,Haiz,Mixed/Mixed Group,2016,Pop/Western Pop/Adult Alternative Pop,"",""
456239099,Various Artists,Is It Too Late Featuring Lena Belgart [Classic Piano Mix],Airport Lounge Vol. 2,"",2014,Electronica/Downtempo Lounge a Ambient/Ambient Electronica,Romantic/Dramatic / Romantic,Medium Tempo/Medium Slow/50s
456239098,Francesca Michielin,Nessun Grado Di Separazione,Di20are,Female/Female,2016,Pop/European Pop/Mediterranean Pop,Yearning/Energetic Yearning,Medium Tempo/Medium/70s
456239097,Michal Szpak,Color Of Your Life,Byle Byc Soba,Male/Male,2015,Pop/European Pop/Euro Pop,Sophisticated/Smoky / Romantic,Slow Tempo/Slow/40s
456239095,Bible - Old Testament,Isaiah 43:16-21 Miracles Of The New Exodus,The Faith Makers IV: Isaiah [Disc 2],"",2000,Other/Spoken Word/General Spoken Word,Other,Slow Tempo/Static/0
456239094,Halsey,Control,Badlands [Deluxe],Female/Female,2015,Electronica/Electronica Mainstream/Pop Electronica,Melancholy/Sad / Soulful,Medium Tempo/Medium Slow/60s
456239093,Diana Vickers,The Boy Who Murdered Love,Songs From The Tainted Cherry Tree,Female/Female,2010,Pop/Western Pop/Adult Alternative Pop,Brooding/Dreamy Brooding,Medium Tempo/Medium Slow/60s
456239091,Coldplay,Square One,XaY,Male/Male Group,2005,Alternative a Punk/Brit Rock/Brit Rock,Brooding/Dreamy Brooding,Medium Tempo/Medium/80s
456239089,Lemâitre Feat. Jennie A.,Closer,Closer,Mixed/Mixed Group,2015,Alternative a Punk/Synth Pop/Synth Pop,Excited/Euphoric Energy,Fast Tempo/Very Fast/180s
456239087,Duke Dumont,Ocean Drive,Ocean Drive,Male/Male,2015,Electronica/House/Deep House,Energizing/Edgy / Sexy,Medium Tempo/Medium Fast/110s
456239086,Rafferty,Apple Pie,Apple Pie [Single],"",2016,Pop/Western Pop/Pop Vocal,Aggressive/Dark Hard Beat,Medium Tempo/Medium Fast/110s
456239082,Stanislav Artemyev,Time,Creatio,"",2015,Alternative a Punk/Alternative/Alternative Rock,Tender/Romantic / Lyrical,Medium Tempo/Medium/70s
456239080,Yann Tiersen,La Valse D'amélie (Orchestra),Amélie,Male/Male,"",Soundtrack/Original Film/TV Music/General Film Music,"",""
456239078,Soundtrack Full House,Love At The Gate (Instrumental),Soundtrack Full House,"","",Soundtrack/Original Film/TV Music/General Film Music,"",""
456239075,Woodkid,The Deer,I Love You [Single],Male/Male,2013,Alternative a Punk/Indie Rock/Indie Pop,Serious/Thrilling,Medium Tempo/Medium Fast/120s
456239074,Rihanna,Towards The Sun,"Towards The Sun (From The ""Home"" Soundtrack)",Female/Female,2015,Urban/Contemporary RaB/Soul/Urban Crossover,Brooding/Dreamy Brooding,Medium Tempo/Medium/80s
456239072,Wolfgang Amadeus Mozart,Lacrimosa,1000 Años De Musica Sacra - Vol 4,Male/Male,2003,Classical/Classical Era/Classical Era Instrumental,Somber/Solemn / Spiritual,Slow Tempo/Very Slow/20s
456239071,Sneaker Pimps,Low Place Like Home,Becoming X,Mixed/Mixed Group,1997,Electronica/Downtempo Lounge a Ambient/Trip Hop,Energizing/Edgy / Sexy,Medium Tempo/Medium/80s
456239070,New Order,Elegia,Low-Life,Mixed/Mixed Group,1985,Alternative a Punk/Synth Pop/Synth Pop,Peaceful/Pastoral / Serene,Medium Tempo/Medium Slow/50s
456239068,8mm,Angel,Songs To Love And Die By...,Mixed/Mixed Group,2006,Electronica/Downtempo Lounge a Ambient/Neo-Lounge,Urgent/Dark Pop Intensity,Fast Tempo/Fast/160s
456239067,Rob Dougan,There's Only Me,Furious Angels,Male/Male,2002,Electronica/Dance a Club/Club Dance,Brooding/Alienated / Brooding,Medium Tempo/Medium Fast/100s
456239066,Альфред Шнитке,"Вальс-раздолье (из к/ф ""Сказка странствий"" 1983)",Сказка странствий,"",2004,Soundtrack/Original Film/TV Music/General Film Music,"",""
