id,artist,title,album_title,artist_type,album_year,genre,mood,tempo
456239032,Various Artists,Cold,The Twilight Saga: Breaking Dawn Part 1,Mixed/Mixed Duo,2011,Alternative a Punk/Brit Rock/Brit Rock,Melancholy/Wistful / Forlorn,Slow Tempo/Slow/40s
364962242,Океан Ельзи,Друг ч.1,Модель,Male/Male Group,2014,Rock/Mainstream Rock/General Mainstream Rock,Melancholy/Wistful / Forlorn,Slow Tempo/Slow/40s
353273145,David Nevue,Overcome,Overcome,Male/Male,2005,Other/New Age/New Acoustic,Melancholy/Wistful / Forlorn,Medium Tempo/Medium/70s
201835904,Ashram,Maria and the Violin's String,Shining Silver Skies,Male/Male Group,2006,Other/New Age/New Acoustic,Melancholy/Wistful / Forlorn,Medium Tempo/Medium/70s
166221447,Evanescence,My Immortal,Fallen,Mixed/Mixed Group,2003,Rock/Metal/Gothic Metal,Melancholy/Wistful / Forlorn,Slow Tempo/Slow/40s
84504561,Carter Burwell,Phascination Phase,Twilight: The Score,Male/Male,2008,Soundtrack/Original Film/TV Music/General Film Music,Melancholy/Wistful / Forlorn,Slow Tempo/Very Slow/30s
84431484,Carter Burwell,The Lion Fell In Love With The Lamb,Twilight [The Score],Male/Male,2008,Soundtrack/Original Film/TV Music/General Film Music,Melancholy/Wistful / Forlorn,Medium Tempo/Medium Slow/60s
82359339,Hana Pestle,Need,This Way,"",2009,Pop/Western Pop/Pop Vocal,Melancholy/Wistful / Forlorn,Slow Tempo/Slow/40s
