id,artist,title,album_title,artist_type,album_year,genre,mood,tempo
456239140,Apocalyptica,Sacra,7th Symphony,Male/Male Group,2010,Rock/Metal/Progressive Metal,Somber/Enigmatic / Mysterious,Medium Tempo/Medium/60s
289931850,John Ottman,Hope (Xavier's Theme),X-Men: Days of Future Past (Original Motion Picture Soundtrack),Male/Male,2014,Soundtrack/Original Film/TV Music/General Film Music,Somber/Enigmatic / Mysterious,Medium Tempo/Medium/60s
181015535,Tykwer Klimek a Heil,Cloud Atlas Opening Title,Cloud Atlas,Male/Male,2012,Soundtrack/Original Film/TV Music/General Film Music,Somber/Enigmatic / Mysterious,Medium Tempo/Medium/70s
180258156,Tykwer Klimek a Heil,Cloud Atlas Opening Title,Cloud Atlas,Male/Male,2012,Soundtrack/Original Film/TV Music/General Film Music,Somber/Enigmatic / Mysterious,Medium Tempo/Medium/70s
84504502,Carter Burwell,I Know What You Are,Twilight: The Score,Male/Male,2008,Soundtrack/Original Film/TV Music/General Film Music,Somber/Enigmatic / Mysterious,Medium Tempo/Medium/60s
