id,artist,title,album_title,artist_type,album_year,genre,mood,tempo
456239134,Echo a The Bunnymen,Lost On You,What Are You Going To Do With Your Life?,Male/Male Group,1999,Alternative a Punk/Indie Rock/Original Post-Punk,Empowering/Powerful / Heroic,Medium Tempo/Medium Slow/60s
456239119,Grace Feat. G-Eazy,You Don't Own Me,You Don't Own Me [Single],Mixed/Mixed Duo,2015,Pop/Western Pop/Urban Crossover: Pop,Cool/Wary / Defiant,Medium Tempo/Medium Slow/60s
456239113,Justin Timberlake,Can't Stop The Feeling!,Can't Stop The Feeling! [Single],Male/Male,2016,Pop/Western Pop/Urban Crossover: Pop,Cool/Casual Groove,Medium Tempo/Medium Slow/50s
456239112,Toto Cutugno,L'Italiano,L'italiano,Male/Male,1983,Pop/European Pop/Mediterranean Pop,Brooding/Evocative / Intriguing,Medium Tempo/Medium Slow/60s
456239092,Muse,Undisclosed Desires,The Resistance,Male/Male Group,2009,Alternative a Punk/Alternative/Alternative Rock,Sensual/Intimate,Medium Tempo/Medium Slow/50s
456239069,Jason Mraz,Plane,Mr. A-Z,Male/Male,2005,Pop/Western Pop/Adult Alternative Pop,Sophisticated/Smoky / Romantic,Medium Tempo/Medium Slow/60s
456239053,Oh Wonder,All We Do,Oh Wonder,Mixed/Mixed Duo,2015,Alternative a Punk/Synth Pop/Synth Pop,Melancholy/Wistful / Forlorn,Medium Tempo/Medium Slow/60s
456239036,Alex Clare,Too Close,The Lateness Of The Hour,Male/Male,2012,Electronica/Electronica Mainstream/Pop Electronica,Brooding/Dreamy Brooding,Medium Tempo/Medium Slow/60s
456239033,Imany,Kisses In The Dark,The Shape Of A Broken Heart,Female/Female,2011,Alternative a Punk/Alternative/Alternative Singer-Songwriter,Gritty/Sober / Determined,Medium Tempo/Medium Slow/50s
456239019,ortoPilot,Moon River (originally by Andy Williams),Covers Album Vol. 6,"",2011,Pop/Western Pop/Pop Vocal,Gritty/Sober / Determined,Medium Tempo/Medium Slow/50s
441529823,Kansas,Dust In The Wind,Point Of Know Return,Male/Male Group,1977,Rock/70's Rock/Classic Rock,Melancholy/Wistful / Forlorn,Medium Tempo/Medium Slow/60s
441489560,Сергей Трофимов,Боже какой пустяк,Ветер в голове,Male/Male,2004,Pop/European Pop/Eastern European Pop,Brooding/Evocative / Intriguing,Medium Tempo/Medium Slow/60s
438721862,The Jimi Hendrix Experience,All Along The Watchtower (Recorded Live At Isle Of Wight England),Box Set 8 Song Sampler,Male/Male Group,0,Rock/60's Rock/Acid Rock,Defiant/Heavy Brooding,Medium Tempo/Medium Slow/50s
436213775,Stereophonics,I Miss You Now,You Gotta Go There To Come Back,Male/Male Group,2003,Alternative a Punk/Brit Rock/Brit Rock,Melancholy/Sad / Soulful,Medium Tempo/Medium Slow/50s
431432446,Макс Барских,По Фрейду,По Фрейду,Male/Male,2014,Pop/European Pop/Eastern European Pop,Sophisticated/Smoky / Romantic,Medium Tempo/Medium Slow/60s
427598415,The Heavy,Short Change Hero,The House That Dirt Built,Male/Male Group,2009,Alternative a Punk/Garage Rock Revival/Garage Rock Revival,Brooding/Dreamy Brooding,Medium Tempo/Medium Slow/50s
427595956,Harmaja,Hauras,Lento,"",2010,Rock/Mainstream Rock/General Mainstream Rock,Melancholy/Wistful / Forlorn,Medium Tempo/Medium Slow/50s
419044044,Nirvana,The Man Who Sold The World,MTV Unplugged In New York,Male/Male Group,1994,Alternative a Punk/Alternative/Grunge,Brooding/Evocative / Intriguing,Medium Tempo/Medium Slow/50s
415976421,Imany,Slow Down,The Shape Of A Broken Heart,Female/Female,2011,Alternative a Punk/Alternative/Alternative Singer-Songwriter,Melancholy/Wistful / Forlorn,Medium Tempo/Medium Slow/50s
424599474,Various Artists,Erann DD,Now 7,"",2004,Pop/Western Pop/Pop Vocal,Sensual/Intimate,Medium Tempo/Medium Slow/50s
409469993,Гуша Катушкин a Мария Чайковская,Чекай,КРАСОТА13,"",2014,Pop/Western Pop/Pop Vocal,Sophisticated/Suave / Sultry,Medium Tempo/Medium Slow/50s
409388804,Марія Бурмака,Верни до мене пам'яте моя,Марія,"",2015,Pop/Western Pop/Pop Vocal,Romantic/Lush / Romantic,Medium Tempo/Medium Slow/50s
409375411,Acoustic Hits,Dangerous (Acoustic Version) [David Guetta Cover],Acoustified Hits Vol. 11,"",2016,Pop/Western Pop/Pop Vocal,Sophisticated/Smoky / Romantic,Medium Tempo/Medium Slow/60s
408956416,Helloween,The Smile Of The Sun,7 Sinners,Male/Male Group,2010,Rock/Metal/Power Metal,Brooding/Energetic Melancholy,Medium Tempo/Medium Slow/50s
403591658,John Lennon,Imagine,Imagine,Male/Male,1971,Pop/Western Pop/Singer-Songwriter,Sentimental/Tender / Sincere,Medium Tempo/Medium Slow/60s
403106090,Bahroma,Надолго,Внутри,Male/Male Group,2014,Rock/Mainstream Rock/General Mainstream Rock,Gritty/Sober / Determined,Medium Tempo/Medium Slow/50s
402919542,Harel Skaat,Milim - Eurovision edit,Milim (Promo),Male/Male,0,Pop/Middle East Pop/Israeli Pop,Romantic/Heartfelt Passion,Medium Tempo/Medium Slow/50s
397664375,Lana Del Rey,West Coast,Ultraviolence,Female/Female,2014,Electronica/Electronica Mainstream/Pop Electronica,Yearning/Energetic Yearning,Medium Tempo/Medium Slow/60s
396157982,Alexandre Desplat,The Imitation Game,The Imitation Game: Original Motion Picture Soundtrack,Male/Male,2014,Soundtrack/Original Film/TV Music/General Film Music,Romantic/Dramatic / Romantic,Medium Tempo/Medium Slow/50s
396157959,Alexandre Desplat,The Imitation Game,The Imitation Game: Original Motion Picture Soundtrack,Male/Male,2014,Soundtrack/Original Film/TV Music/General Film Music,Romantic/Dramatic / Romantic,Medium Tempo/Medium Slow/50s
391778462,Николай Караченцов,Ты Меня На Рассвете Разбудишь,Что Тебе Подарить?,Male/Male,2008,"",Melancholy/Sad / Soulful,Medium Tempo/Medium Slow/60s
384910856,Eels,Flyswatter,Daisies Of The Galaxy,Male/Male Group,2000,Alternative a Punk/Indie Rock/General Indie Rock,Cool/Wary / Defiant,Medium Tempo/Medium Slow/60s
383019610,a-ha,Summer Moved On,Minor Earth Major Sky,Male/Male Group,2000,Alternative a Punk/New Wave Pop/New Wave Pop,Romantic/Heartfelt Passion,Medium Tempo/Medium Slow/60s
376543831,James Gruntz,Dark Side of the Moon,Belvedere,Male/Male,2014,Pop/Western Pop/Adult Alternative Pop,Romantic/Sweet / Sincere,Medium Tempo/Medium Slow/50s
376541780,Il Carlo,Because (The Supremes Cover),How Lonesome Can I Be,"",2001,Alternative a Punk/Punk/General Punk,Sophisticated/Smoky / Romantic,Medium Tempo/Medium Slow/60s
375643616,Gotye,Heart's A Mess,Like Drawing Blood,Male/Male,2006,Alternative a Punk/Alternative/Alternative Singer-Songwriter,Gritty/Gritty / Soulful,Medium Tempo/Medium Slow/60s
375516605,Mike Oldfield,Evacuation (Remastered 2015 / Single Edit / Bonus Track),The Killing Fields (Original Motion Picture Soundtrack / Remastered 2015),Male/Male,2016,Rock/70's Rock/Classic Prog,Sensual/Dreamy Pulse,Medium Tempo/Medium Slow/50s
370696507,Hurts,Somebody To Die For,Exile,Male/Male Duo,2013,Pop/Western Pop/Adult Alternative Pop,Empowering/Dramatic Emotion,Medium Tempo/Medium Slow/60s
368670526,Chris Rea,Looking For The Summer,Auberge,Male/Male,1991,Pop/Western Pop/Singer-Songwriter,Sensual/Sensual Groove,Medium Tempo/Medium Slow/60s
366416044,2CELLOS,Californication,In2ition,Male/Male Duo,2012,Classical/Classical Crossover/Classical Crossover Instrumental,Melancholy/Wistful / Forlorn,Medium Tempo/Medium Slow/60s
360088085,Foster The People,Pumped Up Kicks,Torches,Male/Male Group,2011,Alternative a Punk/Indie Rock/Indie Pop,Yearning/Sensitive / Exploring,Medium Tempo/Medium Slow/60s
355364806,Various Artists,Где Ты,Сборник Русской Музыки,"",2005,Pop/Western Pop/Pop Vocal,Energizing/Edgy / Sexy,Medium Tempo/Medium Slow/60s
352413067,The Maneken,Keep Moving On,Keep Moving On,Male/Male,2014,Alternative a Punk/Indie Rock/Indie Pop,Sensual/Dreamy Pulse,Medium Tempo/Medium Slow/50s
350855724,Скрябін,А пам'ятаєш (Місця щасливих людей) [FDR a CJ Mars Edit],Еволюція,Male/Male Group,2015,Rock/Mainstream Rock/General Mainstream Rock,Yearning/Energetic Yearning,Medium Tempo/Medium Slow/60s
350814483,Тарас Чубай Скрябін,Пливе кача,Наші партизани,"",2000,Rock/Mainstream Rock/General Mainstream Rock,Gritty/Sober / Determined,Medium Tempo/Medium Slow/60s
349970131,Николай Носков,Снег,Золотые хиты,Male/Male,2016,Rock/Mainstream Rock/General Mainstream Rock,Sentimental/Lyrical Sentimental,Medium Tempo/Medium Slow/60s
346988498,Axel Rudi Pell,Long Way to Go,Into The Storm,Male/Male,2014,Rock/Metal/Power Metal,Defiant/Heavy Brooding,Medium Tempo/Medium Slow/60s
346752575,Of Monsters And Men,Dirty Paws,My Head Is An Animal,Mixed/Mixed Group,2012,Alternative a Punk/Alternative Folk/Alternative Folk,Brooding/Dreamy Brooding,Medium Tempo/Medium Slow/50s
346365471,ONUKA,Look,Look,Female/Female,2014,"",Sensual/Dreamy Pulse,Medium Tempo/Medium Slow/50s
345596309,Árstíðir,Ro,Hvel,"",2015,Pop/Western Pop/Pop Vocal,Melancholy/Wistful / Forlorn,Medium Tempo/Medium Slow/60s
341245860,Metric,Help I'm Alive (Acoustic),Fantasies,Mixed/Mixed Group,2010,Alternative a Punk/Indie Rock/Post-Punk Revival,Melancholy/Sad / Soulful,Medium Tempo/Medium Slow/50s
340916149,Скрябін,Добряк,Добряк,Male/Male Group,2013,Rock/Mainstream Rock/General Mainstream Rock,Romantic/Heartfelt Passion,Medium Tempo/Medium Slow/50s
338647647,Red Hot Chili Peppers,The Adventures Of Rain Dance Maggie,I'm With You,Male/Male Group,2011,Alternative a Punk/Alternative/Alternative Rock,Cool/Wary / Defiant,Medium Tempo/Medium Slow/50s
337400375,Alexandre Desplat,Alone With Numbers,The Imitation Game: Original Motion Picture Soundtrack,Male/Male,2014,Soundtrack/Original Film/TV Music/General Film Music,Peaceful/Quiet / Introspective,Medium Tempo/Medium Slow/50s
336870434,Maroon 5,Animals,V,Male/Male Group,2014,Pop/Western Pop/Adult Alternative Pop,Cool/Wary / Defiant,Medium Tempo/Medium Slow/60s
336289486,Ray Band,Крила,Старик и море,"",2016,Rock/Mainstream Rock/General Mainstream Rock,Romantic/Heartfelt Passion,Medium Tempo/Medium Slow/50s
334181959,Валерий Меладзе,Чуть Ниже Небес,Вопреки,Male/Male,2008,Pop/European Pop/Eastern European Pop,Romantic/Heartfelt Passion,Medium Tempo/Medium Slow/50s
334176234,The Grapes Of Wrath,Good to See You,High Road,Male/Male Group,2013,Alternative a Punk/Indie Rock/Jangle Pop,Brooding/Dreamy Brooding,Medium Tempo/Medium Slow/60s
334022535,Champagne Morning,Your Day,Your Day [Single],"",2011,Pop/Western Pop/Teen Pop,Romantic/Heartfelt Passion,Medium Tempo/Medium Slow/50s
332466702,Massive Attack,Angel,Mezzanine,Mixed/Mixed Group,1998,Electronica/Downtempo Lounge a Ambient/Trip Hop,Sensual/Dreamy Pulse,Medium Tempo/Medium Slow/50s
332349707,Fleet Foxes,White Winter Hymnal,Fleet Foxes,Male/Male Group,2008,Alternative a Punk/Alternative Folk/Alternative Folk,Brooding/Dreamy Brooding,Medium Tempo/Medium Slow/60s
330592210,For My Pain...,Bed of Dead Leaves,Fallen,Male/Male Group,2012,Rock/Metal/Gothic Metal,Defiant/Heavy Brooding,Medium Tempo/Medium Slow/60s
330582385,Sleeping With Sirens,http://www.youtube.com/watch?v=tgMzriO93-Y,With Ears To See And Eyes To Hear,Male/Male Group,2010,Alternative a Punk/Emo a Hardcore/Hardcore,Somber/Enigmatic / Mysterious,Medium Tempo/Medium Slow/60s
330581128,Julien Doré,Chou Wasabi,Løve,Mixed/Mixed Duo,2013,Pop/European Pop/French Pop,Sensual/Soft Soulful,Medium Tempo/Medium Slow/60s
330569711,Joe Cocker,Unforgiven,One Night of Sin,Male/Male,1989,Rock/70's Rock/Classic Pop-Rock,Romantic/Sweet / Sincere,Medium Tempo/Medium Slow/60s
330564249,Yodelice,More Than Meets The Eye,Cardioid,Male/Male,2010,Alternative a Punk/Alternative/Alternative Singer-Songwriter,Cool/Wary / Defiant,Medium Tempo/Medium Slow/50s
328475425,The Neighbourhood,Honest,Honest,Mixed/Mixed Group,2014,Urban/Classic RaB/Soul/Funk,Somber/Enigmatic / Mysterious,Medium Tempo/Medium Slow/60s
328096754,Latimore,You've Still Got The Touch,You're Welcome To Ride,Male/Male,2000,Urban/Classic RaB/Soul/Deep Soul,Romantic/Sweet / Sincere,Medium Tempo/Medium Slow/50s
324623243,Reflexion,Child in Dark,Out of the Dark,"",2006,Alternative a Punk/Alternative/Alternative Rock,Brooding/Evocative / Intriguing,Medium Tempo/Medium Slow/50s
324232489,Vivienne Mort,Сліди маленьких рук,Театр Pipinó,"",2014,Pop/Western Pop/Pop Vocal,Sophisticated/Smoky / Romantic,Medium Tempo/Medium Slow/60s
323739017,Валентин Стрыкало,Дешёвые драмы,Смирись и расслабься,Male/Male Group,2012,Rock/Mainstream Rock/General Mainstream Rock,Gritty/Sober / Determined,Medium Tempo/Medium Slow/50s
323731929,Сергей Трофимов,Я Теперь Буду Верен тебе (Посвящается Супруге),Следующая Остановка,Male/Male,2007,Pop/European Pop/Eastern European Pop,Sophisticated/Smoky / Romantic,Medium Tempo/Medium Slow/60s
323508824,Ghost a Gale,Rosemary,Ghost a Gale - EP,"",2013,Traditional/Folk/Traditional U.S. Folk,Sentimental/Tender / Sincere,Medium Tempo/Medium Slow/50s
322804740,Nightwish,"While Your Lips Are Still Red (Theme From The Movie ""Lieksa!"")",Made In Hong Kong (And In Various Other Places) [Live],Mixed/Mixed Group,2009,Rock/Metal/Progressive Metal,Brooding/Dreamy Brooding,Medium Tempo/Medium Slow/50s
319682976,Secret Garden,Passacaglia,White Stones,Mixed/Mixed Duo,1997,Classical/Classical Crossover/Classical Crossover Instrumental,Romantic/Dramatic / Romantic,Medium Tempo/Medium Slow/60s
319189147,The Beatles,And I Love Her,A Hard Day's Night,Male/Male Group,1964,Rock/60's Rock/British Invasion,Brooding/Evocative / Intriguing,Medium Tempo/Medium Slow/50s
318216034,SoulRelic,The Rain Of Sorrow,Love Is A Lie We Both Believed,"",2005,Rock/Metal/Heavy Metal,Brooding/Evocative / Intriguing,Medium Tempo/Medium Slow/60s
318216025,SoulRelic,Still Breathing,Love Is A Lie We Both Believed,"",2005,Rock/Metal/Heavy Metal,Brooding/Energetic Melancholy,Medium Tempo/Medium Slow/60s
318213433,Sinamore,Darkness Of Day,A New Day,"",2012,Rock/Metal/Heavy Metal,Brooding/Dreamy Brooding,Medium Tempo/Medium Slow/60s
313991810,Eels,I Need Some Sleep,Meet The Eels: Essential Eels Vol. 1 1996-2006,Male/Male Group,2008,Alternative a Punk/Indie Rock/General Indie Rock,Melancholy/Wistful / Forlorn,Medium Tempo/Medium Slow/60s
313684527,KT Tunstall,Saving My Face,Drastic Fantastic,Female/Female,2007,Pop/Western Pop/Adult Alternative Pop,Brooding/Dreamy Brooding,Medium Tempo/Medium Slow/60s
312985382,James Blunt,When I Find Love Again,Moon Landing,Male/Male,2013,Pop/Western Pop/Adult Alternative Pop,Empowering/Dramatic Emotion,Medium Tempo/Medium Slow/50s
312789289,Gotthard,Lonely People,Homerun,Male/Male Group,2001,Rock/Mainstream Rock/General Mainstream Rock,Empowering/Strong / Stable,Medium Tempo/Medium Slow/50s
311876585,Bee Gees,How Deep Is Your Love,One Night Only [Live],Male/Male Group,1998,Pop/Western Pop/Adult Contemporary,Romantic/Heartfelt Passion,Medium Tempo/Medium Slow/50s
303148693,Richie Kotzen,Fantasy,Get Up [Bonus Track],Male/Male,2004,Rock/Metal/Progressive Metal,Defiant/Heavy Brooding,Medium Tempo/Medium Slow/60s
300377288,Scorpions,Still Loving You,Love At First Sting,Male/Male Group,1984,Rock/Hard Rock/General Hard Rock,Brooding/Evocative / Intriguing,Medium Tempo/Medium Slow/50s
300347520,Александр Иванов,Боже Какой Пустяк,Звездная Серия,Male/Male,2001,"",Sensual/Sensual Groove,Medium Tempo/Medium Slow/60s
295954316,Miguel Bosé,Decirnos Adiós,Papitwo [Disc 1],Mixed/Mixed Duo,2012,Other/Latin Pop/General Latin Pop,Gritty/Strumming Yearning,Medium Tempo/Medium Slow/60s
295818352,Eicca Toppinen,Love Song,Music For The Movie Black Ice,"",2007,Pop/Western Pop/Pop Vocal,Peaceful/Pastoral / Serene,Medium Tempo/Medium Slow/60s
295818328,Eicca Toppinen,Alone In The Dark,Music For The Movie Black Ice,"",2007,Pop/Western Pop/Pop Vocal,Brooding/Dreamy Brooding,Medium Tempo/Medium Slow/50s
295574529,R.E.M.,Losing My Religion,Out Of Time,Male/Male Group,1991,Rock/Adult Alternative Rock/Adult Alternative Rock,Gritty/Strumming Yearning,Medium Tempo/Medium Slow/60s
288655821,Edguy,Superheroes(Epic Version),Superheroes,Male/Male Group,2005,Rock/Metal/Power Metal,Melancholy/Wistful / Forlorn,Medium Tempo/Medium Slow/60s
279921084,Гарик Сукачев,"Гибель ""Курска""",Poetica,Male/Male,2003,Pop/European Pop/Eastern European Pop,Gritty/Strumming Yearning,Medium Tempo/Medium Slow/60s
279920248,Sad Alice Said,Open Your Eyes,Open Your Eyes (Single),"",2011,Rock/Metal/Heavy Metal,Brooding/Dreamy Brooding,Medium Tempo/Medium Slow/60s
279920170,"Львівський Естрадний Театр-Студія ""Не Журись""",Ой У Лузі Червона Калина,Повіяв Вітер Степовий,"",1990,Traditional/Folk/Traditional U.S. Folk,Melancholy/Sad / Soulful,Medium Tempo/Medium Slow/50s
276457990,Sting,Heavy Cloud No Rain [Live at Irving Plaza 2011 Remix],The Best Of 25 Years,Male/Male,2011,Pop/Western Pop/Adult Contemporary,Cool/Casual Groove,Medium Tempo/Medium Slow/50s
273994506,Nightwish,Eva,Dark Passion Play,Mixed/Mixed Group,2007,Rock/Metal/Progressive Metal,Romantic/Dramatic / Romantic,Medium Tempo/Medium Slow/50s
272830122,Paul Mauriat,Pardonne-Moi Ce Caprice D'enfant,Reflection [Disc 3],Male/Male,1997,Pop/Easy Listening/Other Easy Listening,Brooding/Evocative / Intriguing,Medium Tempo/Medium Slow/60s
272098450,Scorpions,Still Loving You,Love At First Sting,Male/Male Group,1984,Rock/Hard Rock/General Hard Rock,Brooding/Evocative / Intriguing,Medium Tempo/Medium Slow/50s
272091771,Various Artists,Smells Like Teen Spirit (Nirvana) (cover),Shut Up Kitty,"",1993,Alternative a Punk/Industrial/Industrial,Defiant/Attitude / Defiant,Medium Tempo/Medium Slow/50s
270819131,Друга Рiка,Try hvylyny (Три хвилини),Rekordy (Рекорди),Male/Male Group,2005,Rock/Mainstream Rock/General Mainstream Rock,Sentimental/Tender / Sincere,Medium Tempo/Medium Slow/50s
269661765,City And Colour,Comin' Home,Sometimes,Male/Male,2005,Alternative a Punk/Emo a Hardcore/Emo,Sophisticated/Smoky / Romantic,Medium Tempo/Medium Slow/60s
269659061,Caprice,A red red rose,Sister simplicity,"",2004,Classical/Other Classical/General Classical,Empowering/Dramatic Emotion,Medium Tempo/Medium Slow/60s
266279494,Nocturnal Rites,Me,The 8th Sin,Male/Male Group,2012,Rock/Metal/Power Metal,Sophisticated/Smoky / Romantic,Medium Tempo/Medium Slow/50s
265823122,Lama,Знаєш як болить,Світло і тінь,Mixed/Mixed Group,2016,Pop/European Pop/Eastern European Pop,Yearning/Energetic Yearning,Medium Tempo/Medium Slow/60s
264618243,Heaven a Hell,Lady Evil (2007 Live At Radio City Music Hall),Live From Radio City Music Hall [Disc 1],Male/Male Group,2007,Rock/Metal/Classic British Metal,Defiant/Heavy Brooding,Medium Tempo/Medium Slow/60s
262105438,Criss Angel,Die For Me,Mindfreak,Male/Male,2006,Rock/Metal/Nu-Metal,Brooding/Dreamy Brooding,Medium Tempo/Medium Slow/50s
260768473,Jamie Lancaster,All You Need Is Love,Joyride,"",2015,Jazz/Bebop a Modern Jazz/Modern Jazz,Sensual/Soft Soulful,Medium Tempo/Medium Slow/50s
260764891,Patrick Nuo,She's Like The Wind,Welcome [Bonus Tracks],Male/Male,2004,Pop/Western Pop/Teen Pop,Empowering/Strong / Stable,Medium Tempo/Medium Slow/60s
257431970,Panic! At The Disco,There's A Good Reason These Tables Are Numbered Honey You Just Haven't Thought Of It Yet,A Fever You Can't Sweat Out,Male/Male Group,2005,Alternative a Punk/Punk/Pop Punk,Yearning/Sensitive / Exploring,Medium Tempo/Medium Slow/50s
257199859,Avantasia,The Final Sacrifice,The Metal Opera Pt. II,Male/Male Group,2002,Rock/Metal/Progressive Metal,Defiant/Heavy Brooding,Medium Tempo/Medium Slow/60s
253396916,ATB,Magnetic Girl,Distant Earth,Male/Male,2011,Electronica/Trance/Trance,Melancholy/Light Melancholy,Medium Tempo/Medium Slow/50s
252921590,Аркона,Морена,Ночь Велесова ч.2,Mixed/Mixed Group,0,Rock/Mainstream Rock/General Mainstream Rock,Defiant/Heavy Brooding,Medium Tempo/Medium Slow/60s
237085226,VETO,Duck Hush And Be Still,Crushing Digits,Male/Male Group,2008,Alternative a Punk/Indie Rock/Indie Pop,Brooding/Dreamy Brooding,Medium Tempo/Medium Slow/60s
226485909,Brainstorm,French Cartoon,Four Shores,Male/Male Group,2006,Pop/European Pop/Eastern European Pop,Melancholy/Light Melancholy,Medium Tempo/Medium Slow/60s
226484847,Би-2,Скользкие Улицы,Иномарки,Male/Male Group,2015,"",Romantic/Heartfelt Passion,Medium Tempo/Medium Slow/50s
223976831,The Veils,Lavinia,The Runaway Found,Mixed/Mixed Group,2003,Alternative a Punk/Brit Rock/Brit Rock,Brooding/Dreamy Brooding,Medium Tempo/Medium Slow/60s
219709688,Blonde Redhead,23,23,Mixed/Mixed Group,2007,Alternative a Punk/Indie Rock/Noise Pop,Brooding/Dreamy Brooding,Medium Tempo/Medium Slow/60s
219698512,Beccy Cole,Lazy Bones (Play School Theme Toot Toot Chugga Chugga Big Red Car Hot Potato Bananas In Pyjamas Round and Round The Garden Bob The Builder (Can We Fix It)),Live @ Lizottes,Female/Female,2007,Traditional/Country/General Country,Gritty/Sober / Determined,Medium Tempo/Medium Slow/50s
219518824,Мері,Лялька,Війни в прямому ефірі,"",2010,Pop/Western Pop/Pop Vocal,Empowering/Dramatic Emotion,Medium Tempo/Medium Slow/60s
217797473,David Arnold a Michael Price,Opening Titles,Sherlock: Series One,"",2012,Soundtrack/Original Film/TV Music/General Film Music,Brooding/Energetic Melancholy,Medium Tempo/Medium Slow/60s
217342617,The Third Barramundi Sampler,Quiet Light,The Third Barramundi Sampler,"",1995,Other/Data a Other/Data a Other,Sensual/Dreamy Pulse,Medium Tempo/Medium Slow/60s
217342592,James Vincent McMorrow,Follow You Down To The Red Oak Tree,Early In The Morning,Male/Male,2011,Alternative a Punk/Alternative Folk/Alternative Folk,Sentimental/Tender / Sincere,Medium Tempo/Medium Slow/50s
215444042,Валерий Ободзинский,Луна На Солнечном Берегу,Ретро Диск 1,Male/Male,2004,"",Tender/Refined / Mannered,Medium Tempo/Medium Slow/50s
212852570,Азис,Мила моя ангел мой,Азис 2005,"",2005,Traditional/Folk/Traditional U.S. Folk,Sophisticated/Smoky / Romantic,Medium Tempo/Medium Slow/50s
212780755,Suede,A Man's Song (Heroine) (Four Track Demo),Dog Man Star [Disc 1],Male/Male Group,1994,Alternative a Punk/Brit Pop/Brit Pop,Brooding/Dreamy Brooding,Medium Tempo/Medium Slow/50s
212780668,Nolwenn Korbell,News from Town for My Love Who Stayed Home,Red,"",2007,Traditional/Celtic/Celtic,Melancholy/Wistful / Forlorn,Medium Tempo/Medium Slow/60s
212780192,Josh Groban,With You,With You,Male/Male,2006,Classical/Classical Crossover/Classical Crossover Vocal,Sophisticated/Smoky / Romantic,Medium Tempo/Medium Slow/50s
212780125,Draconian,Death Come Near Me,Arcane Rain Fell,Mixed/Mixed Group,2012,Rock/Metal/Gothic Metal,Brooding/Dreamy Brooding,Medium Tempo/Medium Slow/50s
209973062,Lama,Знаєш як болить,Світло і тінь,Mixed/Mixed Group,2016,Pop/European Pop/Eastern European Pop,Yearning/Energetic Yearning,Medium Tempo/Medium Slow/60s
209384914,Various Artists,The Holy Rope In Heart,Himalayas,"",2003,Traditional/Other Traditions/General World,Sophisticated/Smoky / Romantic,Medium Tempo/Medium Slow/50s
209248100,Amanda Mair,House,Amanda Mair,Female/Female,2012,Pop/Western Pop/Adult Alternative Pop,Sophisticated/Smoky / Romantic,Medium Tempo/Medium Slow/60s
209241930,Foxes,Youth,Glorious [Deluxe Edition],Female/Female,2014,Electronica/Electronica Mainstream/Pop Electronica,Sensual/Dreamy Pulse,Medium Tempo/Medium Slow/60s
209236663,Jon Bon Jovi,It's Just Me (Live Acoustic),Janie Don't Take Your Love To Town (Single),Male/Male,1997,Rock/Hard Rock/General Hard Rock,Melancholy/Sad / Soulful,Medium Tempo/Medium Slow/50s
209176425,VETO,Duck Hush And Be Still,Crushing Digits,Male/Male Group,2008,Alternative a Punk/Indie Rock/Indie Pop,Brooding/Dreamy Brooding,Medium Tempo/Medium Slow/60s
208384225,Руслана,Я Тебе Люблю,Дикі Танці,Female/Female,2003,"",Sophisticated/Smoky / Romantic,Medium Tempo/Medium Slow/50s
207245622,Zee Avi,Poppy,Zee Avi,Female/Female,2009,Alternative a Punk/Indie Rock/Indie Pop,Yearning/Energetic Yearning,Medium Tempo/Medium Slow/50s
207245572,The Rasmus,First Day Of My Life [Acoustic Demo],In The Shadows [Single],Male/Male Group,2003,Alternative a Punk/Alternative/Alternative Rock,Sophisticated/Smoky / Romantic,Medium Tempo/Medium Slow/50s
206708955,Damien Rice,9 Crimes,9,Male/Male,2006,Alternative a Punk/Alternative/Alternative Singer-Songwriter,Sentimental/Tender / Sincere,Medium Tempo/Medium Slow/50s
206511042,Fallulah,Give Us A Little Love,The Black Cat Neighbourhood,Female/Female,2010,Alternative a Punk/Indie Rock/General Indie Rock,Sophisticated/Smoky / Romantic,Medium Tempo/Medium Slow/60s
206434272,Éléphant,Au fond (c'est beau),Collective mon amour,Mixed/Mixed Duo,2013,Pop/European Pop/French Pop,Melancholy/Sad / Soulful,Medium Tempo/Medium Slow/50s
206434248,Éléphant,Lisa,Collective mon amour,Mixed/Mixed Duo,2013,Pop/European Pop/French Pop,Melancholy/Light Melancholy,Medium Tempo/Medium Slow/50s
205349177,Kevin Kern,I Am Always Right Here,Imagination's Light,Male/Male,2005,Other/New Age/New Acoustic,Tender/Romantic / Lyrical,Medium Tempo/Medium Slow/50s
205180960,Океан Ельзи,Джульетта,Земля,Male/Male Group,2013,Rock/Mainstream Rock/General Mainstream Rock,Brooding/Evocative / Intriguing,Medium Tempo/Medium Slow/50s
201819665,SoKo,I'll kill her,Soko not Sokute,Female/Female,2007,Alternative a Punk/Alternative Folk/Alternative Folk,Easygoing/Friendly,Medium Tempo/Medium Slow/60s
200292788,Various Artists,Moving Backwards (Featuring Kate Louise Smith),Distant Earth,Male/Male,2011,Electronica/Trance/Trance,Sensual/Dreamy Pulse,Medium Tempo/Medium Slow/60s
