id,artist,title,album_title,artist_type,album_year,genre,mood,tempo
456239172,Misty Miller,Evergreen Love,Misty Miller,Female/Female,2011,Pop/Western Pop/Adult Alternative Pop,Easygoing/Friendly,Slow Tempo/Slow/40s
456239033,Caro Emerald,The Wonderful In You,The Shocking Miss Emerald,Female/Female,2013,Jazz/Jazz Vocals/Jazz Vocals,Easygoing/Friendly,Medium Tempo/Medium/70s
456239022,Palast Orchester Mit Seinem Sänger Max Raabe,Original Charleston,TanzGala,"",1997,Other/Data a Other/Data a Other,Easygoing/Charming / Easygoing,Medium Tempo/Medium Fast/90s
175162829,The Carpenters,Top Of The World,The Singles 1969-1973,Mixed/Mixed Duo,1973,Rock/70's Rock/Classic Soft Rock,Easygoing/Friendly,Slow Tempo/Slow/40s
162978966,Lazlo Bane,Superman,All the Time in the World,Male/Male Group,2002,Rock/Adult Alternative Rock/Adult Alternative Rock,Easygoing/Friendly,Medium Tempo/Medium/80s
142625631,Carly Comando,Everyday,One Take,Female/Female,2009,Other/New Age/New Acoustic,Easygoing/Cheerful / Playful,Fast Tempo/Fast/140s
61796140,Grant Geissman,Theme From Two And A Half Men,Say That!,Male/Male,2006,Jazz/Smooth Jazz/Smooth Jazz Instrumental,Easygoing/Friendly,Medium Tempo/Medium/70s
