id,artist,title,album_title,artist_type,album_year,genre,mood,tempo
456239186,Florence + The Machine,Hurricane Drunk,Lungs,Mixed/Mixed Group,2009,Alternative a Punk/Alternative/Alternative Singer-Songwriter,Empowering/Dramatic Emotion,Slow Tempo/Slow/40s
456239180,Sarah McLachlan,Path Of Thorns,Mirrorball [Live],Female/Female,1999,Pop/Western Pop/Adult Alternative Pop,Empowering/Dramatic Emotion,Slow Tempo/Slow/40s
456239161,a-ha,A Fine Blue Line,Analogue,Male/Male Group,2005,Alternative a Punk/New Wave Pop/New Wave Pop,Empowering/Dramatic Emotion,Slow Tempo/Slow/40s
456239160,Echo a The Bunnymen,Lost On You,What Are You Going To Do With Your Life,Male/Male Group,1999,Alternative a Punk/Indie Rock/Original Post-Punk,Empowering/Powerful / Heroic,Medium Tempo/Medium Slow/60s
456239155,Ellie Goulding,Still Falling For You,Still Falling For You [Single],Female/Female,2016,Electronica/Electronica Mainstream/Pop Electronica,Empowering/Dramatic Emotion,Slow Tempo/Slow/40s
456239140,Katie Melua,If You Were A Sailboat,Pictures,Female/Female,2007,Pop/Western Pop/Adult Contemporary,Empowering/Dramatic Emotion,Slow Tempo/Slow/40s
456239137,Christian Education Publications,I Will Be With You,Connect - Infants B1,"",2011,Other/Children's/General Children's Music,Empowering/Dramatic Emotion,Slow Tempo/Very Slow/30s
456239125,Neele Ternes,Dad (#heimkommen),Dad,Female/Female,2015,Pop/Western Pop/Adult Alternative Pop,Empowering/Dramatic Emotion,Slow Tempo/Very Slow/30s
456239109,Nerina Pallot,Someday Soon,Dear Frustrated Superstar,Female/Female,2001,Pop/Western Pop/Adult Alternative Pop,Empowering/Dramatic Emotion,Slow Tempo/Very Slow/30s
456239106,Florence + The Machine,You've Got The Love,Lungs,Mixed/Mixed Group,2009,Alternative a Punk/Alternative/Alternative Singer-Songwriter,Empowering/Powerful / Heroic,Medium Tempo/Medium Fast/110s
456239039,Hooverphonic,Amalfi,Reflection,Mixed/Mixed Group,2013,Electronica/Downtempo Lounge a Ambient/General Downtempo,Empowering/Dramatic Emotion,Medium Tempo/Medium/60s
432067240,Young The Giant,Cough Syrup,Young The Giant,Male/Male Group,2010,Alternative a Punk/Alternative/Alternative Rock,Empowering/Powerful / Heroic,Medium Tempo/Medium/60s
400411047,Tim Minchin,Canvas Bags,Ready For This ?,Male/Male,2009,Other/Comedy/Comedy,Empowering/Powerful / Heroic,Medium Tempo/Medium/80s
388002356,Paramore,The Only Exception,Brand New Eyes,Mixed/Mixed Group,2009,Alternative a Punk/Alternative/Alternative Rock,Empowering/Dramatic Emotion,Slow Tempo/Slow/40s
364606536,Крихітка,Щось на зразок,Рецепт,"",2009,Alternative a Punk/Alternative/Alternative Rock,Empowering/Dramatic Emotion,Slow Tempo/Very Slow/30s
350893176,First Aid Kit,Winter Is All Over You,The Big Black And The Blue,Female/Female Duo,2010,Alternative a Punk/Alternative Folk/Alternative Folk,Empowering/Dramatic Emotion,Slow Tempo/Very Slow/30s
347705824,Edward Sharpe a The Magnetic Zeros,Home,Up From Below,Mixed/Mixed Group,2009,Alternative a Punk/Alternative Folk/Alternative Folk,Empowering/Idealistic / Stirring,Medium Tempo/Medium Fast/110s
336253380,Ramona Falls,Melectric,Intuit,Mixed/Mixed Group,2009,Alternative a Punk/Indie Rock/General Indie Rock,Empowering/Idealistic / Stirring,Medium Tempo/Medium Fast/100s
331442861,Boston,Let Me Take You Home Tonight,Boston,Male/Male Group,1976,Rock/70's Rock/Classic Rock,Empowering/Idealistic / Stirring,Medium Tempo/Medium/70s
315488066,Darren Korb,The Spine,Transistor Original Soundtrack,Mixed/Mixed Duo,2014,Soundtrack/Game Music/Game Music,Empowering/Dramatic Emotion,Slow Tempo/Very Slow/30s
315487687,Darren Korb,The Spine,Transistor Original Soundtrack,Mixed/Mixed Duo,2014,Soundtrack/Game Music/Game Music,Empowering/Dramatic Emotion,Slow Tempo/Very Slow/30s
314997488,Birdy,People Help The People,Birdy,Female/Female,2011,Alternative a Punk/Alternative Folk/Alternative Folk,Empowering/Dramatic Emotion,Slow Tempo/Very Slow/30s
313417512,Guns N' Roses,Sweet Child O' Mine,Appetite For Destruction,Male/Male Group,1987,Rock/Hard Rock/General Hard Rock,Empowering/Powerful / Heroic,Medium Tempo/Medium Fast/120s
313106168,Evanescence,Missing,Anywhere But Home [Live],Mixed/Mixed Group,2004,Rock/Metal/Gothic Metal,Empowering/Dramatic Emotion,Medium Tempo/Medium Slow/50s
312669136,José González,Step Out,Step Out,Male/Male,0,Alternative a Punk/Indie Rock/General Indie Rock,Empowering/Powerful / Heroic,Medium Tempo/Medium/70s
310128229,Ozzy Osbourne,Dreamer,Down To Earth,Male/Male,2001,Rock/Metal/Classic British Metal,Empowering/Dramatic Emotion,Slow Tempo/Slow/40s
310056310,Rise Against,Hero Of War,Appeal To Reason,Male/Male Group,2008,Alternative a Punk/Punk/Hardcore Punk,Empowering/Strong / Stable,Medium Tempo/Medium/70s
302447256,Tyler Ward,Falling,Honestly,Male/Male,2013,Pop/Western Pop/Adult Alternative Pop,Empowering/Dramatic Emotion,Medium Tempo/Medium/70s
301496042,My Darkest Days,Come Undone,My Darkest Days,Male/Male Group,2010,Alternative a Punk/Alternative/Alternative Rock,Empowering/Powerful / Heroic,Medium Tempo/Medium/80s
301625193,Foo Fighters,Best Of You,In Your Honor [Disc 1],Male/Male Group,2005,Alternative a Punk/Alternative/Alternative Rock,Empowering/Powerful / Heroic,Medium Tempo/Medium/60s
301758308,Semisonic,Closing Time,Feeling Strangely Fine,Male/Male Group,1998,Rock/Adult Alternative Rock/Adult Alternative Rock,Empowering/Powerful / Heroic,Medium Tempo/Medium Fast/90s
279424748,High School Musical Cast,Start Of Something New,High School Musical,Mixed/Mixed Group,2006,Soundtrack/Original Film/TV Music/Musical Film/TV Music,Empowering/Dramatic Emotion,Medium Tempo/Medium/60s
276254997,Three Days Grace,The High Road,Transit Of Venus,Male/Male Group,2012,Alternative a Punk/Alternative/Alternative Rock,Empowering/Powerful / Heroic,Medium Tempo/Medium/70s
267630180,London Grammar,Wasting My Young Years,If You Wait,Mixed/Mixed Group,2013,Alternative a Punk/Indie Rock/Dream Pop,Empowering/Dramatic Emotion,Medium Tempo/Medium Slow/60s
267295708,CHVRCHES,The Mother We Share,The Bones Of What You Believe,Mixed/Mixed Group,2013,Alternative a Punk/Synth Pop/Synth Pop,Empowering/Powerful / Heroic,Medium Tempo/Medium/80s
256798242,U2,Ordinary Love,Ordinary Love,Male/Male Group,2013,Rock/Adult Alternative Rock/Adult Alternative Rock,Empowering/Dramatic Emotion,Medium Tempo/Medium Slow/60s
250310093,Neil Young a Crazy Horse,Love To Burn,Ragged Glory,Male/Male Group,1990,Rock/70's Rock/Classic Rock,Empowering/Powerful / Heroic,Medium Tempo/Medium Fast/110s
246712284,Elton John,Can You Feel The Love Tonight?,Tim Rice / El Rey Leon,Male/Male,0,Pop/Western Pop/Singer-Songwriter,Empowering/Dramatic Emotion,Slow Tempo/Very Slow/30s
245699772,Mandy Moore,Only Hope,The Best of Mandy Moore,Female/Female,2004,Pop/Western Pop/Teen Pop,Empowering/Dramatic Emotion,Slow Tempo/Slow/40s
242647599,Coldplay,Green Eyes,A Rush Of Blood To The Head,Male/Male Group,2002,Alternative a Punk/Brit Rock/Brit Rock,Empowering/Strong / Stable,Medium Tempo/Medium/60s
241545929,David Cook,Avalanche,David Cook,Male/Male,2008,Rock/Adult Alternative Rock/Adult Alternative Rock,Empowering/Powerful / Heroic,Medium Tempo/Medium/70s
241393011,Birdy,People Help The People,Birdy,Female/Female,2011,Alternative a Punk/Alternative Folk/Alternative Folk,Empowering/Dramatic Emotion,Slow Tempo/Very Slow/30s
237043951,Birdy,Skinny Love,Birdy,Female/Female,2011,Alternative a Punk/Alternative Folk/Alternative Folk,Empowering/Dramatic Emotion,Slow Tempo/Slow/40s
235175512,Birdy,Skinny Love,Birdy,Female/Female,2011,Alternative a Punk/Alternative Folk/Alternative Folk,Empowering/Dramatic Emotion,Slow Tempo/Slow/40s
234979773,Daniel Powter,Bad Day,Daniel Powter,Male/Male,2005,Pop/Western Pop/Adult Alternative Pop,Empowering/Strong / Stable,Medium Tempo/Medium/70s
234970932,Mandy Moore,Only Hope,The Best of Mandy Moore,Female/Female,2004,Pop/Western Pop/Teen Pop,Empowering/Dramatic Emotion,Slow Tempo/Slow/40s
234379722,Keane,Higher Than The Sun,The Best Of Keane,Male/Male Group,2013,Alternative a Punk/Brit Rock/Brit Rock,Empowering/Dramatic Emotion,Slow Tempo/Slow/40s
233290439,Pur:Pur,Me is,Pure,"",2015,Pop/Western Pop/Pop Vocal,Empowering/Dramatic Emotion,Medium Tempo/Medium Slow/60s
209858926,鷺巣詩郎,Special Christmas Present From Shiro Sagisu And Freedom Choir,LONDON FREEDOM CHOIR SHIRO'S SONGBOOK SELECTION,Male/Male,2003,Soundtrack/Original Film/TV Music/Anime Film/TV Music,Empowering/Dramatic Emotion,Medium Tempo/Medium Slow/60s
202886017,How I Met Your Mother Band,"How I Met You Mother (Main Title Theme) ""Hey Beautiful""",How I Met You Mother (Theme from CBS TV Series),"",2011,Soundtrack/Original Film/TV Music/General Film Music,Empowering/Dramatic Emotion,Medium Tempo/Medium Slow/60s
202876081,Hinder,Bliss (I Don't Wanna Know),Extreme Behavior,Male/Male Group,2005,Alternative a Punk/Alternative/Alternative Rock,Empowering/Powerful / Heroic,Medium Tempo/Medium/70s
201021981,Simple Plan,Welcome To My Life,Still Not Getting Any...,Male/Male Group,2004,Alternative a Punk/Punk/Pop Punk,Empowering/Powerful / Heroic,Medium Tempo/Medium/80s
190765066,KT Tunstall,Suddenly I See,Eye To The Telescope,Female/Female,2005,Pop/Western Pop/Adult Alternative Pop,Empowering/Dramatic Emotion,Slow Tempo/Slow/40s
186309373,Sum 41,With Me,Underclass Hero,Male/Male Group,2007,Alternative a Punk/Punk/Pop Punk,Empowering/Powerful / Heroic,Medium Tempo/Medium Fast/110s
186309371,Sum 41,Pieces,Chuck,Male/Male Group,2004,Alternative a Punk/Punk/Pop Punk,Empowering/Powerful / Heroic,Medium Tempo/Medium Fast/90s
184699225,The Fray,You Found Me,The Fray,Male/Male Group,2009,Rock/Adult Alternative Rock/Adult Alternative Rock,Empowering/Powerful / Heroic,Medium Tempo/Medium/70s
184328488,Florence + The Machine,Shake It Out,Ceremonials,Mixed/Mixed Group,2011,Alternative a Punk/Alternative/Alternative Singer-Songwriter,Empowering/Powerful / Heroic,Medium Tempo/Medium Fast/100s
184328473,Florence + The Machine,Dog Days Are Over,Lungs,Mixed/Mixed Group,2009,Alternative a Punk/Alternative/Alternative Singer-Songwriter,Empowering/Powerful / Heroic,Medium Tempo/Medium/70s
171877314,James Blunt,No Tears,Some Kind Of Trouble,Male/Male,2010,Pop/Western Pop/Adult Alternative Pop,Empowering/Dramatic Emotion,Medium Tempo/Medium/60s
171537876,Christina Perri,Jar Of Hearts,Lovestrong.,Female/Female,2011,Pop/Western Pop/Adult Alternative Pop,Empowering/Dramatic Emotion,Slow Tempo/Very Slow/30s
166735986,The Pretty Reckless,You,Light Me Up,Mixed/Mixed Group,2010,Alternative a Punk/Alternative/Alternative Rock,Empowering/Idealistic / Stirring,Medium Tempo/Medium/80s
166733949,Taylor Swift,The Moment I Knew,Red [Deluxe Edition] [Disc 2],Female/Female,2012,Pop/Western Pop/Adult Alternative Pop,Empowering/Dramatic Emotion,Medium Tempo/Medium Slow/60s
164103788,U2,With Or Without You,The Joshua Tree,Male/Male Group,1987,Rock/Adult Alternative Rock/Adult Alternative Rock,Empowering/Idealistic / Stirring,Medium Tempo/Medium Fast/110s
163816616,Switchfoot,Your Love Is A Song,Hello Hurricane,Male/Male Group,2009,Alternative a Punk/Alternative/Alternative Rock,Empowering/Powerful / Heroic,Medium Tempo/Medium/80s
162394193,西野カナ,You are the one,to LOVE,Female/Female,2010,Urban/Contemporary RaB/Soul/Urban Crossover,Empowering/Dramatic Emotion,Medium Tempo/Medium Slow/60s
149947422,Florence + The Machine,Never Let Me Go,Ceremonials,Mixed/Mixed Group,2011,Alternative a Punk/Alternative/Alternative Singer-Songwriter,Empowering/Dramatic Emotion,Slow Tempo/Very Slow/30s
140529460,安室奈美恵,arigatou <thank the world for LOVE... gift song for 2011>,Sit! Stay! Wait! Down! / Love Story,Female/Female,2011,Pop/Japanese Pop/J-Pop,Empowering/Dramatic Emotion,Medium Tempo/Medium/70s
137076448,My First Old Testament Bible Stories,God Made Me,My First Old Testament Bible Stories,"",2010,Other/Children's/General Children's Music,Empowering/Dramatic Emotion,Slow Tempo/Very Slow/30s
130398540,Sixpence None The Richer,Breathe Your Name,Divine Discontent,Mixed/Mixed Group,2002,Pop/Western Pop/Adult Alternative Pop,Empowering/Dramatic Emotion,Slow Tempo/Slow/40s
122607021,Yeah Yeah Yeahs,Cheated Hearts,Show Your Bones,Mixed/Mixed Group,2006,Alternative a Punk/Indie Rock/Post-Punk Revival,Empowering/Powerful / Heroic,Medium Tempo/Medium/60s
120236492,Олександр Пономарьов,Він Чекає На Неї,Краще,"",2004,Pop/Western Pop/Pop Vocal,Empowering/Dramatic Emotion,Slow Tempo/Very Slow/30s
98931031,Григорий Лепс,В городе дождь,Натали,Male/Male,1995,Pop/European Pop/Eastern European Pop,Empowering/Dramatic Emotion,Slow Tempo/Very Slow/30s
86448205,Скрябін,Квінти,Моя еволюція,Male/Male Group,2009,Rock/Mainstream Rock/General Mainstream Rock,Empowering/Powerful / Heroic,Medium Tempo/Medium Fast/110s
75181512,Unkle Bob,Swans,Sugar and Spite,"",2006,Rock/Mainstream Rock/General Mainstream Rock,Empowering/Idealistic / Stirring,Medium Tempo/Medium Fast/110s
72366045,Snow Patrol,Chasing Cars,Eyes Open,Male/Male Group,2006,Alternative a Punk/Brit Rock/Brit Rock,Empowering/Powerful / Heroic,Medium Tempo/Medium Fast/100s
72255661,Kaiser Chiefs,Ruby,Yours Truly Angry Mob,Male/Male Group,2007,Alternative a Punk/Indie Rock/General Indie Rock,Empowering/Powerful / Heroic,Medium Tempo/Medium Fast/90s
71962005,Dido,White Flag,Life For Rent,Female/Female,2003,Pop/Western Pop/Adult Alternative Pop,Empowering/Dramatic Emotion,Slow Tempo/Slow/40s
71957639,Dido,White Flag,Life For Rent,Female/Female,2003,Pop/Western Pop/Adult Alternative Pop,Empowering/Dramatic Emotion,Slow Tempo/Slow/40s
69363418,ABBA,Happy New Year,Super Trouper,Mixed/Mixed Group,1980,Pop/European Pop/Euro Pop,Empowering/Dramatic Emotion,Slow Tempo/Slow/40s
67250995,ABBA,The Winner Takes It All,Super Trouper,Mixed/Mixed Group,1980,Pop/European Pop/Euro Pop,Empowering/Powerful / Heroic,Medium Tempo/Medium Slow/60s
