id,artist,title,album_title,artist_type,album_year,genre,mood,tempo
456239539,:Of The Wand And The Moon:,Sunspot,The Lone Descent,"",2011,Traditional/Country/General Country,Brooding/Dreamy Brooding,Medium Tempo/Medium/70s
456239538,Asteroid,Wolf a Snake,III,"",2016,Rock/70's Rock/Classic Rock,Brooding/Dreamy Brooding,Medium Tempo/Medium/80s
456239537,Asteroid,Last Days,III,"",2016,Rock/70's Rock/Classic Rock,Brooding/Dreamy Brooding,Medium Tempo/Medium/60s
456239521,Andy Jackson,Type 2 Error,73 Days at Sea,"",2016,Rock/Mainstream Rock/General Mainstream Rock,Brooding/Dreamy Brooding,Medium Tempo/Medium/80s
456239519,Andy Jackson,Like You,73 Days at Sea,"",2016,Rock/Mainstream Rock/General Mainstream Rock,Brooding/Dreamy Brooding,Medium Tempo/Medium/70s
456239515,Andy Jackson,Type 1 Error,73 Days at Sea,"",2016,Rock/Mainstream Rock/General Mainstream Rock,Brooding/Dreamy Brooding,Medium Tempo/Medium Slow/50s
456239451,Kuolemanlaakso,My Last Words,M. Laakso Vol. 1: The Gothic Tapes,Male/Male Group,2016,Rock/Metal/Doom Metal,Brooding/Dreamy Brooding,Medium Tempo/Medium Slow/60s
456239432,Bloody Hammers,The Reaper Comes,The Reaper Comes,"",2016,Rock/Metal/Heavy Metal,Brooding/Dreamy Brooding,Slow Tempo/Slow/40s
456239406,Mantus,Konstrukt,Grenzland,Mixed/Mixed Group,2014,Rock/Metal/Gothic Metal,Brooding/Dreamy Brooding,Medium Tempo/Medium/60s
456239373,Chelsea Wolfe,We Hit A Wall,Pain Is Beauty,Female/Female,2013,Alternative a Punk/Goth/Goth,Brooding/Dreamy Brooding,Slow Tempo/Slow/40s
456239357,Kutiman,Jaffa Beach,6AM,Male/Male,2016,Electronica/Electronica Fusion/Ethno-Lounge Electronica,Brooding/Dreamy Brooding,Medium Tempo/Medium/80s
456239348,Harold Martinez,Dead Man,Dead Man,"",2014,Rock/Mainstream Rock/General Mainstream Rock,Brooding/Dreamy Brooding,Medium Tempo/Medium Slow/60s
456239340,Estampie,Ungersven,Secrets of the North,Mixed/Mixed Group,2013,Classical/Other Classical/General Classical,Brooding/Dreamy Brooding,Medium Tempo/Medium Slow/50s
456239262,Sonne Hagal,The Shapes of Things to Come,Ockerwasser,"",2014,Traditional/Folk/Traditional U.S. Folk,Brooding/Dreamy Brooding,Medium Tempo/Medium Slow/60s
456239256,Allah-Las,Ela Navega,Allah-Las,Male/Male Group,2012,Alternative a Punk/Indie Rock/Noise Pop,Brooding/Dreamy Brooding,Medium Tempo/Medium/60s
456239253,Mantus,Welt in Flammen,Refugium,Mixed/Mixed Group,2016,Rock/Metal/Gothic Metal,Brooding/Dreamy Brooding,Medium Tempo/Medium Slow/50s
456239245,Katatonia,Shifts,The Fall Of Hearts,Male/Male Group,2016,Rock/Metal/Gothic Metal,Brooding/Dreamy Brooding,Medium Tempo/Medium Slow/60s
456239239,Mantus,Das Wunder des Lebens,Refugium,Mixed/Mixed Group,2016,Rock/Metal/Gothic Metal,Brooding/Dreamy Brooding,Medium Tempo/Medium/70s
456239237,Mantus,Zwischen den Nächten,Refugium,Mixed/Mixed Group,2016,Rock/Metal/Gothic Metal,Brooding/Dreamy Brooding,Slow Tempo/Slow/40s
456239212,Sólstafir,Ótta,Ótta,Male/Male Group,2014,Rock/Metal/Black Metal,Brooding/Dreamy Brooding,Slow Tempo/Slow/40s
456239188,Rome,Broken,Coriolan,Male/Male,2016,Urban/Contemporary RaB/Soul/Urban AC,Brooding/Dreamy Brooding,Slow Tempo/Slow/40s
456239183,Rome,Swords To Rust - Hearts To Dust,Flowers From Exile,Male/Male,2005,Urban/Contemporary RaB/Soul/Urban AC,Brooding/Dreamy Brooding,Medium Tempo/Medium Slow/60s
456239171,Johnny Hollow,Alibi (Album Version (Explicit)),Dirty Hands (Explicit),"",2008,Rock/Mainstream Rock/General Mainstream Rock,Brooding/Dreamy Brooding,Medium Tempo/Medium Slow/50s
456239145,Ivy Hope,Insects,Mary [Single],"",2015,Rock/Mainstream Rock/General Mainstream Rock,Brooding/Dreamy Brooding,Slow Tempo/Slow/40s
456239144,Xu Xu Fang,Fascination Street,Seven Days Now,"",2009,Alternative a Punk/Alternative/Alternative Rock,Brooding/Dreamy Brooding,Medium Tempo/Medium/80s
456239134,Nature Ganganbaigal,Golden Horde,To Where Tengger Leads Me,"",2014,Traditional/Country/General Country,Brooding/Dreamy Brooding,Medium Tempo/Medium/60s
456239101,The Eden House,Reach Out,Smoke And Mirrors,"",2009,Rock/Metal/Gothic Metal,Brooding/Dreamy Brooding,Medium Tempo/Medium/70s
456239096,Ost+Front,Ein alter Mann,Ave Maria,"",2012,Rock/Mainstream Rock/General Mainstream Rock,Brooding/Dreamy Brooding,Slow Tempo/Slow/40s
456239085,Ordo Rosarius Equilibrio,A Song 4 Hate a Devotion,Songs 4 Hate a Devotion,Mixed/Mixed Group,2010,Alternative a Punk/Synth Pop/Synth Pop,Brooding/Dreamy Brooding,Slow Tempo/Slow/40s
456239081,Ordo Rosarius Equilibrio,First Death (Every Man Is A Moth To The Flame),4Play,Mixed/Mixed Group,2013,Alternative a Punk/Synth Pop/Synth Pop,Brooding/Dreamy Brooding,Slow Tempo/Slow/40s
456239069,The Psychotic Reaction,I'm Not Ready Yet,Rumble,"",2004,Pop/Western Pop/Pop Vocal,Brooding/Dreamy Brooding,Medium Tempo/Medium/70s
456239061,Tiamat,Divided,Prey,Male/Male Group,2003,Rock/Metal/Gothic Metal,Brooding/Dreamy Brooding,Medium Tempo/Medium/60s
443881797,Dernière Volonté,Sans Fin,Prie Pour Moi,Male/Male,2016,Alternative a Punk/Goth/Goth,Brooding/Dreamy Brooding,Medium Tempo/Medium/60s
440714370,True Widow,Four Teeth,Circumambulation,Mixed/Mixed Group,2013,Rock/Hard Rock/Stoner Rock,Brooding/Dreamy Brooding,Slow Tempo/Slow/40s
439467003,Tiamat,To Have And Have Not,Skeleton Skeletron,Male/Male Group,1999,Rock/Metal/Gothic Metal,Brooding/Dreamy Brooding,Medium Tempo/Medium Slow/60s
439358132,Golden Apes,Devil,Riot,"",2012,Alternative a Punk/Indie Rock/General Indie Rock,Brooding/Dreamy Brooding,Medium Tempo/Medium/70s
437920200,Days Of The New,Face Of The Earth,Days Of The New 1,Male/Male Group,1997,Alternative a Punk/Alternative/Alternative Rock,Brooding/Dreamy Brooding,Medium Tempo/Medium/80s
426903568,Ordo Rosarius Equilibrio a Spiritual Front,Song For The Old Man,Satyriasis - Somewhere Between Equilibrium And Nihilism,Male/Male Group,2005,Alternative a Punk/Goth/Goth,Brooding/Dreamy Brooding,Medium Tempo/Medium/70s
425922779,Die Form,Cantique,Best Of XXX [Disc 2],Mixed/Mixed Duo,2008,Alternative a Punk/Goth/Goth,Brooding/Dreamy Brooding,Medium Tempo/Medium/60s
424408466,Corvus Corax,Is Nomine Vacans,Kaltenberg Anno MMVII,Male/Male Group,2007,Alternative a Punk/Indie Rock/Dream Pop,Brooding/Dreamy Brooding,Medium Tempo/Medium/60s
423920477,Dorn,Flammender Zorn,Spiegel Der Unendlichkeit,"",2007,Rock/Mainstream Rock/General Mainstream Rock,Brooding/Dreamy Brooding,Medium Tempo/Medium/70s
423900243,Lacrimas Profundere,The Nothingship,Fall I Will Follow,Male/Male Group,2006,Rock/Metal/Gothic Metal,Brooding/Dreamy Brooding,Medium Tempo/Medium/70s
420197626,If These Trees Could Talk,What's in the Ground Belongs to You,Above the Earth Below the Sky,Male/Male Group,2009,Alternative a Punk/Indie Rock/Post-Rock,Brooding/Dreamy Brooding,Medium Tempo/Medium/70s
418329158,Brainstorm,Thunder Without Rain,Four Shores,Male/Male Group,2006,Pop/European Pop/Eastern European Pop,Brooding/Dreamy Brooding,Medium Tempo/Medium Slow/50s
418305486,Elizaveta,Meant,Beatrix Runs,Female/Female,2012,Alternative a Punk/Indie Rock/Indie Pop,Brooding/Dreamy Brooding,Medium Tempo/Medium/70s
418286836,The Black Ryder,Seventh Moon,The Door Behind the Door,Mixed/Mixed Duo,2015,Alternative a Punk/Indie Rock/Shoegazer,Brooding/Dreamy Brooding,Medium Tempo/Medium Slow/50s
416776586,Big Okie Doom,Put On This Earth,The Trail,"",2015,Rock/Mainstream Rock/General Mainstream Rock,Brooding/Dreamy Brooding,Medium Tempo/Medium/60s
413658707,Valravn,Marsk (Pawel Rychert/Pchelki Remix),Re-Coded,Mixed/Mixed Group,2011,Alternative a Punk/Indie Rock/Post-Modern Art Music,Brooding/Dreamy Brooding,Medium Tempo/Medium/80s
413041219,Dernière Volonté,L'Ombre Des Réverbères,Devant Le Miroir,Male/Male,2008,Alternative a Punk/Goth/Goth,Brooding/Dreamy Brooding,Medium Tempo/Medium/60s
412949344,The Afghan Whigs,When We Two Parted,Gentlemen,Male/Male Group,1993,Alternative a Punk/Alternative/Alternative Rock,Brooding/Dreamy Brooding,Medium Tempo/Medium/60s
411134978,Mud Flow,The Sense Of Me,A Life On Standby,Male/Male Group,2004,Alternative a Punk/Indie Rock/General Indie Rock,Brooding/Dreamy Brooding,Medium Tempo/Medium/70s
410972871,The Eden House,Venus in Furs (Featuring Amandine Ferrari),The Looking Glass,"",2010,Rock/Mainstream Rock/General Mainstream Rock,Brooding/Dreamy Brooding,Medium Tempo/Medium/70s
410134773,Forseti,Abendrot,Windzeit,Male/Male Group,2002,Other/New Age/New Acoustic,Brooding/Dreamy Brooding,Medium Tempo/Medium/70s
408985920,She Makes War,In This Boat,Little Battles,Female/Female,2012,Alternative a Punk/Alternative/Alternative Singer-Songwriter,Brooding/Dreamy Brooding,Medium Tempo/Medium/80s
408213657,Sólstafir,Fjara,Svartir Sandar,Male/Male Group,2011,Rock/Metal/Black Metal,Brooding/Dreamy Brooding,Medium Tempo/Medium Slow/50s
408148650,Halgadom,Walkurenritt,Heimstatt,"",2010,Rock/Metal/Heavy Metal,Brooding/Dreamy Brooding,Medium Tempo/Medium Slow/60s
405921796,Allah-Las,Sacred Sands,Allah-Las,Male/Male Group,2012,Alternative a Punk/Indie Rock/Noise Pop,Brooding/Dreamy Brooding,Medium Tempo/Medium/60s
405093758,HIM,(Don't Fear) The Reaper,Greatest Lovesongs Vol. 666,Male/Male Group,1997,Alternative a Punk/Goth/Goth,Brooding/Dreamy Brooding,Medium Tempo/Medium Slow/50s
404345542,Souvenir's Young America,Vanishing (Remaining),The Name Of The Snake,"",2010,Other/Spoken Word/General Spoken Word,Brooding/Dreamy Brooding,Medium Tempo/Medium/70s
404113085,Untoten,Zurück,Liebe oder Tod,Mixed/Mixed Duo,2006,Alternative a Punk/Goth/Goth,Brooding/Dreamy Brooding,Medium Tempo/Medium Slow/50s
404066553,Midlake,Small Mountain,The Courage Of Others,Male/Male Group,2010,Rock/Alternative Roots/Alt Country,Brooding/Dreamy Brooding,Medium Tempo/Medium Slow/60s
402665782,Xy,In Aeternum,Sedunum,"",2014,Soundtrack/Original Film/TV Music/General Film Music,Brooding/Dreamy Brooding,Slow Tempo/Very Slow/30s
398956494,Les Hurlements D'Léo,De l'allure!,Bordel de luxe,Male/Male Group,2011,Rock/European Rock/Chanson Rock,Brooding/Dreamy Brooding,Medium Tempo/Medium/60s
398768618,Born For Bliss,Walk on By,Falling Back to Never,"",2015,Alternative a Punk/Goth/Goth,Brooding/Dreamy Brooding,Medium Tempo/Medium Slow/50s
396205559,Trentemøller,Sycamore Feeling (Trentemøller Remix),Sycamore Feeling,Male/Male,2010,Electronica/House/Tech House,Brooding/Dreamy Brooding,Medium Tempo/Medium Slow/60s
393253584,La Chanson Noire,Cornucópia,Cabaret Portugal,"",2012,Alternative a Punk/Punk/General Punk,Brooding/Dreamy Brooding,Medium Tempo/Medium/80s
385299489,Black Space Riders,Run to the Plains,Refugeeum,"",2015,Rock/Mainstream Rock/General Mainstream Rock,Brooding/Dreamy Brooding,Medium Tempo/Medium Slow/50s
380938064,Trains Things,Hobo,Underground,"",2016,Traditional/Folk/Traditional U.S. Folk,Brooding/Dreamy Brooding,Medium Tempo/Medium Slow/50s
379946829,Golden Apes,The Sea Inside,Denying The Towers Our Words Are Falling From...,"",2010,Alternative a Punk/Alternative/Alternative Rock,Brooding/Dreamy Brooding,Medium Tempo/Medium/60s
379215606,Wolfmother,White Unicorn,Wolfmother,Male/Male Group,2006,Rock/Hard Rock/Stoner Rock,Brooding/Dreamy Brooding,Medium Tempo/Medium Slow/50s
376436441,Сказы Леса,Нежить,Ёлта-ку,"",0,Other/Meditative a Space/Meditative,Brooding/Dreamy Brooding,Medium Tempo/Medium/80s
374342057,Luciferian Light Orchestra,Church of Carmel,Luciferian Light Orchestra,"",2015,Rock/Metal/Heavy Metal,Brooding/Dreamy Brooding,Medium Tempo/Medium Slow/50s
374184072,Nick Cave a The Bad Seeds,I Let Love In,Let Love In,Male/Male Group,1994,Alternative a Punk/Indie Rock/Original Post-Punk,Brooding/Dreamy Brooding,Medium Tempo/Medium Slow/60s
373908201,Florence + The Machine,How Big How Blue How Beautiful,How Big How Blue How Beautiful,Mixed/Mixed Group,2015,Alternative a Punk/Alternative/Alternative Singer-Songwriter,Brooding/Dreamy Brooding,Medium Tempo/Medium/60s
372527524,Hozier,Angel Of Small Death a The Codeine Scene,Hozier (Deluxe Version) [Disc 1],Male/Male,2014,Alternative a Punk/Alternative Folk/Alternative Folk,Brooding/Dreamy Brooding,Slow Tempo/Slow/40s
371775603,Frank The Baptist,The Wrong House,The New Colossus,"",2007,Other/Data a Other/Data a Other,Brooding/Dreamy Brooding,Slow Tempo/Slow/40s
371178963,Florence + The Machine,What The Water Gave Me,Ceremonials,Mixed/Mixed Group,2011,Alternative a Punk/Alternative/Alternative Singer-Songwriter,Brooding/Dreamy Brooding,Medium Tempo/Medium Slow/60s
371122600,The Black Angels,Better off Alone,Passover,Male/Male Group,2006,Alternative a Punk/Indie Rock/Neo-Psychedelic,Brooding/Dreamy Brooding,Medium Tempo/Medium/60s
370805945,Matt Costa,These Arms,Songs We Sing,Male/Male,2006,Pop/Western Pop/Adult Alternative Pop,Brooding/Dreamy Brooding,Medium Tempo/Medium/60s
366361398,E Nomine,Das Böse (Samuel L. Jackson),Finsternis,Male/Male Group,2001,Alternative a Punk/Goth/Goth,Brooding/Dreamy Brooding,Medium Tempo/Medium/60s
363909320,Kingdom Come,Janine,Twilight Cruiser,Male/Male Group,1995,Rock/Hard Rock/General Hard Rock,Brooding/Dreamy Brooding,Medium Tempo/Medium Slow/60s
363907277,Otis Taylor,Ten Million Slaves,Recapturing The Banjo,Male/Male,2008,Traditional/Electric Blues/Contemporary Blues,Brooding/Dreamy Brooding,Medium Tempo/Medium/60s
336188838,Forseti,Korn,Erde,Male/Male Group,2004,Other/New Age/New Acoustic,Brooding/Dreamy Brooding,Slow Tempo/Slow/40s
314841014,The Shroud,Madeline,A Dark Moon Night,"",0,Alternative a Punk/Goth/Goth,Brooding/Dreamy Brooding,Medium Tempo/Medium Slow/60s
289000995,Johnny Hollow,Superhero,Dirty Hands (Explicit),"",2008,Rock/Mainstream Rock/General Mainstream Rock,Brooding/Dreamy Brooding,Medium Tempo/Medium/70s
287787482,HaYehudim,Kach Oti,Metziut Nifredet,Mixed/Mixed Group,1995,Pop/Middle East Pop/Israeli Pop,Brooding/Dreamy Brooding,Medium Tempo/Medium Slow/60s
285475046,Opeth,Harvest,Blackwater Park,Male/Male Group,2001,Rock/Metal/Progressive Metal,Brooding/Dreamy Brooding,Medium Tempo/Medium Slow/60s
283589154,Opeth,To Rid The Disease,Damnation,Male/Male Group,2003,Rock/Metal/Progressive Metal,Brooding/Dreamy Brooding,Medium Tempo/Medium/60s
276811137,Hekate,Unser Die Welt Trotz Alledem,Ten Years Of Endurance,"",2003,Traditional/Folk/Traditional U.S. Folk,Brooding/Dreamy Brooding,Medium Tempo/Medium/60s
269328658,Ume,Hurricane II,Phantoms,Mixed/Mixed Group,2011,Alternative a Punk/Indie Rock/Neo-Psychedelic,Brooding/Dreamy Brooding,Medium Tempo/Medium/70s
262284316,Ritual Howls,Zemmoa,Turkish Leather,Male/Male Group,2014,Alternative a Punk/Indie Rock/Post-Punk Revival,Brooding/Dreamy Brooding,Medium Tempo/Medium/70s
253875504,The Corrs,Silver Strand,Borrowed Heaven,Mixed/Mixed Group,2004,Pop/Western Pop/Adult Alternative Pop,Brooding/Dreamy Brooding,Medium Tempo/Medium/70s
254844430,Mantus,Schuld,Demut,Mixed/Mixed Group,2010,Rock/Metal/Gothic Metal,Brooding/Dreamy Brooding,Slow Tempo/Slow/40s
250393674,Era,The Mass,The Mass,Male/Male,2003,Alternative a Punk/Indie Rock/Dream Pop,Brooding/Dreamy Brooding,Medium Tempo/Medium Slow/50s
250180849,Spiritual Front,Ragged Bed,Armageddon Gigolo,Male/Male Group,2006,Alternative a Punk/Goth/Goth,Brooding/Dreamy Brooding,Medium Tempo/Medium/70s
240944769,Tiamat,Carry Your Cross And I'll Carry Mine,Prey,Male/Male Group,2003,Rock/Metal/Gothic Metal,Brooding/Dreamy Brooding,Medium Tempo/Medium/80s
237590784,Abney Park,She,Lost Horizons,"",2009,Rock/Mainstream Rock/General Mainstream Rock,Brooding/Dreamy Brooding,Slow Tempo/Slow/40s
220109178,Susie Van Der Meer,Somebody Has To Pay,Luciferin,Female/Female,2003,Electronica/Downtempo Lounge a Ambient/Trip Hop,Brooding/Dreamy Brooding,Medium Tempo/Medium/80s
201867809,Konami Kukeiha Club,Silent Hill,Silent Hill (Original Game Soundtracks),"",2007,Soundtrack/Original Film/TV Music/General Film Music,Brooding/Dreamy Brooding,Medium Tempo/Medium Slow/60s
193610817,Mantus,Utopia,Fremde Welten,Mixed/Mixed Group,2004,Rock/Metal/Gothic Metal,Brooding/Dreamy Brooding,Medium Tempo/Medium/70s
193513291,Mantus,Untergang,Requiem,Mixed/Mixed Group,2005,Rock/Metal/Gothic Metal,Brooding/Dreamy Brooding,Medium Tempo/Medium Slow/60s
191061982,Delain,Sleepwalker's Dream,Lucidity,Mixed/Mixed Group,2006,Rock/Metal/Progressive Metal,Brooding/Dreamy Brooding,Medium Tempo/Medium Slow/60s
181475025,Lacrimosa,Rote Sinfonie,Revolution,Mixed/Mixed Duo,2012,Alternative a Punk/Goth/Goth,Brooding/Dreamy Brooding,Medium Tempo/Medium/60s
181475021,Lacrimosa,Weil Du Hilfe Brauchst,Revolution,Mixed/Mixed Duo,2012,Alternative a Punk/Goth/Goth,Brooding/Dreamy Brooding,Slow Tempo/Slow/40s
179058382,PJ Harvey,Let England Shake,Let England Shake,Female/Female,2011,Alternative a Punk/Alternative/Alternative Singer-Songwriter,Brooding/Dreamy Brooding,Medium Tempo/Medium/80s
176066798,Unheilig,Sei Mein Licht,Puppenspiel,Male/Male Group,2008,Rock/Mainstream Rock/General Mainstream Rock,Brooding/Dreamy Brooding,Medium Tempo/Medium Slow/60s
175078053,Unheilig,Halt Mich,Grosse Freiheit,Male/Male Group,2010,Rock/Mainstream Rock/General Mainstream Rock,Brooding/Dreamy Brooding,Medium Tempo/Medium/60s
171969371,Florence + The Machine,Breath Of Life,Ceremonials,Mixed/Mixed Group,2012,Alternative a Punk/Alternative/Alternative Singer-Songwriter,Brooding/Dreamy Brooding,Medium Tempo/Medium/70s
171589344,Samsas Traum,Dein schönster Augenblick,Wenn Schwarzer Regen,Male/Male Group,2009,Rock/Metal/Industrial Metal,Brooding/Dreamy Brooding,Medium Tempo/Medium Slow/50s
