id,artist,title,album_title,artist_type,album_year,genre,mood,tempo
456239510,Blood Axis,Follow Me Up to Carlow,Ultimacy,Mixed/Mixed Group,2011,Rock/Metal/Black Metal,Gritty/Strumming Yearning,Medium Tempo/Medium Fast/90s
456239387,Ghostfire,Fire in the Hole (Featuring Nathaniel Johnstone),Skeleton Coast - EP,"",2013,Traditional/Folk/Traditional U.S. Folk,Gritty/Sober / Determined,Medium Tempo/Medium/70s
456239377,Woven Hand,My Russia (Standing On Hands),Blush Music,Male/Male Group,2003,Traditional/Country/Americana,Gritty/Sober / Determined,Medium Tempo/Medium/70s
456239361,Harold Martinez,Wolf Leathers,Dead Man,"",2014,Rock/Mainstream Rock/General Mainstream Rock,Gritty/Sober / Determined,Medium Tempo/Medium/80s
456239294,Amadou a Mariam,Sénégal Fast Food,Dimanche À Bamako,Mixed/Mixed Duo,2004,Traditional/African Traditional/West African,Gritty/Strumming Yearning,Medium Tempo/Medium/80s
456239240,Mantus,Traurig bin ich sowieso,Refugium,Mixed/Mixed Group,2016,Rock/Metal/Gothic Metal,Gritty/Strumming Yearning,Medium Tempo/Medium/80s
456239203,Emilie Autumn,Opheliac,Opheliac - The Deluxe Edition,Female/Female,2009,Alternative a Punk/Indie Rock/Indie Pop,Gritty/Sober / Determined,Medium Tempo/Medium/80s
456239172,Johnny Hollow,Stranger (Album Version (Explicit)),Dirty Hands (Explicit),"",2008,Rock/Mainstream Rock/General Mainstream Rock,Gritty/Sober / Determined,Medium Tempo/Medium Fast/90s
456239123,PJ Harvey,C'mon Billy,To Bring You My Love,Female/Female,1994,Alternative a Punk/Alternative/Alternative Singer-Songwriter,Gritty/Strumming Yearning,Medium Tempo/Medium/70s
456239079,Various Artists,Какой чудесный день,Любимые песни из мультфильмов,"",2005,Other/Children's/General Children's Music,Gritty/Depressed / Lonely,Medium Tempo/Medium Slow/60s
456239047,Spiritual Front,Kiss The Girls And Make Them Die,Rotten Roma Casino,Male/Male Group,2006,Alternative a Punk/Goth/Goth,Gritty/Strumming Yearning,Medium Tempo/Medium/60s
456239033,The Arcs,Pistol Made of Bones,Yours Dreamily,Male/Male Group,2015,Alternative a Punk/Indie Rock/Neo-Psychedelic,Gritty/Strumming Yearning,Medium Tempo/Medium Fast/110s
439367989,Golden Apes,The Archers,The Langsyne Litanies,"",2014,Alternative a Punk/Indie Rock/General Indie Rock,Gritty/Strumming Yearning,Medium Tempo/Medium Fast/90s
434085790,Laura Marling,Devil's Spoke,I Speak Because I Can,Female/Female,2009,Alternative a Punk/Alternative Folk/Alternative Folk,Gritty/Strumming Yearning,Medium Tempo/Medium Fast/110s
434082751,Laura Marling,The Captain And The Hourglass,Alas I Cannot Swim,Female/Female,2008,Alternative a Punk/Alternative Folk/Alternative Folk,Gritty/Sober / Determined,Medium Tempo/Medium Slow/50s
426171908,Woven Hand,Dirty Blue,Mosaic,Male/Male Group,2006,Traditional/Country/Americana,Gritty/Strumming Yearning,Medium Tempo/Medium Fast/110s
424452008,Safety Third,Lighthouse,Talking To Telescopes,"",2016,Rock/Mainstream Rock/General Mainstream Rock,Gritty/Sober / Determined,Medium Tempo/Medium/70s
425891770,Munly a The Lee Lewis Harlots,My Second Salvation Army Choir,Munly a The Lee Lewis Harlots,"",2004,Alternative a Punk/Alternative/Alternative Rock,Gritty/Gritty / Soulful,Medium Tempo/Medium Fast/100s
419830633,The Cubical,In the Night,Come Sing These Crippled Tunes,"",2015,Rock/Mainstream Rock/General Mainstream Rock,Gritty/Gritty / Soulful,Medium Tempo/Medium/80s
416781328,The Rolling Stones,100 Years Ago,Goats Head Soup,Male/Male Group,1973,Rock/70's Rock/Boogie Rock,Gritty/Strumming Yearning,Medium Tempo/Medium Slow/60s
416049103,Total Guitar Magazine,Sultans Of Swing - Complete,Total Guitar CD Vol 102,"",0,Other/Spoken Word/General Spoken Word,Gritty/Strumming Yearning,Medium Tempo/Medium/70s
415798200,Estampie,Ramunder,Secrets of the North,Mixed/Mixed Group,2013,Classical/Other Classical/General Classical,Gritty/Strumming Yearning,Medium Tempo/Medium/60s
412947824,Eric Clapton,Me And The Devil Blues,Me a Mr. Johnson,Male/Male,2004,Traditional/Electric Blues/Slide Guitar Blues,Gritty/Strumming Yearning,Medium Tempo/Medium Fast/90s
410663697,Mylène Farmer,Pourvu Qu'elles Soient Douces,Les Mots,Female/Female,2001,Pop/European Pop/French Pop,Gritty/Sober / Determined,Medium Tempo/Medium Fast/90s
409649198,Younger Brother,The Receptive,A Flock Of Bleeps,Male/Male Duo,2003,Alternative a Punk/Indie Rock/Post-Rock,Gritty/Sober / Determined,Medium Tempo/Medium/80s
408711309,Eric Clapton,Come On In My Kitchen,Me a Mr. Johnson,Male/Male,2004,Traditional/Electric Blues/Slide Guitar Blues,Gritty/Gritty / Soulful,Medium Tempo/Medium/80s
408692664,Walter Sickert a The Army Of Broken Toys,Devil's In The Details,Soft Time Traveler,"",2013,Alternative a Punk/Indie Rock/General Indie Rock,Gritty/Gritty / Soulful,Medium Tempo/Medium/70s
406259495,Soft Cell,Tainted Love,Non-Stop Erotic Cabaret,Male/Male Duo,1996,Alternative a Punk/Synth Pop/Synth Pop,Gritty/Gritty / Soulful,Medium Tempo/Medium/70s
400890320,The Blues,Evil Ways,The Blues From The Vaults vol2,"",0,Traditional/Acoustic Blues/Piano Blues,Gritty/Depressed / Lonely,Slow Tempo/Very Slow/30s
397342066,Portishead,Over,Portishead,Mixed/Mixed Group,1997,Electronica/Downtempo Lounge a Ambient/Trip Hop,Gritty/Gritty / Soulful,Medium Tempo/Medium/70s
379976856,Moriarty,Clementine,The Missing Room,Mixed/Mixed Group,2011,Alternative a Punk/Alternative Folk/Alternative Folk,Gritty/Gritty / Soulful,Medium Tempo/Medium/70s
379971646,Moriarty,I Will Do,The Missing Room,Mixed/Mixed Group,2011,Alternative a Punk/Alternative Folk/Alternative Folk,Gritty/Sober / Determined,Medium Tempo/Medium Slow/60s
379946904,Golden Apes,Rosary,The Langsyne Litanies,"",2014,Alternative a Punk/Indie Rock/General Indie Rock,Gritty/Strumming Yearning,Medium Tempo/Medium Fast/120s
376434124,Сказы Леса,Нет,НежитиеНесвятых,"",2007,Traditional/Folk/Traditional U.S. Folk,Gritty/Sober / Determined,Medium Tempo/Medium Slow/50s
374184317,The Coffinshakers,No Rest For The Wicked,We Are The Undead,"",0,Traditional/Country/General Country,Gritty/Sober / Determined,Medium Tempo/Medium/60s
373711268,Boo Boo Davis,Who Stole The Booty,Drew Mississippi,"",2006,Traditional/Electric Blues/General Blues,Gritty/Strumming Yearning,Medium Tempo/Medium Fast/90s
373500660,Clan Of Xymox,She's Dangerous,Breaking Point,Male/Male Group,2006,Alternative a Punk/Synth Pop/Synth Pop,Gritty/Strumming Yearning,Medium Tempo/Medium Slow/60s
363907062,Otis Taylor,Hey Joe,Recapturing The Banjo,Male/Male,2008,Traditional/Electric Blues/Contemporary Blues,Gritty/Sober / Determined,Medium Tempo/Medium/80s
361223930,Сергей Трофимов,На Краю,Я Скучаю По Тебе,Male/Male,2011,Pop/European Pop/Eastern European Pop,Gritty/Sober / Determined,Medium Tempo/Medium Slow/50s
361423836,АукцЫон,Все Вертится,Птица,Male/Male Group,1993,Jazz/Bebop a Modern Jazz/Avant Garde,Gritty/Strumming Yearning,Medium Tempo/Medium/80s
361224920,АукцЫон,Глаза,Птица,Male/Male Group,1993,Jazz/Bebop a Modern Jazz/Avant Garde,Gritty/Strumming Yearning,Medium Tempo/Medium/70s
360730807,Townes Van Zandt,Waitin' Around To Die,Texas Troubadour [Disc 1],Male/Male,2005,Traditional/Classic Country/Texas Country,Gritty/Gritty / Soulful,Medium Tempo/Medium Slow/50s
353779725,Theodor Bastard,Gerda,Oikoumene,Mixed/Mixed Group,2012,Rock/Mainstream Rock/General Mainstream Rock,Gritty/Strumming Yearning,Medium Tempo/Medium Fast/90s
336790860,The Coffinshakers,From Here To Hell,Coffinshakers,"",2007,Alternative a Punk/Alternative/Alternative Rock,Gritty/Strumming Yearning,Medium Tempo/Medium Fast/120s
330908822,Moondog,Stamping Ground,Moondog,Male/Male,1989,Classical/Classical Crossover/Classical Fusion,Gritty/Gritty / Soulful,Medium Tempo/Medium Fast/90s
326652569,Немного Нервно,Дыши глубже,Не Вынуждай Меня,"",2012,Traditional/Folk/Traditional U.S. Folk,Gritty/Strumming Yearning,Medium Tempo/Medium/60s
317642032,Максим Леонидов,Девочка-видение,146 минут в России,Male/Male,2004,"",Gritty/Strumming Yearning,Medium Tempo/Medium/60s
314660635,Engelsstaub,The Kingdom of Blindness,Anderswelt,Mixed/Mixed Group,1999,Alternative a Punk/Goth/Goth,Gritty/Strumming Yearning,Medium Tempo/Medium Fast/90s
311528804,Harley Poe,That Time Of The Month,Satan Sex and No Regrets,"",2012,Alternative a Punk/Alternative/Alternative Rock,Gritty/Strumming Yearning,Medium Tempo/Medium Fast/90s
293245117,Evils Toy,Inside Out,Silvertears,Male/Male Duo,2000,Alternative a Punk/Industrial/Industrial,Gritty/Sober / Determined,Medium Tempo/Medium/70s
286927803,Nick Cave a The Bad Seeds,Where The Wild Roses Grow,Murder Ballads,Mixed/Mixed Group,1996,Alternative a Punk/Indie Rock/Chamber Pop,Gritty/Strumming Yearning,Medium Tempo/Medium/70s
290087692,Von Thronstahl,THE Baltic Partisan [Interpretation],Conscriptum,"",2010,Alternative a Punk/Alternative/Alternative Rock,Gritty/Strumming Yearning,Medium Tempo/Medium Fast/90s
283608130,Deadly Avenger,DS2,Kingdom,Male/Male,2014,Electronica/Techno/Breakbeat,Gritty/Sober / Determined,Medium Tempo/Medium/70s
283382889,Diary Of Dreams,A Day in December,Elegies in Darkness,Male/Male Duo,2014,Alternative a Punk/Goth/Goth,Gritty/Strumming Yearning,Medium Tempo/Medium/70s
279501975,The Cure,In Your House,Seventeen Seconds,Male/Male Group,1980,Alternative a Punk/Alternative/Alternative Rock,Gritty/Sober / Determined,Medium Tempo/Medium Slow/50s
272088794,Johnny Cash,Hurt,American IV: The Man Comes Around,Male/Male,2002,Traditional/Classic Country/Outlaw Country,Gritty/Sober / Determined,Medium Tempo/Medium Fast/90s
267071122,Waylon Jennings,Waymore's Blues,Nashville Rebel,Male/Male,2006,Traditional/Classic Country/Outlaw Country,Gritty/Sober / Determined,Medium Tempo/Medium/70s
267070570,Black Rebel Motorcycle Club,Fault Line,Howl,Male/Male Group,2005,Alternative a Punk/Garage Rock Revival/Garage Rock Revival,Gritty/Sober / Determined,Medium Tempo/Medium/70s
266525113,Александр Башлачев,В чистом поле,Александр Башлачев. Легенды русского рока,Male/Male,2014,"",Gritty/Gritty / Soulful,Medium Tempo/Medium/80s
265334720,Сплин,Три Цвета,Акустика (Концерт В Театре Им.Станиславского),Male/Male Group,2005,"",Gritty/Strumming Yearning,Medium Tempo/Medium/70s
264232180,Primus,American Life,Sailing The Seas Of Cheese,Male/Male Group,1991,Alternative a Punk/Alternative/Funk Metal,Gritty/Gritty / Soulful,Medium Tempo/Medium Fast/90s
242621236,Anson Funderburgh a The Rockets Feat. Sam Myers,Tell Me What I Want To Hear,Live at The Grand Emporium,Male/Male Group,1995,Traditional/Electric Blues/Texas Blues,Gritty/Gritty / Soulful,Medium Tempo/Medium/60s
242442978,Beltaine,Ye Jacobites,KoncenTrad.,"",2007,Traditional/Folk/Traditional U.S. Folk,Gritty/Strumming Yearning,Medium Tempo/Medium Fast/100s
237421024,Schandmaul,Dein Anblick,Narrenkönig,Mixed/Mixed Group,2002,Rock/Mainstream Rock/General Mainstream Rock,Gritty/Strumming Yearning,Medium Tempo/Medium Fast/90s
230613245,Johnny Hollow,Gone,Johnny Hollow,"",2005,Alternative a Punk/Alternative/Alternative Rock,Gritty/Gritty / Soulful,Medium Tempo/Medium/80s
229184502,Rockers Train,True Story,Love a Culture 02,"",2005,Other/Reggae/Other Reggae,Gritty/Sober / Determined,Medium Tempo/Medium/80s
227910843,Пикник,Ночь,Новая Коллекция: Лучшие Песни Часть 1,Male/Male Group,2007,"",Gritty/Strumming Yearning,Medium Tempo/Medium/60s
219827155,Deine Lakaien,Kiss,Live in Concert,Male/Male Group,2003,Alternative a Punk/Goth/Goth,Gritty/Sober / Determined,Medium Tempo/Medium Slow/60s
218791189,Крематорий,Ромео И Джульетта,Амстердам,Male/Male Group,2008,Rock/Mainstream Rock/General Mainstream Rock,Gritty/Strumming Yearning,Medium Tempo/Medium/70s
212777758,Василий К.,Дань авангарду Feat. Интеллигенты,High,Male/Male,2007,Rock/Mainstream Rock/General Mainstream Rock,Gritty/Sober / Determined,Medium Tempo/Medium Slow/60s
211607811,Пикник,Недобитый Романтик,Железные Мантры,Male/Male Group,2008,Rock/Mainstream Rock/General Mainstream Rock,Gritty/Gritty / Soulful,Medium Tempo/Medium/60s
210380599,Die Streuner,Tourdion,Wein Weib und Gesang,Male/Male Group,2004,Alternative a Punk/Indie Rock/Dream Pop,Gritty/Strumming Yearning,Medium Tempo/Medium/80s
203602735,Botho-Lucas-Chor,Die Feder Am Sturmhut In Spiel Und Gefahren,Die Landsknechtstrommel,"",0,Traditional/Folk/Traditional U.S. Folk,Gritty/Sober / Determined,Medium Tempo/Medium/80s
197633720,Brother Dege,Too Old to Die Young,Folk Songs of the American Longhair,Male/Male,2010,Rock/Alternative Roots/Roots Rock,Gritty/Sober / Determined,Medium Tempo/Medium Slow/50s
195720145,Оргия праведников,Весна,Оглашенные изыйдите,"",2002,Rock/Hard Rock/General Hard Rock,Gritty/Strumming Yearning,Medium Tempo/Medium Fast/100s
194049141,Bjørn Berge,Crazy Times,Fretwork,Male/Male,2009,Rock/70's Rock/Blues Rock,Gritty/Strumming Yearning,Medium Tempo/Medium/60s
193351726,Various Artists,Какой чудесный день,Любимые песни из мультфильмов,"",2005,Other/Children's/General Children's Music,Gritty/Depressed / Lonely,Medium Tempo/Medium Slow/60s
193351639,Shocking Blue,Never Marry A Railroad Man,The Best Of Shocking Blue,Mixed/Mixed Group,1999,Rock/60's Rock/Acid Rock,Gritty/Strumming Yearning,Medium Tempo/Medium/60s
193280027,Tenacious D,Roadie,Rize Of The Fenix,Male/Male Duo,2012,Other/Comedy/Comedy,Gritty/Strumming Yearning,Medium Tempo/Medium Fast/90s
193275082,Vicious Crusade,Dancing On the Ledge,Forbidden Tunes,Mixed/Mixed Group,2002,Rock/Metal/Black Metal,Gritty/Strumming Yearning,Medium Tempo/Medium Fast/110s
193140247,Ian Anderson,Not Ralitsa Vassileva,Rupi's Dance,Male/Male,2003,Rock/70's Rock/Classic Prog,Gritty/Strumming Yearning,Medium Tempo/Medium/70s
189048455,Die Streuner,Der Graf,Fürsten in Lumpen und Loden,Male/Male Group,2014,Alternative a Punk/Indie Rock/Dream Pop,Gritty/Strumming Yearning,Medium Tempo/Medium/70s
189047889,Die Streuner,Der Schlemmer,Schnorrer Penner schräge Narren,Male/Male Group,2004,Alternative a Punk/Indie Rock/Dream Pop,Gritty/Strumming Yearning,Medium Tempo/Medium/60s
188637051,Seasick Steve,Cut My Wings,Dog House Music,Male/Male,2006,Traditional/Acoustic Blues/General Acoustic Blues,Gritty/Gritty / Soulful,Medium Tempo/Medium Slow/50s
186647448,Машина Времени,Перекресток,Машины Не Парковать,Male/Male Group,2009,Rock/Mainstream Rock/General Mainstream Rock,Gritty/Sober / Determined,Medium Tempo/Medium/60s
181526002,Lou Reed,Beginning Of A Great Adventure,New York,Male/Male,1989,Alternative a Punk/New Wave Rock/New Wave Rock,Gritty/Depressed / Lonely,Medium Tempo/Medium Slow/50s
180612298,Therion,Black Sun,Vovin,Mixed/Mixed Group,1998,Rock/Metal/Progressive Metal,Gritty/Strumming Yearning,Medium Tempo/Medium/60s
180039527,Johnny Cash,Ain't No Grave,American VI: Ain't No Grave,Male/Male,2010,Traditional/Classic Country/Outlaw Country,Gritty/Sober / Determined,Medium Tempo/Medium/70s
175604465,Рабфак,Новая песня о Родине,Забей!?,"",2013,Traditional/European Traditional/Eastern European,Gritty/Strumming Yearning,Medium Tempo/Medium/60s
175079523,Jace Everett,Bad Things,Jace Everett,Male/Male,2006,Traditional/Classic Country/Texas Country,Gritty/Strumming Yearning,Medium Tempo/Medium/60s
174045673,Laibach,Jesus Christ Superstars,Jesus Christ Superstars,Male/Male Group,1997,Alternative a Punk/Industrial/Industrial,Gritty/Strumming Yearning,Medium Tempo/Medium Fast/90s
172913240,Led Zeppelin,Kashmir,Physical Graffiti [Disc 1],Male/Male Group,1975,Rock/70's Rock/Classic Hard Rock,Gritty/Gritty / Soulful,Medium Tempo/Medium/80s
170983366,Mr. Eric a Mr. Michael (Eric Litwin a Michael Levine),Going On A Bear Hunt (Story Song),Yummy Yellow From The Learning Groove,"",2010,Other/Children's/General Children's Music,Gritty/Gritty / Soulful,Medium Tempo/Medium Slow/50s
167455177,Voltaire,Zombie Prostitute,Ooky Spooky,Male/Male,2007,Alternative a Punk/Goth/Goth,Gritty/Strumming Yearning,Medium Tempo/Medium/80s
162397339,Jesse Winchester,Step By Step,Let The Rough Side Drag,Male/Male,2008,Traditional/Country/General Country,Gritty/Gritty / Soulful,Medium Tempo/Medium/80s
160784538,Inner Circle,Bad Boys,Bad To The Bone,Male/Male Group,1992,Other/Reggae/Roots Reggae,Gritty/Sober / Determined,Medium Tempo/Medium/80s
