id,artist,title,album_title,artist_type,album_year,genre,mood,tempo
423891795,Randall Wong Wilbur Pauley Meredith Monk Etc.,Monk: Atlas - Part 2: Night Travel: Lonely Spirit,Atlas - An Opera In Three Parts [Disc 2],"",2008,Classical/Other Classical/General Classical,Peaceful/Reverent / Healing,Slow Tempo/Very Slow/20s
412076978,Der Blaue Reiter,Underworld Dreams,Le Paradise Funèbre L'Envers Du Tristesse,"",2006,Alternative a Punk/Goth/Goth,Peaceful/Reverent / Healing,Slow Tempo/Slow/40s
411905822,Oneiroid Psychosis,As Leaves Fell,Forever Is Forgotten,Male/Male Duo,2004,Alternative a Punk/Goth/Goth,Peaceful/Reverent / Healing,Slow Tempo/Very Slow/20s
408919786,Tuxedomoon / Cult With No Name,The Slow Club,Blue Velvet Revisited,Male/Male Group,2016,Soundtrack/Original Film/TV Music/General Film Music,Peaceful/Reverent / Healing,Medium Tempo/Medium/80s
313515123,Seven Years Lost,An Indiscernible Message,Above And Below,"",2007,Rock/Mainstream Rock/General Mainstream Rock,Peaceful/Reverent / Healing,Medium Tempo/Medium Slow/50s
237462709,Hildegard Von Bingen,Responsorio: O Vis Aeternitatis,Ave Generosa,Female/Female,0,Classical/Medieval Era/General Medieval Era,Peaceful/Reverent / Healing,Slow Tempo/Very Slow/20s
170346375,Lucas King,Fullmetal Alchemist Trisha's Lullaby,The Anime Album,"",2015,Pop/Easy Listening/Other Easy Listening,Peaceful/Reverent / Healing,Slow Tempo/Very Slow/20s
