id,artist,title,album_title,artist_type,album_year,genre,mood,tempo
251348899,Крематорий,Дрянь,Двойной Альбом,Male/Male Group,1998,Rock/Mainstream Rock/General Mainstream Rock,Upbeat/Carefree Pop,Fast Tempo/Fast/130s
192080607,Stealers Wheel,Stuck In The Middle With You,Stealers Wheel,Male/Male Duo,1972,Rock/70's Rock/Classic Pop-Rock,Upbeat/Carefree Pop,Medium Tempo/Medium Fast/120s
190115764,Royal Republic,Addictive,Royal Republic and the Nosebreakers,Male/Male Group,2014,Alternative a Punk/Alternative/Alternative Rock,Upbeat/Carefree Pop,Medium Tempo/Medium/70s
189066106,Versengold,In einem Meer Aus Wein,Hoerensagen,"",2013,Traditional/Other Traditions/General World,Upbeat/Carefree Pop,Fast Tempo/Fast/130s
168781334,Stealers Wheel,Stuck In The Middle With You,Stealers Wheel,Male/Male Duo,1972,Rock/70's Rock/Classic Pop-Rock,Upbeat/Carefree Pop,Medium Tempo/Medium Fast/120s
162670140,Goran Bregović,Kalashnikov,Make Music Not War: Kalasnikov a Kalashnikov,Male/Male,2014,Soundtrack/Original Film/TV Music/General Film Music,Upbeat/Carefree Pop,Medium Tempo/Medium/80s
