id,artist,title,album_title,artist_type,album_year,genre,mood,tempo
456239516,Andy Jackson,Ballooning,73 Days at Sea,"",2016,Rock/Mainstream Rock/General Mainstream Rock,Yearning/Energetic Dreamy,Medium Tempo/Medium Fast/110s
456239452,Kuolemanlaakso,Deeper Into The Unknown,M. Laakso Vol. 1: The Gothic Tapes,Male/Male Group,2016,Rock/Metal/Doom Metal,Yearning/Sensitive / Exploring,Medium Tempo/Medium Fast/110s
456239423,Bob Dylan,Thunder On The Mountain,Modern Times,Male/Male,2006,Rock/Folk Rock/Classic Folk Rock,Yearning/Sensitive / Exploring,Medium Tempo/Medium/70s
456239383,The Flaming Lips,Ego Tripping At The Gates Of Hell,Yoshimi Battles The Pink Robots,Male/Male Group,2002,Alternative a Punk/Indie Rock/Neo-Psychedelic,Yearning/Energetic Yearning,Medium Tempo/Medium/80s
456239378,Woven Hand,To Make A Ring,Consider The Birds,Male/Male Group,2004,Traditional/Country/Americana,Yearning/Sensitive / Exploring,Medium Tempo/Medium Fast/90s
456239376,Woven Hand,Ain't No Sunshine,Woven Hand,Male/Male Group,2002,Traditional/Country/Americana,Yearning/Sensitive / Exploring,Medium Tempo/Medium/80s
456239286,Valravn,Ólavur Riddararós,Valravn,Mixed/Mixed Group,2013,Alternative a Punk/Indie Rock/Post-Modern Art Music,Yearning/Energetic Yearning,Medium Tempo/Medium/80s
456239206,Made In Poland,Love a Mist,Future Time,"",2009,Alternative a Punk/Alternative/Alternative Rock,Yearning/Sensitive / Exploring,Medium Tempo/Medium/60s
456239178,Rotting Christ,Χ Ξ Σ [666],Κατα Τον Δαιμονα Εαυτου,Male/Male Group,2013,Rock/Metal/Black Metal,Yearning/Energetic Dreamy,Medium Tempo/Medium/80s
456239133,Nature Ganganbaigal,From Far Away,To Where Tengger Leads Me,"",2014,Traditional/Country/General Country,Yearning/Energetic Dreamy,Medium Tempo/Medium/70s
456239118,Dernière Volonté,Mes Faiblesses,Devant Le Miroir,Male/Male,2008,Alternative a Punk/Goth/Goth,Yearning/Sensitive / Exploring,Medium Tempo/Medium Fast/90s
456239113,Third Day,The Everlasting,Offerings II: All I Have to Give,Male/Male Group,2003,Other/Religious/Christian Rock a Metal,Yearning/Sensitive / Exploring,Medium Tempo/Medium/70s
456239054,U2,Red Hill Mining Town,The Joshua Tree,Male/Male Group,1987,Rock/Adult Alternative Rock/Adult Alternative Rock,Yearning/Energetic Dreamy,Medium Tempo/Medium/70s
439460187,Tiamat,Wings Of Heaven,Prey,Male/Male Group,2003,Rock/Metal/Gothic Metal,Yearning/Energetic Yearning,Medium Tempo/Medium/70s
435335970,Jamie N Commons,The Preacher,Rumble And Sway EP,Male/Male,2013,Urban/Classic RaB/Soul/RaB/Soul,Yearning/Sensitive / Exploring,Slow Tempo/Slow/40s
432367294,Dirtmusic,Black Gravity,BKO,Male/Male Group,2010,Rock/Alternative Roots/Roots Rock,Yearning/Sensitive / Exploring,Medium Tempo/Medium/70s
430460969,Woven Hand,Your Russia,Woven Hand,Male/Male Group,2002,Traditional/Country/Americana,Yearning/Sensitive / Exploring,Medium Tempo/Medium/60s
430451361,Woven Hand,Cripplegate (Standing On Glass),Blush Music,Male/Male Group,2003,Traditional/Country/Americana,Yearning/Sensitive / Exploring,Medium Tempo/Medium Slow/50s
424447416,My Dad Is Dead,Nothing Special,Shine(r),"",1996,Alternative a Punk/Alternative/Alternative Rock,Yearning/Bittersweet Pop,Medium Tempo/Medium Fast/100s
424447446,Third Coast Kings,Crush It,Third Coast Kings,"",2012,Urban/Classic RaB/Soul/Funk,Yearning/Sensitive / Exploring,Medium Tempo/Medium Fast/90s
422674221,Miossec,Mes Crimes : Le Châtiment,L'Etreinte,Male/Male,2006,Pop/European Pop/Chanson,Yearning/Energetic Yearning,Medium Tempo/Medium Fast/110s
418295471,The Black Ryder,Let Me Be Your Light,The Door Behind the Door,Mixed/Mixed Duo,2015,Alternative a Punk/Indie Rock/Shoegazer,Yearning/Energetic Dreamy,Medium Tempo/Medium Fast/90s
418278540,Delta Goodrem,Running Away,Innocent Eyes,Female/Female,2003,Pop/Western Pop/Adult Alternative Pop,Yearning/Energetic Yearning,Medium Tempo/Medium Slow/60s
416075042,Azure Ray,No Signs Of Pain,November,Female/Female Duo,2002,Alternative a Punk/Alternative Folk/Alternative Folk,Yearning/Sensitive / Exploring,Medium Tempo/Medium/80s
410665996,Mylène Farmer,Jardin De Vienne,Ainsi Soit Je,Female/Female,1988,Pop/European Pop/French Pop,Yearning/Energetic Dreamy,Medium Tempo/Medium Fast/90s
410665986,Mylène Farmer,Ainsi Soit-Je,Les Mots,Female/Female,2001,Pop/European Pop/French Pop,Yearning/Energetic Yearning,Medium Tempo/Medium Slow/60s
410429943,The Eden House,The Empty Space,Half Life,"",2013,Alternative a Punk/Alternative/Alternative Rock,Yearning/Energetic Dreamy,Medium Tempo/Medium Fast/110s
410137625,Solanaceae,Hemlock And Mandrake Fields,Solanaceae,"",2009,Traditional/Folk/Traditional U.S. Folk,Yearning/Sensitive / Exploring,Medium Tempo/Medium Fast/100s
409590733,17 Hippies,Adieu,El Dorado,Mixed/Mixed Group,2009,Pop/Western Pop/World Pop Fusion,Yearning/Sensitive / Exploring,Medium Tempo/Medium/80s
408424569,Térsivel,Those Days Are Gone,For One Pagan Brotherhood,"",2011,Rock/Metal/Heavy Metal,Yearning/Sensitive / Exploring,Medium Tempo/Medium/80s
403790473,Carla Bruni,Quelqu'un M'a Dit,Quelqu'un M'a Dit,Female/Female,2002,Pop/European Pop/French Pop,Yearning/Sensitive / Exploring,Medium Tempo/Medium/60s
401085870,Немного Нервно,Поехали Со Мной в Сибирь,Не Вынуждай Меня,"",2012,Traditional/Folk/Traditional U.S. Folk,Yearning/Energetic Yearning,Medium Tempo/Medium/70s
396818098,Nick Cave a The Bad Seeds,Spell,Abattoir Blues/The Lyre Of Orpheus [Disc 2],Male/Male Group,2004,Alternative a Punk/Indie Rock/Original Post-Punk,Yearning/Sensitive / Exploring,Medium Tempo/Medium Slow/50s
383574576,Daemonia Nymphe,Daemonos,Krataia asterope,Mixed/Mixed Group,2007,Alternative a Punk/Indie Rock/Dream Pop,Yearning/Sensitive / Exploring,Medium Tempo/Medium/80s
379746343,Moriarty,Private Lily,Gee Whiz But This Is A Lonesome Town,Mixed/Mixed Group,2007,Alternative a Punk/Alternative Folk/Alternative Folk,Yearning/Sensitive / Exploring,Medium Tempo/Medium Fast/100s
379254025,RPA a The United Nations Of Sound,Are You Ready,United Nations Of Sound,"",2010,Pop/Western Pop/Pop Vocal,Yearning/Energetic Yearning,Medium Tempo/Medium/80s
377923383,Strangeweather,We Tried To Put Our Feet To Ground But Lost Our Legs Unto The Flux,Like Shadows In Grey Rivers,"",2013,Pop/Western Pop/Pop Vocal,Yearning/Sensitive / Exploring,Medium Tempo/Medium Fast/90s
376347377,После 11,Крылья,Детям До 16,"",2009,Alternative a Punk/Alternative/Alternative Rock,Yearning/Sensitive / Exploring,Medium Tempo/Medium/70s
373734574,R.E.M.,Aftermath,Around The Sun,Male/Male Group,2004,Rock/Adult Alternative Rock/Adult Alternative Rock,Yearning/Bittersweet Pop,Medium Tempo/Medium Fast/110s
373730890,The Flaming Lips,Ego Tripping At The Gates Of Hell,Yoshimi Battles The Pink Robots,Male/Male Group,2002,Alternative a Punk/Indie Rock/Neo-Psychedelic,Yearning/Energetic Yearning,Medium Tempo/Medium/80s
373724330,Bozzio Levin Stevens,Duende,Black Light Syndrome,Male/Male Group,1997,Rock/70's Rock/Classic Prog,Yearning/Sensitive / Exploring,Medium Tempo/Medium/60s
373153739,Robert Leiner,Laniakea Part 2,Melomania,"",2015,Electronica/Electronica Mainstream/Pop Electronica,Yearning/Energetic Yearning,Medium Tempo/Medium Slow/60s
371120970,The Black Angels,Bloodhounds on My Trail,Passover,Male/Male Group,2006,Alternative a Punk/Indie Rock/Neo-Psychedelic,Yearning/Bittersweet Pop,Medium Tempo/Medium Fast/110s
175078230,Eluveitie,Isara,Everything Remains (As It Never Was),Mixed/Mixed Group,2010,Rock/Metal/Black Metal,Yearning/Bittersweet Pop,Medium Tempo/Medium/80s
367314944,Massive Attack,False Flags,Collected [Disc 2],Mixed/Mixed Group,2006,Electronica/Downtempo Lounge a Ambient/Trip Hop,Yearning/Sensitive / Exploring,Medium Tempo/Medium/70s
364714575,Moon Far Away,Цветики,Беловодие,Mixed/Mixed Group,2005,Rock/Mainstream Rock/General Mainstream Rock,Yearning/Energetic Yearning,Medium Tempo/Medium/70s
412116832,The Darling Buds,One Thing Leads To Another,Erotica,Mixed/Mixed Group,1992,Alternative a Punk/Alternative/Alternative Pop,Yearning/Energetic Dreamy,Medium Tempo/Medium/70s
361423261,7б,Моя Любовь,Лучшие Песни,Male/Male Group,2012,Rock/Mainstream Rock/General Mainstream Rock,Yearning/Energetic Yearning,Medium Tempo/Medium Fast/100s
347255686,Ю-Питер,Чудеса Небесны,Имя Рек,Male/Male Group,2003,Rock/Mainstream Rock/General Mainstream Rock,Yearning/Energetic Yearning,Medium Tempo/Medium Fast/110s
336188663,Zero 7,I Have Seen,Simple Things,Mixed/Mixed Group,2001,Electronica/Downtempo Lounge a Ambient/General Downtempo,Yearning/Sensitive / Exploring,Medium Tempo/Medium/70s
325832567,Primus,Over The Falls,Brown Album,Male/Male Group,1997,Alternative a Punk/Alternative/Funk Metal,Yearning/Sensitive / Exploring,Medium Tempo/Medium Fast/90s
326492411,三代目 J Soul Brothers from EXILE TRIBE,Summer Dreams Come True,PLANET SEVEN,Male/Male Group,2015,Pop/Japanese Pop/J-Pop,Yearning/Energetic Yearning,Medium Tempo/Medium Fast/110s
320613267,Mantas,Legion of Doom (Death By Metal 1st Version Demo),Death By Metal,Mixed/Mixed Group,2012,Rock/Metal/Industrial Metal,Yearning/Sensitive / Exploring,Medium Tempo/Medium/60s
313517377,Android Lust,Cruelty (Desolate),Evolution,Female/Female,1998,Alternative a Punk/Goth/Goth,Yearning/Energetic Dreamy,Medium Tempo/Medium Fast/100s
286848164,Wir Sind Helden,Du Erkennst Mich Nicht Wieder,Die Reklamation,Mixed/Mixed Group,2003,Pop/European Pop/German Pop,Yearning/Energetic Yearning,Medium Tempo/Medium Fast/100s
286256745,Dolphin,Весна,Звезда,Male/Male,2004,Rock/Mainstream Rock/General Mainstream Rock,Yearning/Energetic Yearning,Medium Tempo/Medium Fast/110s
277290730,Ногу Свело!,Идём на восток!,Идём На Восток!,Male/Male Group,2005,Rock/Mainstream Rock/General Mainstream Rock,Yearning/Energetic Yearning,Medium Tempo/Medium/70s
270203887,Bleak,Darkness,Vane,Male/Male,1995,Alternative a Punk/Goth/Goth,Yearning/Energetic Dreamy,Fast Tempo/Fast/130s
269281359,Hat,The Angry River (Featuring Father John Misty and S.I. Istwa) [Theme From the HBO® Series True Detective],The Angry River (Featuring Father John Misty and S.I. Istwa) [From the HBO® Series True Detective],Male/Male Group,2014,Electronica/Techno/Intelligent (IDM),Yearning/Sensitive / Exploring,Medium Tempo/Medium/80s
261814339,Jean Michel Jarre,Second Rendez-Vous,Rendez-Vous,Male/Male,1986,Other/Meditative a Space/Progressive Electronic,Yearning/Energetic Dreamy,Medium Tempo/Medium/60s
253886806,Mantus,Dunkler Engel,Ein Hauch von Wirklichkeit,Mixed/Mixed Group,2008,Rock/Metal/Gothic Metal,Yearning/Energetic Dreamy,Medium Tempo/Medium/60s
250321807,Brother Dege,The Battle of New Orleans,Folk Songs of the American Longhair,Male/Male,2010,Rock/Alternative Roots/Roots Rock,Yearning/Sensitive / Exploring,Medium Tempo/Medium/70s
237417572,Frei.Wild,Freiheit,Wo die Sonne wieder lacht,Male/Male Group,2010,Alternative a Punk/Punk/Hardcore Punk,Yearning/Sensitive / Exploring,Medium Tempo/Medium/70s
230312128,Bjørn Berge,Ramblin' on My Mind,Mad Fingers Ball,Male/Male,2013,Rock/70's Rock/Blues Rock,Yearning/Sensitive / Exploring,Medium Tempo/Medium Fast/110s
230293899,Oddland,In Endless Endeavour,The Treachery Of Senses,"",2012,Rock/Metal/Heavy Metal,Yearning/Sensitive / Exploring,Medium Tempo/Medium Fast/110s
226437154,Bjørn Berge,Zebra,Fretwork,Male/Male,2009,Rock/70's Rock/Blues Rock,Yearning/Energetic Yearning,Medium Tempo/Medium Fast/90s
212784468,Агата Кристи,Пароль,Эпилог,Male/Male Group,2010,Rock/Mainstream Rock/General Mainstream Rock,Yearning/Sensitive / Exploring,Medium Tempo/Medium Slow/60s
212110491,Godsmack,Serenity,Faceless,Male/Male Group,2003,Rock/Metal/Nu-Metal,Yearning/Sensitive / Exploring,Medium Tempo/Medium Fast/110s
206699613,Tiamat,The Sun Also Rises,The Scarred People,Male/Male Group,2012,Rock/Metal/Gothic Metal,Yearning/Energetic Yearning,Medium Tempo/Medium/60s
206221932,Ernst Busch  ,Der Heimliche Aufmarsch,Lieder Der Arbeiterklasse Und Aus Dem Spanischen Bürgerkrieg,Male/Male,1989,Pop/Western Pop/Other Pop,Yearning/Bittersweet Pop,Medium Tempo/Medium Fast/120s
199467625,Eels,Lone Wolf,Shootenanny!,Male/Male Group,2003,Alternative a Punk/Indie Rock/General Indie Rock,Yearning/Sensitive / Exploring,Medium Tempo/Medium Slow/60s
194351268,Frank Black,I Burn Today (live The Night Light lounge Sept 2006),Christmass,Male/Male,2006,Alternative a Punk/Alternative/Alternative Singer-Songwriter,Yearning/Sensitive / Exploring,Medium Tempo/Medium Fast/100s
193699894,Bjørn Berge,Accused,Blackwood,Male/Male,2011,Rock/70's Rock/Blues Rock,Yearning/Energetic Yearning,Medium Tempo/Medium/70s
190803505,Сектор Газа,Ночь Перед Рождеством,Звездная Серия [Disc 1],Male/Male Group,2003,"",Yearning/Bittersweet Pop,Fast Tempo/Fast/150s
189703929,L'Âme Immortelle,Dein Herz,Auf deinen Schwingen,Male/Male Group,2006,Rock/Metal/Gothic Metal,Yearning/Energetic Yearning,Medium Tempo/Medium/80s
189213588,Eddie Vedder,Hard Sun,Into The Wild,Male/Male,2007,Rock/Adult Alternative Rock/Adult Alternative Rock,Yearning/Sensitive / Exploring,Medium Tempo/Medium/70s
189039398,Letzte Instanz,Mein Leben,Schuldig,Male/Male Group,2009,Alternative a Punk/Indie Rock/Dream Pop,Yearning/Energetic Yearning,Medium Tempo/Medium/70s
188636574,The 69 Eyes,Sister Of Charity,Devils,Male/Male Group,2005,Alternative a Punk/Goth/Goth,Yearning/Energetic Yearning,Medium Tempo/Medium/60s
183819871,Katzenjammer,To The Sea,Le Pop,Female/Female Group,2008,Alternative a Punk/Indie Rock/Indie Pop,Yearning/Energetic Yearning,Medium Tempo/Medium Fast/120s
177321208,SuidAkrA,Ár Nasc Fola,Crogacht,Mixed/Mixed Group,2009,Rock/Metal/Black Metal,Yearning/Sensitive / Exploring,Medium Tempo/Medium Fast/90s
176064349,Eluveitie,Brictom,Evocation I - The Arcane Dominion [Exclusive Bonus Version],Mixed/Mixed Group,2009,Rock/Metal/Black Metal,Yearning/Energetic Yearning,Medium Tempo/Medium Fast/90s
173010782,Hypocrisy,Paled Empty Sphere,Hypocrisy,Male/Male Group,1999,Rock/Metal/Death Metal,Yearning/Energetic Dreamy,Medium Tempo/Medium Fast/110s
173009624,Гражданская Оборона,Солнце взойдет,Звездопад,Mixed/Mixed Group,2002,"",Yearning/Energetic Dreamy,Medium Tempo/Medium/80s
170460325,audiomachine,Reaching,Chronicles,Mixed/Mixed Group,2012,Pop/Western Pop/Pop Vocal,Yearning/Energetic Dreamy,Medium Tempo/Medium Fast/100s
167248687,Landser,Rebell,Rock Gegen Oben,Male/Male Group,1997,Alternative a Punk/Punk/Hardcore Punk,Yearning/Sensitive / Exploring,Medium Tempo/Medium/60s
166716712,The Birthday Massacre,Pale,Pins and Needles,Mixed/Mixed Group,2010,Alternative a Punk/Goth/Goth,Yearning/Energetic Yearning,Medium Tempo/Medium Fast/90s
166261042,Eluveitie,Setlon,Everything Remains (As It Never Was),Mixed/Mixed Group,2010,Rock/Metal/Black Metal,Yearning/Energetic Dreamy,Medium Tempo/Medium Fast/110s
165958172,Iron Maiden,Blood Brothers,Brave New World,Male/Male Group,2000,Rock/Metal/Classic British Metal,Yearning/Energetic Yearning,Medium Tempo/Medium Fast/90s
158899008,Гражданская Оборона,Без меня,Коллекция легендарных песен,Mixed/Mixed Group,2014,Rock/Mainstream Rock/General Mainstream Rock,Yearning/Energetic Dreamy,Medium Tempo/Medium Fast/110s
