id,artist,title,album_title,artist_type,album_year,genre,mood,tempo
366416714,2CELLOS,Shape of My Heart,Celloverse,Male/Male Duo,2015,Classical/Classical Crossover/Classical Crossover Instrumental,Melancholy/Light Melancholy,Slow Tempo/Slow/40s
366416139,2CELLOS,Highway To Hell,In2ition,Male/Male Group,2012,Classical/Classical Crossover/Classical Crossover Instrumental,Rowdy/Confident / Tough,Medium Tempo/Medium Fast/120s
366416044,2CELLOS,Californication,In2ition,Male/Male Duo,2012,Classical/Classical Crossover/Classical Crossover Instrumental,Melancholy/Wistful / Forlorn,Medium Tempo/Medium Slow/60s
366415536,2CELLOS,Supermassive Black Hole,In2ition,Mixed/Mixed Group,2012,Alternative a Punk/Indie Rock/Chamber Pop,Defiant/Heavy Brooding,Medium Tempo/Medium Fast/120s
366414880,2CELLOS,They Don't Care About Us,Celloverse,Male/Male Duo,2015,Classical/Classical Crossover/Classical Crossover Instrumental,Fiery/Fiery Groove,Medium Tempo/Medium Fast/90s
