id,artist,title,album_title,artist_type,album_year,genre,mood,tempo
456239023,Друга Рiка,Хто якщо не ти?,Supernation,Male/Male Group,2014,"","",""
360821097,Друга Рiка,Париж(дай мені вогню),Supernation,Male/Male Group,2014,"","",""
344476632,Друга Рiка,Там де ти,Dенніч,Male/Male Group,2006,"",Yearning/Sensitive / Exploring,Medium Tempo/Medium/80s
339750085,Друга Рiка,Sam sobi ostriv (Сам собі острів),Rekordy (Рекорди),Male/Male Group,2005,Rock/Mainstream Rock/General Mainstream Rock,Yearning/Energetic Yearning,Medium Tempo/Medium/80s
270819131,Друга Рiка,Try hvylyny (Три хвилини),Rekordy (Рекорди),Male/Male Group,2005,Rock/Mainstream Rock/General Mainstream Rock,Sentimental/Tender / Sincere,Medium Tempo/Medium Slow/50s
