id,artist,title,album_title,artist_type,album_year,genre,mood,tempo
456239185,The Rasmus,Immortal,Hide From The Sun,Male/Male Group,2005,Alternative a Punk/Alternative/Alternative Rock,Defiant/Heavy Brooding,Medium Tempo/Medium/70s
456239183,The Rasmus,Lucifer's Angel,Hide From The Sun,Male/Male Group,2005,Alternative a Punk/Alternative/Alternative Rock,Defiant/Heavy Brooding,Medium Tempo/Medium/70s
456239165,Paper Route,Real Emotion,Real Emotion,Male/Male Group,2016,Alternative a Punk/Synth Pop/Synth Pop,Brooding/Dreamy Brooding,Medium Tempo/Medium/70s
456239141,Manowar,Die For Metal,Gods Of War,Male/Male Group,2007,Rock/Metal/Power Metal,Aggressive/Aggressive Power,Medium Tempo/Medium/70s
456239128,Stateless,Bloodstream,Stateless,Male/Male Group,2007,Alternative a Punk/Indie Rock/Post-Modern Art Music,Sensual/Intimate,Medium Tempo/Medium/70s
456239114,Low Roar,I'Ll Keep Coming,0,Male/Male Group,2014,Alternative a Punk/Indie Rock/Post-Modern Art Music,Brooding/Dreamy Brooding,Medium Tempo/Medium/70s
456239098,Francesca Michielin,Nessun Grado Di Separazione,Di20are,Female/Female,2016,Pop/European Pop/Mediterranean Pop,Yearning/Energetic Yearning,Medium Tempo/Medium/70s
456239082,Stanislav Artemyev,Time,Creatio,"",2015,Alternative a Punk/Alternative/Alternative Rock,Tender/Romantic / Lyrical,Medium Tempo/Medium/70s
456239065,Ramona Falls,Spore,Prophet,Mixed/Mixed Group,2012,Alternative a Punk/Indie Rock/General Indie Rock,Brooding/Dreamy Brooding,Medium Tempo/Medium/70s
456239061,Mutemath,You Are Mine,Mutemath,Male/Male Group,2006,Alternative a Punk/Alternative/Alternative Rock,Melancholy/Light Melancholy,Medium Tempo/Medium/70s
456239033,Caro Emerald,The Wonderful In You,The Shocking Miss Emerald,Female/Female,2013,Jazz/Jazz Vocals/Jazz Vocals,Easygoing/Friendly,Medium Tempo/Medium/70s
443450694,Hedged,Every Time I Call,Serving Time,"",2008,Rock/Mainstream Rock/General Mainstream Rock,Defiant/Heavy Brooding,Medium Tempo/Medium/70s
435603463,KONAMI,Shot Down in Flames,SILENT HILL ZERO ORIGINAL SOUNDTRACK,Unknown/Other,2008,Soundtrack/Game Music/Game Music,Defiant/Heavy Brooding,Medium Tempo/Medium/70s
429447048,Rushnychok (Рушничок),Moon and the Stars - Місяць і зіроньки,Rushnychok Vol. 5,"",2012,Traditional/Other Traditions/General World,Romantic/Heartfelt Passion,Medium Tempo/Medium/70s
428691497,Tarja Turunen,I Walk Alone (Live At Teatro El Círculo Rosario Argentina/2012),Act 1 (Live At Teatro El Círculo Rosario Argentina/2012) [Disc 1],Female/Female,2012,Rock/Metal/Progressive Metal,Brooding/Evocative / Intriguing,Medium Tempo/Medium/70s
420170885,Elizaveta,Meant,Beatrix Runs,Female/Female,2012,Alternative a Punk/Indie Rock/Indie Pop,Brooding/Dreamy Brooding,Medium Tempo/Medium/70s
419631257,Kila,Dusty Wine Bottle,The Best Of Kila,"",2009,Traditional/Other Traditions/General World,Romantic/Dramatic / Romantic,Medium Tempo/Medium/70s
414946310,UNKLE,When Things Explode (Featuring Ian Astbury),War Stories,Male/Male Group,2007,Electronica/Downtempo Lounge a Ambient/Trip Hop,Brooding/Dreamy Brooding,Medium Tempo/Medium/70s
402588376,Muse,New Born,Origin Of Symmetry,Male/Male Group,2001,Alternative a Punk/Alternative/Alternative Rock,Brooding/Alienated / Brooding,Medium Tempo/Medium/70s
402587741,Muse,Feeling Good,Origin Of Symmetry,Male/Male Group,2001,Alternative a Punk/Alternative/Alternative Rock,Brooding/Evocative / Intriguing,Medium Tempo/Medium/70s
395987519,Isaac Shepard,Sprinkle to Rain,Swept Away,"",2005,Alternative a Punk/Alternative/Alternative Rock,Romantic/Dramatic / Romantic,Medium Tempo/Medium/70s
395300829,Fabrizio Paterlini,Veloma,Fragments Viandanze,Male/Male,0,Other/New Age/New Acoustic,Tender/Romantic / Lyrical,Medium Tempo/Medium/70s
393851786,DJ Vadim,Beyond Thought,U.S.S.R. Reconstruction,Male/Male,2005,Electronica/Downtempo Lounge a Ambient/Ambient Electronica,Sensual/Dreamy Pulse,Medium Tempo/Medium/70s
393063154,Apocalyptica,Faraway,Reflections,Male/Male Group,2003,Rock/Metal/Progressive Metal,Romantic/Dramatic / Romantic,Medium Tempo/Medium/70s
389277478,Metronomy,Trouble,The English Riviera,Mixed/Mixed Group,2011,Alternative a Punk/Synth Pop/Synth Pop,Brooding/Dreamy Brooding,Medium Tempo/Medium/70s
389225487,Bethel Music,This Is What You Do,The Loft Sessions,Mixed/Mixed Group,2012,Other/Religious/Christian Alt-Rock,Brooding/Dreamy Brooding,Medium Tempo/Medium/70s
388030549,M83,I Need You,Divergent: Original Motion Picture Soundtrack,Mixed/Mixed Group,2014,Alternative a Punk/Indie Rock/Dream Pop,Brooding/Dreamy Brooding,Medium Tempo/Medium/70s
380676405,She Wants Revenge,Rachael,This Is Forever,Male/Male Duo,2007,Alternative a Punk/Indie Rock/Post-Punk Revival,Brooding/Alienated / Brooding,Medium Tempo/Medium/70s
379976684,a-ha,Stop! And Make Your Mind Up,Hunting High And Low [Disc 2],Male/Male Group,1985,Alternative a Punk/New Wave Pop/New Wave Pop,Stirring/Jubilant / Soulful,Medium Tempo/Medium/70s
372574980,I Monster,Daydream In Blue,neveroddoreven,Male/Male Duo,2004,Electronica/Downtempo Lounge a Ambient/General Downtempo,Sensual/Dreamy Pulse,Medium Tempo/Medium/70s
367198897,The Daydream Club,Soundwaves Of Gold,Found,"",2013,Alternative a Punk/Alternative/Alternative Rock,Gritty/Strumming Yearning,Medium Tempo/Medium/70s
363769167,Emilie Autumn,Juliet,Enchant,Female/Female,2001,Alternative a Punk/Indie Rock/Indie Pop,Yearning/Energetic Yearning,Medium Tempo/Medium/70s
345397823,The Kooks,Melody Maker,Listen [Bonus Tracks],Male/Male Group,2014,Alternative a Punk/Indie Rock/Indie Pop,Gritty/Sober / Determined,Medium Tempo/Medium/70s
340807669,Различные Исполнители,Дела Людей Которые Были До Нас,Рок Сейшн,"",1999,Rock/70's Rock/Classic Pop-Rock,Sensual/Sensual Groove,Medium Tempo/Medium/70s
337715161,Velojet,I Follow My Heart,This Quiet Town,Mixed/Mixed Group,2007,Alternative a Punk/Indie Rock/Indie Pop,Defiant/Heavy Brooding,Medium Tempo/Medium/70s
335746018,Boy Kill Boy,Promises,Stars And The Sea,Male/Male Group,2008,Alternative a Punk/Indie Rock/Post-Punk Revival,Defiant/Heavy Brooding,Medium Tempo/Medium/70s
334990273,The Constellations,Perfect Day,Southern Gothic,Mixed/Mixed Group,2010,Alternative a Punk/Alternative/Alternative Rock,Sensual/Dreamy Pulse,Medium Tempo/Medium/70s
331442861,Boston,Let Me Take You Home Tonight,Boston,Male/Male Group,1976,Rock/70's Rock/Classic Rock,Empowering/Idealistic / Stirring,Medium Tempo/Medium/70s
329382612,The Hardkiss,Stones,Stones and Honey,Mixed/Mixed Group,2014,Electronica/Electronica Mainstream/Pop Electronica,Sophisticated/Smoky / Romantic,Medium Tempo/Medium/70s
328377681,Noel Gallagher's High Flying Birds,Let The Lord Shine A Light On Me,Noel Gallagher's High Flying Birds,Male/Male Group,2011,Alternative a Punk/Alternative/Alternative Pop,Brooding/Dreamy Brooding,Medium Tempo/Medium/70s
327893791,Vivienne Mort,Лети,Лети,"",2014,Pop/Western Pop/Pop Vocal,Gritty/Strumming Yearning,Medium Tempo/Medium/70s
326940888,Various Artists,Towards The Within,Voce: Music From Women Of The World,"",1999,Pop/Easy Listening/Other Easy Listening,Serious/Hypnotic Rhythm,Medium Tempo/Medium/70s
326911922,Various Artists,Towards The Within,Voce: Music From Women Of The World,"",1999,Pop/Easy Listening/Other Easy Listening,Serious/Hypnotic Rhythm,Medium Tempo/Medium/70s
325526911,Coldplay,Shiver,Parachutes,Male/Male Group,2000,Alternative a Punk/Brit Rock/Brit Rock,Upbeat/Happy / Soulful,Medium Tempo/Medium/70s
320239959,XIII. Století,Transylvanian Werewolf,Werewolf,Mixed/Mixed Group,2008,Rock/Metal/Gothic Metal,Defiant/Heavy Brooding,Medium Tempo/Medium/70s
315510693,Alina Orlova,Menulis,Дикая Собака Динго,Female/Female,2008,Pop/European Pop/Eastern European Pop,Energizing/Edgy / Sexy,Medium Tempo/Medium/70s
314785791,Broods,Everytime,Evergreen,Mixed/Mixed Duo,2014,Alternative a Punk/Synth Pop/Synth Pop,Defiant/Heavy Brooding,Medium Tempo/Medium/70s
312669136,José González,Step Out,Step Out,Male/Male,0,Alternative a Punk/Indie Rock/General Indie Rock,Empowering/Powerful / Heroic,Medium Tempo/Medium/70s
310694364,KONAMI,Shot Down in Flames,SILENT HILL ZERO ORIGINAL SOUNDTRACK,Unknown/Other,2008,Soundtrack/Game Music/Game Music,Defiant/Heavy Brooding,Medium Tempo/Medium/70s
310056310,Rise Against,Hero Of War,Appeal To Reason,Male/Male Group,2008,Alternative a Punk/Punk/Hardcore Punk,Empowering/Strong / Stable,Medium Tempo/Medium/70s
309431462,Portugal. The Man,Sleep Forever,In The Mountain In The Cloud,Male/Male Group,2011,Alternative a Punk/Indie Rock/General Indie Rock,Brooding/Dreamy Brooding,Medium Tempo/Medium/70s
307271736,Darren Korb,Paper Boats,Transistor Original Soundtrack,Mixed/Mixed Duo,2014,Soundtrack/Game Music/Game Music,Urgent/Energetic Anxious,Medium Tempo/Medium/70s
306216515,Alina Orlova,Sirdis,Mutabor,Female/Female,2011,Pop/European Pop/Eastern European Pop,Melancholy/Wistful / Forlorn,Medium Tempo/Medium/70s
305566669,Kongos,Nothing,Kongos,Male/Male Group,2007,Alternative a Punk/Alternative/Alternative Rock,Yearning/Energetic Yearning,Medium Tempo/Medium/70s
305383992,Sunrise Avenue,Forever Yours,On The Way To Wonderland,Male/Male Group,2006,Alternative a Punk/Alternative/Alternative Rock,Defiant/Heavy Brooding,Medium Tempo/Medium/70s
302590233,System Of A Down,Lonely Day,Hypnotize,Male/Male Group,2005,Rock/Metal/Nu-Metal,Sophisticated/Smoky / Romantic,Medium Tempo/Medium/70s
302447256,Tyler Ward,Falling,Honestly,Male/Male,2013,Pop/Western Pop/Adult Alternative Pop,Empowering/Dramatic Emotion,Medium Tempo/Medium/70s
301786810,Megadeth,Promises,The World Needs A Hero,Male/Male Group,2001,Rock/Metal/Speed Metal,Defiant/Heavy Brooding,Medium Tempo/Medium/70s
301796383,Green Day,Holiday,American Idiot,Male/Male Group,2004,Alternative a Punk/Punk/Pop Punk,Defiant/Heavy Brooding,Medium Tempo/Medium/70s
295897171,Robert Wells,Chopin: Fantasie,Robert Wells,Male/Male,1994,Rock/70's Rock/Classic Prog,Sentimental/Cool Melancholy,Medium Tempo/Medium/70s
295889395,Blackstreet,I'm Sorry,Finally,Male/Male Group,1999,Urban/Contemporary RaB/Soul/Urban Crossover,Sensual/Intimate,Medium Tempo/Medium/70s
290865683,David Garrett,Who Wants To Live Forever?,Encore,Male/Male,2008,Classical/Classical Crossover/Classical Crossover Instrumental,Romantic/Dramatic / Romantic,Medium Tempo/Medium/70s
287347656,Esthetic Education,Vasil Vasiltsiv,Werewolf,"",2007,Rock/Mainstream Rock/General Mainstream Rock,Brooding/Dreamy Brooding,Medium Tempo/Medium/70s
284124623,The Servant,Cells (Instrumental),Liquefy [EP],Male/Male Group,2006,Alternative a Punk/Alternative/Alternative Rock,Brooding/Alienated / Brooding,Medium Tempo/Medium/70s
276254997,Three Days Grace,The High Road,Transit Of Venus,Male/Male Group,2012,Alternative a Punk/Alternative/Alternative Rock,Empowering/Powerful / Heroic,Medium Tempo/Medium/70s
276109128,Hooverphonic,Devil Kind of Girl,Reflection,Mixed/Mixed Group,2013,Electronica/Downtempo Lounge a Ambient/General Downtempo,Rowdy/Ramshackle / Rollicking,Medium Tempo/Medium/70s
273162035,The 69 Eyes,Lost Boys,Devils,Male/Male Group,2005,Alternative a Punk/Goth/Goth,Defiant/Heavy Brooding,Medium Tempo/Medium/70s
267513364,Keane,She Has No Time,Hopes a Fears,Male/Male Group,2004,Alternative a Punk/Brit Rock/Brit Rock,Somber/Enigmatic / Mysterious,Medium Tempo/Medium/70s
251977914,The Hardkiss,Tell Me Brother,Stones and Honey,Mixed/Mixed Group,2014,Electronica/Electronica Mainstream/Pop Electronica,Defiant/Heavy Brooding,Medium Tempo/Medium/70s
250317918,Revolver,Leave Me Alone,Music For A While,Male/Male Group,2009,Alternative a Punk/Indie Rock/Indie Pop,Sentimental/Gentle Bittersweet,Medium Tempo/Medium/70s
249698436,Hans Zimmer,Panic Shear Bloody Panic,Sherlock Holmes,Male/Male,2010,Soundtrack/Original Film/TV Music/General Film Music,Serious/Thrilling,Medium Tempo/Medium/70s
244169869,Joshua Bell John Williams: London Symphony Orchestra,Gershwin: Our Love Is Here To Stay,Gershwin Fantasy,Mixed/Mixed Group,1998,Classical/Other Classical/General Classical,Tender/Refined / Mannered,Medium Tempo/Medium/70s
241545929,David Cook,Avalanche,David Cook,Male/Male,2008,Rock/Adult Alternative Rock/Adult Alternative Rock,Empowering/Powerful / Heroic,Medium Tempo/Medium/70s
234993446,No Doubt,Don't Speak,Tragic Kingdom,Mixed/Mixed Group,1995,Alternative a Punk/Alternative/Alternative Pop,Brooding/Evocative / Intriguing,Medium Tempo/Medium/70s
234979773,Daniel Powter,Bad Day,Daniel Powter,Male/Male,2005,Pop/Western Pop/Adult Alternative Pop,Empowering/Strong / Stable,Medium Tempo/Medium/70s
229141849,Karl Jenkins,Cantus - Song Of Tears,Adiemus II: Cantata Mundi,Mixed/Mixed Group,1997,Classical/Classical Crossover/Classical Crossover Vocal,Serious/Thrilling,Medium Tempo/Medium/70s
229135184,Adiemus Best Dreams,Cantus - Song Of Tears,Mystic Hits Volume 3,"",0,Other/New Age/General New Age,Serious/Thrilling,Medium Tempo/Medium/70s
228933562,Сергей Бабкин,Возьми Меня,Сергевна,Male/Male,2013,"",Yearning/Sensitive / Exploring,Medium Tempo/Medium/70s
228932668,Сергей Бабкин,Забери,Ура!,Male/Male,2004,"",Sentimental/Tender / Sincere,Medium Tempo/Medium/70s
226807679,Stabilo,Everybody,Happiness a Disaster,Male/Male Group,2006,Alternative a Punk/Alternative/Alternative Rock,Excited/Upbeat Pop Groove,Medium Tempo/Medium/70s
226212382,Ashram,Maria and the Violin's String,Shining Silver Skies,Male/Male Group,2006,Other/New Age/New Acoustic,Melancholy/Wistful / Forlorn,Medium Tempo/Medium/70s
213647006,Keane,A Bad Dream,Under The Iron Sea,Male/Male Group,2006,Alternative a Punk/Brit Rock/Brit Rock,Yearning/Energetic Dreamy,Medium Tempo/Medium/70s
208971628,Kevin Rudolf,In The City,In The City [Explicit],Male/Male,2008,Pop/Western Pop/Urban Crossover: Pop,Urgent/Energetic Anxious,Medium Tempo/Medium/70s
208420164,Oasis,I'm Outta Time,Dig Out Your Soul,Male/Male Group,2008,Alternative a Punk/Brit Pop/Brit Pop,Brooding/Dreamy Brooding,Medium Tempo/Medium/70s
206392264,Puggy,Teaser,Something You Might Like,Male/Male Group,2009,Pop/Western Pop/Adult Alternative Pop,Rowdy/Ramshackle / Rollicking,Medium Tempo/Medium/70s
206109132,My Chemical Romance,The Sharpest Lives,The Black Parade,Male/Male Group,2006,Alternative a Punk/Emo a Hardcore/Emo,Urgent/Energetic Anxious,Medium Tempo/Medium/70s
204983978,Simple Plan,Astronaut,Get Your Heart On!,Male/Male Group,2011,Alternative a Punk/Punk/Pop Punk,Yearning/Energetic Yearning,Medium Tempo/Medium/70s
202876081,Hinder,Bliss (I Don't Wanna Know),Extreme Behavior,Male/Male Group,2005,Alternative a Punk/Alternative/Alternative Rock,Empowering/Powerful / Heroic,Medium Tempo/Medium/70s
201047699,Stateless,Bloodstream,Stateless,Male/Male Group,2007,Alternative a Punk/Indie Rock/Post-Modern Art Music,Sensual/Intimate,Medium Tempo/Medium/70s
192849160,John Murphy,Don Abandons Alice,28 Weeks Later,Male/Male,2007,Soundtrack/Original Film/TV Music/General Film Music,Brooding/Alienated / Brooding,Medium Tempo/Medium/70s
189746753,Snow Patrol,The Lightning Strike (What If This Storm Ends?),Greatest Hits,Male/Male Group,2013,Alternative a Punk/Brit Rock/Brit Rock,Brooding/Dreamy Brooding,Medium Tempo/Medium/70s
185985795,Michael Bublé,Feeling Good,It's Time,Male/Male,2005,Pop/Classic Pop Vocals/Classic Male Vocal Pop,Brooding/Evocative / Intriguing,Medium Tempo/Medium/70s
185649734,Nina Simone,Feeling Good (Joe Claussell Remix),Feeling Good (Joe Claussell Remix),Female/Female,0,Jazz/Jazz Vocals/Jazz Vocals,Sensual/Dreamy Pulse,Medium Tempo/Medium/70s
184699225,The Fray,You Found Me,The Fray,Male/Male Group,2009,Rock/Adult Alternative Rock/Adult Alternative Rock,Empowering/Powerful / Heroic,Medium Tempo/Medium/70s
184328473,Florence + The Machine,Dog Days Are Over,Lungs,Mixed/Mixed Group,2009,Alternative a Punk/Alternative/Alternative Singer-Songwriter,Empowering/Powerful / Heroic,Medium Tempo/Medium/70s
184328461,Florence + The Machine,Cosmic Love,Lungs,Mixed/Mixed Group,2009,Alternative a Punk/Alternative/Alternative Singer-Songwriter,Sophisticated/Smoky / Romantic,Medium Tempo/Medium/70s
180181439,Gavin DeGraw,I Don't Want To Be,Chariot,Male/Male,2003,Pop/Western Pop/Adult Alternative Pop,Defiant/Heavy Brooding,Medium Tempo/Medium/70s
167007409,Brainstorm,Kitten Who Did Not Want To Give Up,Online,Male/Male Group,2001,Pop/European Pop/Eastern European Pop,Rowdy/Driving Dark Groove,Medium Tempo/Medium/70s
145072034,Regina Spektor,Dance Anthem Of The 80's,Far,Female/Female,2009,Alternative a Punk/Indie Rock/Indie Pop,Gritty/Gritty / Soulful,Medium Tempo/Medium/70s
143577496,IAMX,Think Of England,Kingdom Of Welcome Addiction,Male/Male Group,2009,Alternative a Punk/Indie Rock/Post-Punk Revival,Yearning/Energetic Yearning,Medium Tempo/Medium/70s
140529460,安室奈美恵,arigatou <thank the world for LOVE... gift song for 2011>,Sit! Stay! Wait! Down! / Love Story,Female/Female,2011,Pop/Japanese Pop/J-Pop,Empowering/Dramatic Emotion,Medium Tempo/Medium/70s
118193498,Radiohead,Karma Police,OK Computer,Male/Male Group,1997,Alternative a Punk/Brit Rock/Brit Rock,Brooding/Dreamy Brooding,Medium Tempo/Medium/70s
118104608,Oasis,Stop Crying Your Heart Out,Heathen Chemistry,Male/Male Group,2002,Alternative a Punk/Brit Pop/Brit Pop,Brooding/Dreamy Brooding,Medium Tempo/Medium/70s
104683218,Dr. Dre Feat. Eminem a Skylar Grey,I Need A Doctor (Edited Version),I Need A Doctor,Mixed/Mixed Group,2010,Urban/Western Hip-Hop/Rap/General Hip-Hop/Rap,Brooding/Dreamy Brooding,Medium Tempo/Medium/70s
76262971,Kings Of Convenience,I'd Rather Dance With You,Riot On An Empty Street,Male/Male Duo,2004,Alternative a Punk/Alternative/Alternative Singer-Songwriter,Gritty/Strumming Yearning,Medium Tempo/Medium/70s
75151625,Villeneuve,Tomorrow - Never,First Date,Mixed/Mixed Group,2005,Alternative a Punk/Indie Rock/Post-Modern Electronic Pop,Brooding/Dreamy Brooding,Medium Tempo/Medium/70s
74063071,Positive Reggae Music,(1) Jah Is Good (2) Sweet Loving(3) The Poor People ( 4) Yes We Can (5) Greetings Dominicans (6) L Love You More And More (7) Life Not Easy (8) Paid Bouche People Prayer To Jah(9)Yes We Can Mix (10) Sweet Loving Mix,Yes We Can,"",2016,Other/Reggae/Other Reggae,Energizing/Edgy / Sexy,Medium Tempo/Medium/70s
72753565,Jason Mraz,Make It Mine,We Sing. We Dance. We Steal Things.,Male/Male,2008,Pop/Western Pop/Adult Alternative Pop,Yearning/Sensitive / Exploring,Medium Tempo/Medium/70s
68746902,Reamonn,Tonight,Wish,Male/Male Group,2006,Rock/Adult Alternative Rock/Adult Alternative Rock,Gritty/Strumming Yearning,Medium Tempo/Medium/70s
68003803,Yann Tiersen,La Chute,Le Phare,Male/Male,1998,Soundtrack/Original Film/TV Music/General Film Music,Peaceful/Quiet / Introspective,Medium Tempo/Medium/70s
61796140,Grant Geissman,Theme From Two And A Half Men,Say That!,Male/Male,2006,Jazz/Smooth Jazz/Smooth Jazz Instrumental,Easygoing/Friendly,Medium Tempo/Medium/70s
