id,artist,title,album_title,artist_type,album_year,genre,mood,tempo
191603563,Charles Aznavour,Une Vie D'amour,Mes Amours,Male/Male,2003,Pop/European Pop/Chanson,Sentimental/Lyrical Sentimental,Medium Tempo/Medium Slow/50s
191599940,Joe Dassin,A Toi,Éternel,Male/Male,2005,Pop/European Pop/French Pop,Fiery/Passionate Rhythm,Medium Tempo/Medium Fast/120s
191599250,Joe Dassin,Salut,Souvenirs,Male/Male,2008,Pop/European Pop/French Pop,Gritty/Sober / Determined,Medium Tempo/Medium Slow/50s
190794906,Scorpions,Maybe I Maybe You,Unbreakable,Male/Male Group,2004,Rock/Hard Rock/General Hard Rock,Brooding/Evocative / Intriguing,Medium Tempo/Medium Slow/60s
189746753,Snow Patrol,The Lightning Strike (What If This Storm Ends?),Greatest Hits,Male/Male Group,2013,Alternative a Punk/Brit Rock/Brit Rock,Brooding/Dreamy Brooding,Medium Tempo/Medium/70s
188343905,Delphic,Baiya,Collections,Male/Male Group,2013,Alternative a Punk/Indie Rock/Indie Pop,Urgent/Energetic Anxious,Medium Tempo/Medium Fast/110s
186615962,Reamonn,Sometimes,Wish,Male/Male Group,2006,Rock/Adult Alternative Rock/Adult Alternative Rock,Urgent/Energetic Anxious,Medium Tempo/Medium Fast/90s
186382942,Breaking Benjamin,The Diary Of Jane,Phobia,Male/Male Group,2006,Alternative a Punk/Alternative/Alternative Rock,Defiant/Heavy Brooding,Medium Tempo/Medium/80s
186309373,Sum 41,With Me,Underclass Hero,Male/Male Group,2007,Alternative a Punk/Punk/Pop Punk,Empowering/Powerful / Heroic,Medium Tempo/Medium Fast/110s
186309371,Sum 41,Pieces,Chuck,Male/Male Group,2004,Alternative a Punk/Punk/Pop Punk,Empowering/Powerful / Heroic,Medium Tempo/Medium Fast/90s
185985795,Michael Bublé,Feeling Good,It's Time,Male/Male,2005,Pop/Classic Pop Vocals/Classic Male Vocal Pop,Brooding/Evocative / Intriguing,Medium Tempo/Medium/70s
185649734,Nina Simone,Feeling Good (Joe Claussell Remix),Feeling Good (Joe Claussell Remix),Female/Female,0,Jazz/Jazz Vocals/Jazz Vocals,Sensual/Dreamy Pulse,Medium Tempo/Medium/70s
185078481,Chevelle,The Fad,Vena Sera,Male/Male Group,2007,Rock/Metal/Nu-Metal,Defiant/Heavy Brooding,Medium Tempo/Medium Fast/90s
185065350,Christina Aguilera,You Lost Me,Bionic,Female/Female,2010,Pop/Western Pop/Dance Pop,Sophisticated/Smoky / Romantic,Medium Tempo/Medium Slow/50s
184702069,The Rasmus,Night After Night (Out Of The Shadows),Hide From The Sun,Male/Male Group,2005,Alternative a Punk/Alternative/Alternative Rock,Defiant/Heavy Brooding,Medium Tempo/Medium Fast/100s
184700122,Muse,Sober,Showbiz,Male/Male Group,1999,Alternative a Punk/Alternative/Alternative Rock,Defiant/Heavy Brooding,Medium Tempo/Medium Fast/120s
184699225,The Fray,You Found Me,The Fray,Male/Male Group,2009,Rock/Adult Alternative Rock/Adult Alternative Rock,Empowering/Powerful / Heroic,Medium Tempo/Medium/70s
184695390,My Chemical Romance,The Jetset Life Is Gonna Kill You,Three Cheers For Sweet Revenge,Male/Male Group,2004,Alternative a Punk/Emo a Hardcore/Emo,Defiant/Heavy Brooding,Medium Tempo/Medium Fast/120s
184693665,Mark Knopfler a Emmylou Harris,Beyond My Wildest Dreams,All The Roadrunning,Mixed/Mixed Duo,2006,Traditional/Country/Alternative Country,Brooding/Dreamy Brooding,Medium Tempo/Medium Slow/50s
184690853,Story Of The Year,Until The Day I Die,Page Avenue,Male/Male Group,2003,Alternative a Punk/Emo a Hardcore/Hardcore,Rowdy/Driving Dark Groove,Medium Tempo/Medium Fast/90s
184543025,Ibiza Dance,Smoke Sign - Before The 3 Suns (Urban Shaman Remix) (Trance / Electro / Progressive),Ibiza 2010 Hits (Top 60 Electro Trance Dubstep Breaks Techno Acid House Goa Psytrance Hard Dance Electronic Dance Music),"",2011,Other/Data a Other/Data a Other,Energizing/Heavy Beat,Medium Tempo/Medium Fast/120s
184540629,Sebastian Ingrosso Steve Angello Tiesto Marcel Woods John Dahlback Jean Elan Cosmo Klein B/B Noferini,Feel Alive (Arnaud Andrieu a Matt Venice Remix),St Tropez Fever [Disc 1],"",2011,Electronica/Electronica Mainstream/Pop Electronica,Energizing/Heavy Beat,Medium Tempo/Medium Fast/120s
184540155,Gin Wigmore,Kill Of The Night,Gravel a Wine,Female/Female,2011,Urban/Classic RaB/Soul/RaB/Soul,Rowdy/Confident / Tough,Medium Tempo/Medium Slow/60s
184539644,Blackmore's Night,Wish You Were Here,Shadow of The Moon,Mixed/Mixed Group,1997,Rock/70's Rock/Neo-Prog Rock,Romantic/Dramatic / Romantic,Medium Tempo/Medium Slow/60s
184348494,Anya Marina,Whatever You Like (Single Version),Whatever You Like [Digital 45],Female/Female,2009,Alternative a Punk/Indie Rock/Indie Pop,Yearning/Energetic Yearning,Medium Tempo/Medium Slow/60s
184328488,Florence + The Machine,Shake It Out,Ceremonials,Mixed/Mixed Group,2011,Alternative a Punk/Alternative/Alternative Singer-Songwriter,Empowering/Powerful / Heroic,Medium Tempo/Medium Fast/100s
184328473,Florence + The Machine,Dog Days Are Over,Lungs,Mixed/Mixed Group,2009,Alternative a Punk/Alternative/Alternative Singer-Songwriter,Empowering/Powerful / Heroic,Medium Tempo/Medium/70s
184328461,Florence + The Machine,Cosmic Love,Lungs,Mixed/Mixed Group,2009,Alternative a Punk/Alternative/Alternative Singer-Songwriter,Sophisticated/Smoky / Romantic,Medium Tempo/Medium/70s
182588866,Green Day,Stray Heart,¡Dos!,Male/Male Group,2012,Alternative a Punk/Punk/Pop Punk,Defiant/Hard Dark Excitement,Medium Tempo/Medium Fast/100s
180193571,I Hate Kate,Then You Kiss,Embrace The Curse,"",2008,Rock/Mainstream Rock/General Mainstream Rock,Urgent/Energetic Anxious,Medium Tempo/Medium/80s
180192346,Neon Trees,Everybody Talks,Picture Show,Male/Male Group,2012,Alternative a Punk/Alternative/Alternative Pop,Excited/Happy Excitement,Medium Tempo/Medium Fast/100s
180181439,Gavin DeGraw,I Don't Want To Be,Chariot,Male/Male,2003,Pop/Western Pop/Adult Alternative Pop,Defiant/Heavy Brooding,Medium Tempo/Medium/70s
178777865,Kid Cudi,Erase Me,Man On The Moon II: The Legend Of Mr. Rager,Male/Male Duo,2010,Urban/Western Hip-Hop/Rap/Conscious Hip-Hop/Rap,Cool/Cool Confidence,Medium Tempo/Medium Fast/90s
178414374,The Black Keys,Lonely Boy,El Camino,Male/Male Duo,2011,Alternative a Punk/Garage Rock Revival/Garage Rock Revival,Defiant/Heavy Brooding,Medium Tempo/Medium/80s
177387107,Jack Johnson,Sitting Waiting Wishing,In Between Dreams,Male/Male,2005,Pop/Western Pop/Adult Alternative Pop,Brooding/Energetic Melancholy,Medium Tempo/Medium Fast/100s
177384709,Snow Patrol,Called Out In The Dark,Fallen Empires,Male/Male Group,2011,Alternative a Punk/Brit Rock/Brit Rock,Excited/Upbeat Pop Groove,Medium Tempo/Medium Fast/120s
177086679,Jocelyn Pook,Loving Strangers,Habitación en Roma (BSO),Female/Female,2010,Soundtrack/Original Film/TV Music/General Film Music,Sentimental/Tender / Sincere,Medium Tempo/Medium Slow/50s
176994688,Stereophonics,Maybe Tomorrow,You Gotta Go There To Come Back,Male/Male Group,2003,Alternative a Punk/Brit Rock/Brit Rock,Gritty/Strumming Yearning,Medium Tempo/Medium/80s
176323190,The Rapture,How Deep Is Your Love?,In The Grace Of Your Love,Male/Male Group,2011,Alternative a Punk/Indie Rock/Indie Pop,Urgent/Dark Pop Intensity,Medium Tempo/Medium Fast/120s
176240771,Esthetic Education,Unbelievable,Werewolf,"",2007,Rock/Mainstream Rock/General Mainstream Rock,Brooding/Energetic Melancholy,Medium Tempo/Medium/80s
176108711,Maybeshewill,He Films The Clouds Pt. 2,Not For Want Of Trying,Male/Male Group,2008,Alternative a Punk/Indie Rock/Post-Rock,Brooding/Dreamy Brooding,Medium Tempo/Medium/80s
174626727,Flipsyde,Someday,We The People,Male/Male Group,2005,Alternative a Punk/Alternative/Alternative Rock,Energizing/Edgy / Sexy,Medium Tempo/Medium/80s
173765541,The Cranberries,Will You Remember,To The Faithful Departed,Mixed/Mixed Group,1996,Rock/Adult Alternative Rock/Adult Alternative Rock,Sensual/Dreamy Pulse,Medium Tempo/Medium Slow/60s
173750418,Shinedown,Her Name Is Alice (Bonus Track),The Sound of Madness,Male/Male Group,2008,Alternative a Punk/Alternative/Alternative Rock,Yearning/Energetic Yearning,Medium Tempo/Medium Fast/90s
173121319,The Beatles,Michelle,Rubber Soul,Male/Male Group,1965,Rock/60's Rock/British Invasion,Melancholy/Sad / Soulful,Medium Tempo/Medium Slow/50s
173121318,a-ha,Foot Of The Mountain,Foot Of The Mountain,Male/Male Group,2009,Alternative a Punk/New Wave Pop/New Wave Pop,Yearning/Energetic Yearning,Medium Tempo/Medium/60s
172767460,Shocking Blue,Long And Lonesome Road,At Home,Mixed/Mixed Group,1969,Rock/60's Rock/Acid Rock,Urgent/Dark Urgent,Medium Tempo/Medium Fast/120s
172013741,The Temper Trap,Sweet Disposition,Conditions,Male/Male Group,2009,Alternative a Punk/Indie Rock/Post-Punk Revival,Brooding/Energetic Melancholy,Medium Tempo/Medium Fast/120s
171912567,Fallulah,Give Us A Little Love,The Black Cat Neighbourhood,Female/Female,2010,Alternative a Punk/Indie Rock/General Indie Rock,Sophisticated/Smoky / Romantic,Medium Tempo/Medium Slow/60s
171880866,Lifehouse,It Is What It Is,Smoke a Mirrors,Male/Male Group,2010,Rock/Adult Alternative Rock/Adult Alternative Rock,Yearning/Energetic Yearning,Medium Tempo/Medium/80s
171877314,James Blunt,No Tears,Some Kind Of Trouble,Male/Male,2010,Pop/Western Pop/Adult Alternative Pop,Empowering/Dramatic Emotion,Medium Tempo/Medium/60s
170788730,Brainstorm,Thunder Without Rain,Four Shores,Male/Male Group,2006,Pop/European Pop/Eastern European Pop,Brooding/Dreamy Brooding,Medium Tempo/Medium Slow/50s
170686351,Various Artists,Bikini (Cyberpunker Remix),Remixes by Discograph,"",2014,Rock/70's Rock/Classic Rock,Defiant/Attitude / Defiant,Medium Tempo/Medium/60s
170643732,God Help The Girl,Baby You're Blind,Baby You're Blind,Mixed/Mixed Group,2010,Alternative a Punk/Indie Rock/Twee Pop,Excited/Upbeat Pop Groove,Medium Tempo/Medium Fast/100s
170642249,God Help The Girl,Funny Little Frog,God Help The Girl,Mixed/Mixed Group,2009,Alternative a Punk/Indie Rock/Twee Pop,Yearning/Bittersweet Pop,Medium Tempo/Medium Fast/90s
170556929,Marina a The Diamonds,Girls,The Family Jewels,Female/Female,2010,Alternative a Punk/Synth Pop/Synth Pop,Urgent/Dark Pop Intensity,Medium Tempo/Medium Fast/110s
169737377,Various Artists,NO bambino,Fresh Hits Summer 2007,"",2007,Traditional/Folk/Old Timey,Energizing/Heavy Beat,Medium Tempo/Medium Fast/90s
167432779,I am waiting for you last summer,Solar Wind,Edge Party,Male/Male Group,2013,Rock/Mainstream Rock/General Mainstream Rock,Yearning/Energetic Dreamy,Medium Tempo/Medium Fast/90s
167007409,Brainstorm,Kitten Who Did Not Want To Give Up,Online,Male/Male Group,2001,Pop/European Pop/Eastern European Pop,Rowdy/Driving Dark Groove,Medium Tempo/Medium/70s
166750668,Modjo,Lady (Hear Me Tonight),Modjo (UK CD Set),Male/Male Duo,2001,Electronica/House/Euro House,Stirring/Jubilant / Soulful,Medium Tempo/Medium Fast/120s
166740135,Motorama,Alps,Alps,Mixed/Mixed Group,2013,Rock/Mainstream Rock/General Mainstream Rock,Yearning/Energetic Yearning,Medium Tempo/Medium/60s
166735986,The Pretty Reckless,You,Light Me Up,Mixed/Mixed Group,2010,Alternative a Punk/Alternative/Alternative Rock,Empowering/Idealistic / Stirring,Medium Tempo/Medium/80s
166734656,Motorama,Wind in Her Hair,Alps,Mixed/Mixed Group,2013,Rock/Mainstream Rock/General Mainstream Rock,Yearning/Energetic Yearning,Medium Tempo/Medium Slow/60s
166733949,Taylor Swift,The Moment I Knew,Red [Deluxe Edition] [Disc 2],Female/Female,2012,Pop/Western Pop/Adult Alternative Pop,Empowering/Dramatic Emotion,Medium Tempo/Medium Slow/60s
166733165,Motorama,Ship,Alps,Mixed/Mixed Group,2013,Rock/Mainstream Rock/General Mainstream Rock,Yearning/Sensitive / Exploring,Medium Tempo/Medium/60s
166655091,Emma Hewitt,These Days Are Ours,Burn The Sky Down,Female/Female,2012,Electronica/Trance/Trance,Yearning/Energetic Yearning,Medium Tempo/Medium/80s
165367496,DeeExpus,King of Number 33 (II - Accession),King of Number 33,"",2012,Rock/70's Rock/Classic Prog,Defiant/Heavy Brooding,Medium Tempo/Medium Fast/90s
165209525,Revolver,Back To You,Music For A While,Male/Male Group,2009,Alternative a Punk/Indie Rock/Indie Pop,Sentimental/Tender / Sincere,Medium Tempo/Medium Slow/60s
163915119,Lynsey De Paul,Sugar Me,Sugar Me,Female/Female,2009,Pop/Western Pop/Singer-Songwriter,Brooding/Alienated / Brooding,Medium Tempo/Medium Fast/90s
164039446,Florence + The Machine,Kiss With A Fist,Lungs,Mixed/Mixed Group,2009,Alternative a Punk/Alternative/Alternative Singer-Songwriter,Defiant/Heavy Brooding,Medium Tempo/Medium Fast/100s
164425430,Yeah Yeah Yeahs,Gold Lion,Show Your Bones,Mixed/Mixed Group,2006,Alternative a Punk/Indie Rock/Post-Punk Revival,Urgent/Energetic Anxious,Medium Tempo/Medium/80s
164744359,Madonna,Love Profusion,American Life,Female/Female,2003,Pop/Western Pop/Dance Pop,Energizing/Edgy / Sexy,Medium Tempo/Medium Fast/120s
164104179,Paula Seling a Ovi,Playing With Fire,Playing With Fire,"",2010,Pop/Western Pop/Pop Vocal,Energizing/Edgy / Sexy,Medium Tempo/Medium Fast/120s
164103788,U2,With Or Without You,The Joshua Tree,Male/Male Group,1987,Rock/Adult Alternative Rock/Adult Alternative Rock,Empowering/Idealistic / Stirring,Medium Tempo/Medium Fast/110s
164103378,Michael Tolcher,Bad Habits,I Am,Male/Male,2007,Pop/Western Pop/Adult Alternative Pop,Brooding/Energetic Melancholy,Medium Tempo/Medium/80s
164100483,Westlife,What About Now,Where We Are,Male/Male Group,2009,Pop/Western Pop/Teen Boy Band,Brooding/Energetic Melancholy,Medium Tempo/Medium/80s
163978176,Of Monsters And Men,Little Talks,My Head Is An Animal,Mixed/Mixed Group,2012,Alternative a Punk/Alternative Folk/Alternative Folk,Yearning/Energetic Yearning,Medium Tempo/Medium Fast/100s
163816616,Switchfoot,Your Love Is A Song,Hello Hurricane,Male/Male Group,2009,Alternative a Punk/Alternative/Alternative Rock,Empowering/Powerful / Heroic,Medium Tempo/Medium/80s
162978966,Lazlo Bane,Superman,All the Time in the World,Male/Male Group,2002,Rock/Adult Alternative Rock/Adult Alternative Rock,Easygoing/Friendly,Medium Tempo/Medium/80s
162796862,The Sensational Alex Harvey Band,Give My Compliments To The Chef,Tomorrow Belongs To Me,Male/Male Group,1975,Rock/Hard Rock/Glam,Brooding/Evocative / Intriguing,Medium Tempo/Medium/80s
162523211,Plain White T's,1 2 3 4,Big Bad World,Male/Male Group,2008,Alternative a Punk/Alternative/Alternative Pop,Yearning/Bittersweet Pop,Medium Tempo/Medium Fast/90s
162523208,Plain White T's,Welcome To Mystery,Wonders Of The Younger,Male/Male Group,2010,Alternative a Punk/Alternative/Alternative Pop,Yearning/Energetic Yearning,Medium Tempo/Medium Slow/60s
162394193,西野カナ,You are the one,to LOVE,Female/Female,2010,Urban/Contemporary RaB/Soul/Urban Crossover,Empowering/Dramatic Emotion,Medium Tempo/Medium Slow/60s
162048994,Halestorm,I Miss The Misery,The Strange Case Of...,Mixed/Mixed Group,2012,Rock/Hard Rock/General Hard Rock,Defiant/Heavy Brooding,Medium Tempo/Medium/80s
161850313,岩崎琢,Si deus me relinquit,黒執事 Sound Complete Black Box [Disc 2],Male/Male,2009,Soundtrack/Original Film/TV Music/Anime Film/TV Music,Romantic/Dramatic / Romantic,Medium Tempo/Medium/80s
161426900,McFly,Five Colours In Her Hair,Room On The 3rd Floor,Male/Male Group,2004,Alternative a Punk/Punk/Pop Punk,Defiant/Hard Positive Excitement,Medium Tempo/Medium Fast/90s
161421677,The Cardigans,Say That You Love Me,Greatest Hits,Mixed/Mixed Group,2008,Alternative a Punk/Indie Rock/General Indie Rock,Cool/Dark Groovy,Medium Tempo/Medium Fast/110s
150582783,Vanessa Paradis,La Seine,Love Songs Tour,Female/Female,2014,Pop/European Pop/French Pop,Urgent/Dark Pop Intensity,Medium Tempo/Medium Fast/110s
150013000,I am waiting for you last summer,Unseen,Edge Party,Male/Male Group,2013,Rock/Mainstream Rock/General Mainstream Rock,Excited/Euphoric Energy,Medium Tempo/Medium Fast/120s
149369218,Elbow,Grounds For Divorce,The Seldom Seen Kid,Male/Male Group,2008,Alternative a Punk/Indie Rock/General Indie Rock,Brooding/Energetic Melancholy,Medium Tempo/Medium Fast/90s
149268278,Vanilla Sky,Just Dance,Fragile,Male/Male Group,2010,Alternative a Punk/Punk/Pop Punk,Urgent/Energetic Anxious,Medium Tempo/Medium Fast/120s
148177877,Slash,Promise,Slash,Male/Male,2010,Rock/Hard Rock/General Hard Rock,Defiant/Heavy Brooding,Medium Tempo/Medium Fast/90s
147799046,Julian Perretta,Wonder Why,Stitch Me Up,Male/Male,2010,Pop/Western Pop/Adult Alternative Pop,Yearning/Energetic Yearning,Medium Tempo/Medium/80s
147182423,ATB,My Everything,Future Memories [Disc 1],Male/Male,2009,Electronica/Trance/Trance,Yearning/Energetic Dreamy,Medium Tempo/Medium/80s
146278611,Rob Thomas,Lonely No More,...Something To Be,Male/Male,2005,Pop/Western Pop/Adult Alternative Pop,Rowdy/Driving Dark Groove,Medium Tempo/Medium/80s
146060563,Noel Gallagher's High Flying Birds,(Stranded On) The Wrong Beach,Noel Gallagher's High Flying Birds,Male/Male Group,2011,Alternative a Punk/Brit Rock/Brit Rock,Brooding/Energetic Melancholy,Medium Tempo/Medium Slow/60s
145072034,Regina Spektor,Dance Anthem Of The 80's,Far,Female/Female,2009,Alternative a Punk/Indie Rock/Indie Pop,Gritty/Gritty / Soulful,Medium Tempo/Medium/70s
143577496,IAMX,Think Of England,Kingdom Of Welcome Addiction,Male/Male Group,2009,Alternative a Punk/Indie Rock/Post-Punk Revival,Yearning/Energetic Yearning,Medium Tempo/Medium/70s
143569354,IAMX,My Secret Friend (Featuring Imogen Heap),Kingdom Of Welcome Addiction,Male/Male Group,2009,Alternative a Punk/Indie Rock/Post-Punk Revival,Yearning/Energetic Yearning,Medium Tempo/Medium Fast/110s
140529460,安室奈美恵,arigatou <thank the world for LOVE... gift song for 2011>,Sit! Stay! Wait! Down! / Love Story,Female/Female,2011,Pop/Japanese Pop/J-Pop,Empowering/Dramatic Emotion,Medium Tempo/Medium/70s
139392117,Kasabian,Club Foot,Kasabian,Male/Male Group,2004,Alternative a Punk/Brit Rock/Brit Rock,Brooding/Alienated / Brooding,Medium Tempo/Medium Fast/100s
139382359,The Kooks,Naive,Inside In/Inside Out,Male/Male Group,2006,Alternative a Punk/Indie Rock/Indie Pop,Urgent/Energetic Anxious,Medium Tempo/Medium Fast/100s
139241896,Neon Trees,In The Next Room,Habits,Male/Male Group,2010,Alternative a Punk/Alternative/Alternative Pop,Brooding/Energetic Melancholy,Medium Tempo/Medium Fast/90s
139158025,White Apple Tree,Snowflakes,Velvet Mustache,Male/Male Group,2010,Alternative a Punk/Synth Pop/Synth Pop,Brooding/Dreamy Brooding,Medium Tempo/Medium Slow/60s
136967729,The Kooks,Be Mine,Inside In/Inside Out,Male/Male Group,2006,Alternative a Punk/Indie Rock/Indie Pop,Defiant/Hard Positive Excitement,Medium Tempo/Medium Fast/90s
135016610,Ramona Falls,Russia,Intuit,Mixed/Mixed Group,2009,Alternative a Punk/Indie Rock/General Indie Rock,Sensual/Dreamy Pulse,Medium Tempo/Medium/80s
133323086,The Hardkiss,Babylon,Stones and Honey,Mixed/Mixed Group,2014,Electronica/Electronica Mainstream/Pop Electronica,Sophisticated/Smoky / Romantic,Medium Tempo/Medium/60s
133320940,The Hardkiss,Dance with Me,Stones and Honey,Mixed/Mixed Group,2014,Electronica/Electronica Mainstream/Pop Electronica,Urgent/Dark Pop Intensity,Medium Tempo/Medium Fast/120s
132866443,Florence + The Machine,Bird Song,Lungs: The B-Sides,Mixed/Mixed Group,2009,Alternative a Punk/Alternative/Alternative Singer-Songwriter,Sophisticated/Smoky / Romantic,Medium Tempo/Medium Slow/60s
132694595,Eminem,Drips,The Eminem Show,Male/Male Duo,2002,Urban/Western Hip-Hop/Rap/Midwestern Rap,Cool/Wary / Defiant,Medium Tempo/Medium/80s
132594269,Gossip,Heavy Cross,Music For Men,Mixed/Mixed Group,2009,Alternative a Punk/Indie Rock/Indie Pop,Rowdy/Driving Dark Groove,Medium Tempo/Medium Fast/120s
132491346,Blue Foundation,Bonfires,Sweep Of Days,Mixed/Mixed Group,2005,Alternative a Punk/Indie Rock/General Indie Rock,Cool/Wary / Defiant,Medium Tempo/Medium/80s
132246909,Various Artists,"El Tango De Roxanne (Instr. From ""Moulin Rouge"")",Ballroom Emotions,"",2002,Pop/Western Pop/Other Pop,Sophisticated/Dark Playful,Medium Tempo/Medium Fast/120s
130399296,Sixpence None The Richer,Don't Dream It's Over,Divine Discontent,Mixed/Mixed Group,2002,Pop/Western Pop/Adult Alternative Pop,Yearning/Energetic Yearning,Medium Tempo/Medium/80s
129598648,Robbie Williams,The Road To Mandalay,Sing When You're Winning,Male/Male,2000,Pop/Western Pop/Adult Contemporary,Yearning/Energetic Dreamy,Medium Tempo/Medium Fast/90s
128481708,Sophie Ellis-Bextor,Murder On The Dancefloor,Read My Lips,Female/Female,2001,Pop/Western Pop/Dance Pop,Excited/Euphoric Energy,Medium Tempo/Medium Fast/110s
128194075,Sophie Ellis-Bextor,Off a On,Make a Scene,Female/Female,2011,Pop/Western Pop/Dance Pop,Energizing/Edgy / Sexy,Medium Tempo/Medium Fast/120s
128182052,Sophie Ellis-Bextor,Me And My Imagination,Trip The Light Fantastic,Female/Female,2007,Pop/Western Pop/Dance Pop,Excited/Euphoric Energy,Medium Tempo/Medium Fast/120s
128038651,Скрябін,Дочка Україна,Дочка Україна,Male/Male Group,2015,Rock/Mainstream Rock/General Mainstream Rock,Gritty/Strumming Yearning,Medium Tempo/Medium Fast/90s
125417309,Kasabian,Underdog,West Ryder Pauper Lunatic Asylum,Male/Male Group,2009,Alternative a Punk/Brit Rock/Brit Rock,Brooding/Energetic Melancholy,Medium Tempo/Medium Fast/100s
124128241,Selena Gomez a The Scene,Love You Like A Love Song,When The Sun Goes Down,Mixed/Mixed Group,2011,Pop/Western Pop/Teen Pop,Energizing/Edgy / Sexy,Medium Tempo/Medium Fast/110s
122766486,Sia,Breathe Me,Colour The Small One [Deluxe Edition],Female/Female,2005,Alternative a Punk/Indie Rock/Post-Modern Electronic Pop,Yearning/Energetic Yearning,Medium Tempo/Medium Fast/110s
122607021,Yeah Yeah Yeahs,Cheated Hearts,Show Your Bones,Mixed/Mixed Group,2006,Alternative a Punk/Indie Rock/Post-Punk Revival,Empowering/Powerful / Heroic,Medium Tempo/Medium/60s
121135638,009 Sound System,Trinity,009 Sound System,Male/Male,2009,Electronica/Trance/Trance,Excited/Euphoric Energy,Medium Tempo/Medium Fast/120s
120441853,Blind Guardian,The Bard's Song (The Hobbit) [New Recording 2011],Memories Of A Time To Come [Disc 2],Male/Male Group,2012,Rock/Metal/Power Metal,Aggressive/Aggressive Power,Medium Tempo/Medium/80s
118760995,The Downtown Fiction,I Just Wanna Run,Let's Be Animals,Male/Male Group,2011,Alternative a Punk/Emo a Hardcore/Emo,Urgent/Energetic Anxious,Medium Tempo/Medium Fast/120s
118193498,Radiohead,Karma Police,OK Computer,Male/Male Group,1997,Alternative a Punk/Brit Rock/Brit Rock,Brooding/Dreamy Brooding,Medium Tempo/Medium/70s
118105489,Paramore,Decode,Brand New Eyes [Bonus Tracks],Mixed/Mixed Group,2009,Alternative a Punk/Alternative/Alternative Rock,Defiant/Heavy Brooding,Medium Tempo/Medium/80s
118104608,Oasis,Stop Crying Your Heart Out,Heathen Chemistry,Male/Male Group,2002,Alternative a Punk/Brit Pop/Brit Pop,Brooding/Dreamy Brooding,Medium Tempo/Medium/70s
118104013,Audio Bullys,Only Man,Higher Than The Eiffel,Male/Male Duo,2011,Electronica/Electronica Mainstream/Big Beat,Energizing/Edgy / Sexy,Medium Tempo/Medium Fast/100s
118103715,Ida Corr Vs. Fedde Le Grand,Let Me Think About It,Let Me Think About It [Single],Mixed/Mixed Duo,2007,Pop/Western Pop/Dance Pop,Energizing/Arousing Groove,Medium Tempo/Medium Fast/120s
117133683,Made Famous By Jessie J Ft. B.o.B,Price Tag,Price Tag,"",2011,Pop/Japanese Pop/J-Pop,Cool/Cool Confidence,Medium Tempo/Medium/80s
116520635,Олег Митяев,Самая любимая песня,Лучшие песни,Male/Male,1999,Pop/European Pop/Eastern European Pop,Gritty/Depressed / Lonely,Medium Tempo/Medium Slow/50s
116189624,Texas,Summer Son,The Hush,Mixed/Mixed Group,1999,Rock/Adult Alternative Rock/Adult Alternative Rock,Brooding/Energetic Melancholy,Medium Tempo/Medium Fast/120s
116125581,Kylie Minogue,In Your Eyes,Fever,Female/Female,2001,Pop/Western Pop/Dance Pop,Fiery/Fiery Groove,Medium Tempo/Medium Fast/120s
110911153,Мотор'Ролла,Моя вода,Кольорові сни,"",2008,Pop/Western Pop/Pop Vocal,Brooding/Energetic Melancholy,Medium Tempo/Medium Fast/100s
109386245,Сплин,Прочь Из Моей Головы,Раздвоение Личности,Male/Male Group,2012,Rock/Mainstream Rock/General Mainstream Rock,Defiant/Heavy Brooding,Medium Tempo/Medium/80s
109283262,Alanis Morissette,Crazy,The Collection,Female/Female,2005,Rock/Adult Alternative Rock/Adult Alternative Rock,Urgent/Dark Pop Intensity,Medium Tempo/Medium Fast/100s
109276099,The Pierces,Secret,Thirteen Tales Of Love a Revenge,Female/Female Duo,2008,Pop/Western Pop/Adult Alternative Pop,Sensual/Dreamy Pulse,Medium Tempo/Medium/60s
109273990,The Pierces,Sticks And Stones,Thirteen Tales Of Love a Revenge,Female/Female Duo,2008,Pop/Western Pop/Adult Alternative Pop,Urgent/Dark Pop Intensity,Medium Tempo/Medium Fast/110s
109051689,a-ha,Forever Not Yours,Lifelines,Male/Male Group,2002,Alternative a Punk/New Wave Pop/New Wave Pop,Gritty/Strumming Yearning,Medium Tempo/Medium/80s
109049057,Panic! At The Disco,I Write Sins Not Tragedies,A Fever You Can't Sweat Out,Male/Male Group,2005,Alternative a Punk/Punk/Pop Punk,Brooding/Energetic Melancholy,Medium Tempo/Medium/80s
109036800,Александр Иванов,Боже Какой Пустяк,Звездная Серия,Male/Male,2001,"",Sensual/Sensual Groove,Medium Tempo/Medium Slow/60s
107515435,Take That,The Flood,Progress,Male/Male Group,2010,Pop/Western Pop/Teen Boy Band,Brooding/Energetic Melancholy,Medium Tempo/Medium Fast/100s
106125128,Panic! At The Disco,Build God Then We'll Talk,A Fever You Can't Sweat Out,Male/Male Group,2005,Alternative a Punk/Punk/Pop Punk,Urgent/Dark Pop Intensity,Medium Tempo/Medium Fast/120s
104900529,Carrie Underwood,Cowboy Casanova,Play On,Female/Female,2009,Traditional/Country/Contemporary Country,Urgent/Dark Pop Intensity,Medium Tempo/Medium Fast/120s
104684463,Holly Brook,It's Raining Again (Smile),O'Dark:Thirty,Female/Female,2010,Pop/Western Pop/Adult Alternative Pop,Yearning/Energetic Yearning,Medium Tempo/Medium Fast/90s
104683218,Dr. Dre Feat. Eminem a Skylar Grey,I Need A Doctor (Edited Version),I Need A Doctor,Mixed/Mixed Group,2010,Urban/Western Hip-Hop/Rap/General Hip-Hop/Rap,Brooding/Dreamy Brooding,Medium Tempo/Medium/70s
