id,artist,title,album_title,artist_type,album_year,genre,mood,tempo
456239187,The Rosebuds,Boxcar,Birds Make Good Neighbours,Mixed/Mixed Duo,2005,Alternative a Punk/Indie Rock/Indie Pop,Yearning/Energetic Yearning,Medium Tempo/Medium/60s
456239177,Florence + The Machine,Girl With One Eye,Lungs,Mixed/Mixed Group,2009,Alternative a Punk/Alternative/Alternative Singer-Songwriter,Sophisticated/Smoky / Romantic,Medium Tempo/Medium/60s
456239175,Florence + The Machine,Hardest Of Hearts,Lungs: The B-Sides,Mixed/Mixed Group,2009,Alternative a Punk/Alternative/Alternative Singer-Songwriter,Sensual/Dreamy Pulse,Medium Tempo/Medium/60s
456239173,Ringo Starr,You're Sixteen,Ringo a His New All-Starr Band,Male/Male,2002,Pop/Western Pop/Singer-Songwriter,Rowdy/Ramshackle / Rollicking,Medium Tempo/Medium/60s
456239139,Katie Melua,All Over The World,Secret Symphony,Female/Female,2012,Pop/Western Pop/Adult Contemporary,Sensual/Soft Soulful,Medium Tempo/Medium/60s
456239138,Egor Grushin,Essential,Once,"",2016,Classical/Other Classical/General Classical,Brooding/Dreamy Brooding,Medium Tempo/Medium/60s
456239134,Egor Grushin,Beginning,Dominicano,"",2015,Alternative a Punk/Alternative/Alternative Rock,Melancholy/Light Melancholy,Medium Tempo/Medium/60s
456239051,Erlend Øye,Estate,Estate,Male/Male,2015,Alternative a Punk/Indie Rock/Indie Pop,Gritty/Depressed / Lonely,Medium Tempo/Medium/60s
456239049,Heidevolk,Deemstering,Uit Oude Grond,Male/Male Group,2012,Rock/Metal/Black Metal,Somber/Enigmatic / Mysterious,Medium Tempo/Medium/60s
456239039,Hooverphonic,Amalfi,Reflection,Mixed/Mixed Group,2013,Electronica/Downtempo Lounge a Ambient/General Downtempo,Empowering/Dramatic Emotion,Medium Tempo/Medium/60s
456239025,Die Antwoord,Gucci Coochie,Mount Ninji And Da Nice Time Kid,Mixed/Mixed Group,2016,Urban/Western Hip-Hop/Rap/Conscious Hip-Hop/Rap,Defiant/Attitude / Defiant,Medium Tempo/Medium/60s
443991926,Explosions In The Sky,Magic Hours,How Strange Innocence,Male/Male Group,2000,Alternative a Punk/Indie Rock/Post-Rock,Melancholy/Light Melancholy,Medium Tempo/Medium/60s
432067240,Young The Giant,Cough Syrup,Young The Giant,Male/Male Group,2010,Alternative a Punk/Alternative/Alternative Rock,Empowering/Powerful / Heroic,Medium Tempo/Medium/60s
431140244,Yann Tiersen,Rue Des Cascades,C'Etait Ici [Disc 1],Male/Male,2002,Soundtrack/Original Film/TV Music/General Film Music,Melancholy/Wistful / Forlorn,Medium Tempo/Medium/60s
430376085,Die Form,Cantique,Best Of XXX [Disc 2],Mixed/Mixed Duo,2008,Alternative a Punk/Goth/Goth,Brooding/Dreamy Brooding,Medium Tempo/Medium/60s
427975967,Chaos Chaos,Do You Feel It?,Committed to the Crime,Female/Female Duo,2014,Rock/Adult Alternative Rock/Adult Alternative Rock,Cool/Cool Confidence,Medium Tempo/Medium/60s
425702571,The Radio Dept.,Strange Things Will Happen,Lesser Matters,Male/Male Group,2004,Alternative a Punk/Indie Rock/Dream Pop,Romantic/Heartfelt Passion,Medium Tempo/Medium/60s
424458901,Kaleida,Think,Think,Female/Female Duo,2015,Electronica/Electronica Mainstream/Pop Electronica,Sensual/Dreamy Pulse,Medium Tempo/Medium/60s
408415423,Tim Minchin,Confessions,Ready For This ?,Male/Male,2009,Other/Comedy/Comedy,Gritty/Sober / Determined,Medium Tempo/Medium/60s
400471362,Dead Man's Bones,In The Room Where You Sleep,Dead Man's Bones,Male/Male Duo,2009,Alternative a Punk/Indie Rock/Indie Pop,Somber/Enigmatic / Mysterious,Medium Tempo/Medium/60s
396815761,Cat Stevens,Morning Has Broken,Teaser And The Firecat,Male/Male,1971,Pop/Western Pop/Folk Pop,Sentimental/Tender / Sincere,Medium Tempo/Medium/60s
393215675,Stanislav Artemyev,Manifestation,Manifestation,"",2014,Other/Data a Other/Data a Other,Sentimental/Lyrical Sentimental,Medium Tempo/Medium/60s
393177486,Stanislav Artemyev,Gust (Orchestral),Manifestation,"",2014,Other/Data a Other/Data a Other,Romantic/Dramatic / Romantic,Medium Tempo/Medium/60s
381719795,Of Monsters And Men,Crystals,Beneath The Skin,Mixed/Mixed Group,2015,Alternative a Punk/Alternative Folk/Alternative Folk,Yearning/Sensitive / Exploring,Medium Tempo/Medium/60s
375370981,Exgf,We Are The Hearts,We Are The Hearts,Mixed/Mixed Group,2015,Alternative a Punk/Synth Pop/Synth Pop,Brooding/Dreamy Brooding,Medium Tempo/Medium/60s
370687398,Elina Born a Stig Rästa,Goodbye To Yesterday,Goodbye To Yesterday,Mixed/Mixed Duo,2015,Pop/Western Pop/Pop Vocal,Yearning/Energetic Yearning,Medium Tempo/Medium/60s
364662053,Sophie Hunger,Shape,Monday's Ghost,Female/Female,2008,Pop/European Pop/German Pop,Sophisticated/Smoky / Romantic,Medium Tempo/Medium/60s
335710848,Echosmith,Cool Kids,Talking Dreams,Mixed/Mixed Group,2013,Alternative a Punk/Indie Rock/Indie Pop,Yearning/Energetic Yearning,Medium Tempo/Medium/60s
331575739,Marie Laforêt,Ivan Boris Et Moi,Talents Du Siecle,Female/Female,2001,Pop/European Pop/French Pop,Brooding/Evocative / Intriguing,Medium Tempo/Medium/60s
326595725,The Cinematic Orchestra,Arrival Of The Birds,The Crimson Wing: Mystery Of The Flamingos,Mixed/Mixed Group,2009,Electronica/Downtempo Lounge a Ambient/General Downtempo,Romantic/Dramatic / Romantic,Medium Tempo/Medium/60s
322291048,Mantas,Legion of Doom (Death By Metal 1st Version Demo),Death By Metal,Mixed/Mixed Group,2012,Rock/Metal/Industrial Metal,Yearning/Sensitive / Exploring,Medium Tempo/Medium/60s
320219163,Strangeweather,Mourning Sun,Like Shadows In Grey Rivers,"",2013,Pop/Western Pop/Pop Vocal,Melancholy/Sad / Soulful,Medium Tempo/Medium/60s
318714910,Various Artists,Romanoir,Heavenly Voices III,"",1995,Alternative a Punk/Alternative/Alternative Rock,Romantic/Dramatic / Romantic,Medium Tempo/Medium/60s
315060006,Meghan Trainor,All About That Bass,Title [Bonus Tracks],Female/Female,2014,Pop/Western Pop/Adult Alternative Pop,Cool/Wary / Defiant,Medium Tempo/Medium/60s
314764159,Hozier,Take Me To Church,Hozier (Deluxe Version) [Disc 1],Male/Male,2014,Alternative a Punk/Alternative Folk/Alternative Folk,Sophisticated/Smoky / Romantic,Medium Tempo/Medium/60s
311556790,Shelley Harland,Stay,The Girl Who Cried Wolf,Female/Female,2014,Alternative a Punk/Indie Rock/Indie Pop,Somber/Enigmatic / Mysterious,Medium Tempo/Medium/60s
306168709,Eels,I Like Birds,Daisies Of The Galaxy,Male/Male Group,2000,Alternative a Punk/Indie Rock/General Indie Rock,Rowdy/Ramshackle / Rollicking,Medium Tempo/Medium/60s
302588643,System Of A Down,Roulette,Steal This Album!,Male/Male Group,2002,Rock/Metal/Nu-Metal,Sophisticated/Smoky / Romantic,Medium Tempo/Medium/60s
301955238,Nirvana,Sappy,Nevermind [Disc 2],Male/Male Group,1991,Alternative a Punk/Alternative/Grunge,Yearning/Sensitive / Exploring,Medium Tempo/Medium/60s
301625193,Foo Fighters,Best Of You,In Your Honor [Disc 1],Male/Male Group,2005,Alternative a Punk/Alternative/Alternative Rock,Empowering/Powerful / Heroic,Medium Tempo/Medium/60s
291811380,The Glitch Mob,Animus Vox,Drink The Sea,Male/Male Group,2010,Electronica/Dubstep/Dubstep,Cool/Wary / Defiant,Medium Tempo/Medium/60s
284347237,Muse,Take A Bow,Black Holes And Revelations,Male/Male Group,2006,Alternative a Punk/Alternative/Alternative Rock,Brooding/Dreamy Brooding,Medium Tempo/Medium/60s
283715344,Billy Joel,Honesty,52nd Street,Male/Male,1978,Pop/Western Pop/Singer-Songwriter,Brooding/Evocative / Intriguing,Medium Tempo/Medium/60s
282069426,Fleur,Будь моим смыслом,Будь моим смыслом,Female/Female Group,2015,Rock/Metal/Gothic Metal,Yearning/Energetic Yearning,Medium Tempo/Medium/60s
280507737,Ours,Red Colored Stars,Precious,Male/Male Group,2002,Alternative a Punk/Alternative/Alternative Singer-Songwriter,Brooding/Dreamy Brooding,Medium Tempo/Medium/60s
279424748,High School Musical Cast,Start Of Something New,High School Musical,Mixed/Mixed Group,2006,Soundtrack/Original Film/TV Music/Musical Film/TV Music,Empowering/Dramatic Emotion,Medium Tempo/Medium/60s
271034927,The Stranglers,Golden Brown,All Live and All of the Night,Male/Male Group,1988,Alternative a Punk/Indie Rock/Original Post-Punk,Cool/Dark Groovy,Medium Tempo/Medium/60s
268970814,Cirque Du Soleil,Atmadja,Quidam,Mixed/Mixed Group,1996,Other/New Age/Adult Alternative New Age,Serious/Thrilling,Medium Tempo/Medium/60s
252197941,Tim Minchin,Inflatable You,Darkside,Male/Male,2005,Other/Comedy/Comedy,Gritty/Gritty / Soulful,Medium Tempo/Medium/60s
250338780,The Cinematic Orchestra,Arrival Of The Birds,The Crimson Wing: Mystery Of The Flamingos,Mixed/Mixed Group,2009,Electronica/Downtempo Lounge a Ambient/General Downtempo,Romantic/Dramatic / Romantic,Medium Tempo/Medium/60s
242647599,Coldplay,Green Eyes,A Rush Of Blood To The Head,Male/Male Group,2002,Alternative a Punk/Brit Rock/Brit Rock,Empowering/Strong / Stable,Medium Tempo/Medium/60s
208971939,Chris Cornell,You Know My Name,Carry On,Male/Male,2007,Rock/Adult Alternative Rock/Adult Alternative Rock,Yearning/Energetic Yearning,Medium Tempo/Medium/60s
198777350,Rival State,Sleep Talker,Apollo Me,"",2012,Alternative a Punk/Alternative/Alternative Rock,Defiant/Heavy Brooding,Medium Tempo/Medium/60s
192472873,Lisa Miskovsky,Still Alive (Benny Benassi mix),Still Alive (The Theme From Mirror's Edge): The Remixes,Female/Female,2008,Pop/Western Pop/Adult Alternative Pop,Yearning/Energetic Yearning,Medium Tempo/Medium/60s
192034858,Ludovico Einaudi,Primavera,The Royal Albert Hall Concert,Male/Male,2010,Classical/Classical Crossover/Classical Crossover Instrumental,Romantic/Dramatic / Romantic,Medium Tempo/Medium/60s
173121318,a-ha,Foot Of The Mountain,Foot Of The Mountain,Male/Male Group,2009,Alternative a Punk/New Wave Pop/New Wave Pop,Yearning/Energetic Yearning,Medium Tempo/Medium/60s
171877314,James Blunt,No Tears,Some Kind Of Trouble,Male/Male,2010,Pop/Western Pop/Adult Alternative Pop,Empowering/Dramatic Emotion,Medium Tempo/Medium/60s
170686351,Various Artists,Bikini (Cyberpunker Remix),Remixes by Discograph,"",2014,Rock/70's Rock/Classic Rock,Defiant/Attitude / Defiant,Medium Tempo/Medium/60s
166740135,Motorama,Alps,Alps,Mixed/Mixed Group,2013,Rock/Mainstream Rock/General Mainstream Rock,Yearning/Energetic Yearning,Medium Tempo/Medium/60s
166733165,Motorama,Ship,Alps,Mixed/Mixed Group,2013,Rock/Mainstream Rock/General Mainstream Rock,Yearning/Sensitive / Exploring,Medium Tempo/Medium/60s
133323086,The Hardkiss,Babylon,Stones and Honey,Mixed/Mixed Group,2014,Electronica/Electronica Mainstream/Pop Electronica,Sophisticated/Smoky / Romantic,Medium Tempo/Medium/60s
122607021,Yeah Yeah Yeahs,Cheated Hearts,Show Your Bones,Mixed/Mixed Group,2006,Alternative a Punk/Indie Rock/Post-Punk Revival,Empowering/Powerful / Heroic,Medium Tempo/Medium/60s
109276099,The Pierces,Secret,Thirteen Tales Of Love a Revenge,Female/Female Duo,2008,Pop/Western Pop/Adult Alternative Pop,Sensual/Dreamy Pulse,Medium Tempo/Medium/60s
76014341,Toru Tanabe,Itsumo nando demo (from Spirited Away),Toru Tanabe - Anime Classics,"",2006,Pop/Western Pop/Pop Vocal,Sophisticated/Smoky / Romantic,Medium Tempo/Medium/60s
74970214,Vanessa-Mae,Toccata a Fugue In D Minor,The Violin Player,Female/Female,1995,Classical/Classical Crossover/Classical Crossover Instrumental,Somber/Enigmatic / Mysterious,Medium Tempo/Medium/60s
74910515,Vanessa-Mae,Toccata a Fugue In D Minor,The Violin Player,Female/Female,1995,Classical/Classical Crossover/Classical Crossover Instrumental,Somber/Enigmatic / Mysterious,Medium Tempo/Medium/60s
68189092,Jem,They,Finally Woken,Female/Female,2004,Pop/Western Pop/Adult Alternative Pop,Sensual/Intimate,Medium Tempo/Medium/60s
