id,artist,title,album_title,artist_type,album_year,genre,mood,tempo
456239190,Leighton Meester,Heartstrings,Heartstrings,Female/Female,2014,Pop/Western Pop/Dance Pop,Yearning/Energetic Yearning,Medium Tempo/Medium Fast/100s
456239188,The Rasmus,First Day Of My Life,Dead Letters,Male/Male Group,2003,Alternative a Punk/Alternative/Alternative Rock,Defiant/Heavy Brooding,Medium Tempo/Medium Fast/100s
456239187,The Rosebuds,Boxcar,Birds Make Good Neighbours,Mixed/Mixed Duo,2005,Alternative a Punk/Indie Rock/Indie Pop,Yearning/Energetic Yearning,Medium Tempo/Medium/60s
456239185,The Rasmus,Immortal,Hide From The Sun,Male/Male Group,2005,Alternative a Punk/Alternative/Alternative Rock,Defiant/Heavy Brooding,Medium Tempo/Medium/70s
456239184,The Rasmus,Night After Night (Out Of The Shadows),Hide From The Sun,Male/Male Group,2005,Alternative a Punk/Alternative/Alternative Rock,Defiant/Heavy Brooding,Medium Tempo/Medium Fast/100s
456239183,The Rasmus,Lucifer's Angel,Hide From The Sun,Male/Male Group,2005,Alternative a Punk/Alternative/Alternative Rock,Defiant/Heavy Brooding,Medium Tempo/Medium/70s
456239181,Apocalyptica Feat. Adam Gontier,I Don't Care,I Don't Care,Male/Male Group,2007,Rock/Metal/Progressive Metal,Brooding/Energetic Melancholy,Medium Tempo/Medium/80s
456239179,R.E.M.,Bittersweet Me,New Adventures In Hi-Fi,Male/Male Group,1996,Rock/Adult Alternative Rock/Adult Alternative Rock,Brooding/Energetic Melancholy,Medium Tempo/Medium Fast/120s
456239178,Linkin Park,Given Up,Minutes To Midnight,Male/Male Group,2007,Rock/Metal/Rap Metal,Aggressive/Aggressive Power,Medium Tempo/Medium Fast/100s
456239177,Florence + The Machine,Girl With One Eye,Lungs,Mixed/Mixed Group,2009,Alternative a Punk/Alternative/Alternative Singer-Songwriter,Sophisticated/Smoky / Romantic,Medium Tempo/Medium/60s
456239175,Florence + The Machine,Hardest Of Hearts,Lungs: The B-Sides,Mixed/Mixed Group,2009,Alternative a Punk/Alternative/Alternative Singer-Songwriter,Sensual/Dreamy Pulse,Medium Tempo/Medium/60s
456239174,ウォン・ウィンツァン,旅のはじめに,光の華 [Disc 2] PianoaStrings Version,Male/Male,2009,Other/New Age/Adult Alternative New Age,Tender/Romantic / Lyrical,Medium Tempo/Medium Slow/50s
456239173,Ringo Starr,You're Sixteen,Ringo a His New All-Starr Band,Male/Male,2002,Pop/Western Pop/Singer-Songwriter,Rowdy/Ramshackle / Rollicking,Medium Tempo/Medium/60s
456239171,Flunk,Cigarette Burns,This Is What You Get,Mixed/Mixed Group,2009,Electronica/Downtempo Lounge a Ambient/Trip Hop,Yearning/Energetic Yearning,Medium Tempo/Medium Fast/110s
456239170,Blonde Redhead,Elephant Woman,Misery Is A Butterfly,Mixed/Mixed Group,2004,Alternative a Punk/Indie Rock/Noise Pop,Brooding/Energetic Melancholy,Medium Tempo/Medium/80s
456239169,New Young Pony Club,Architect of Love,The Optimist,Mixed/Mixed Group,2010,Alternative a Punk/Indie Rock/Indie Pop,Urgent/Dark Pop Intensity,Medium Tempo/Medium Fast/120s
456239168,Luigi Rubino,Before Love,A Theme for the Moon,Male/Male,2009,Other/New Age/New Acoustic,Romantic/Dramatic / Romantic,Medium Tempo/Medium Slow/50s
456239167,Luigi Rubino,Last Dance,A Theme for the Moon,Male/Male,2009,Other/New Age/New Acoustic,Romantic/Dramatic / Romantic,Medium Tempo/Medium Slow/50s
456239166,Muse,Butterflies a Hurricanes,Absolution,Male/Male Group,2003,Alternative a Punk/Alternative/Alternative Rock,Somber/Enigmatic / Mysterious,Medium Tempo/Medium Slow/50s
456239165,Paper Route,Real Emotion,Real Emotion,Male/Male Group,2016,Alternative a Punk/Synth Pop/Synth Pop,Brooding/Dreamy Brooding,Medium Tempo/Medium/70s
456239162,a-ha,Don't Do Me Any Favours,Analogue,Male/Male Group,2005,Alternative a Punk/New Wave Pop/New Wave Pop,Brooding/Energetic Melancholy,Medium Tempo/Medium Fast/90s
456239160,Echo a The Bunnymen,Lost On You,What Are You Going To Do With Your Life,Male/Male Group,1999,Alternative a Punk/Indie Rock/Original Post-Punk,Empowering/Powerful / Heroic,Medium Tempo/Medium Slow/60s
456239157,London Grammar,Hey Now,If You Wait,Mixed/Mixed Group,2013,Alternative a Punk/Indie Rock/Dream Pop,Excited/Euphoric Energy,Medium Tempo/Medium Fast/120s
456239152,Abel Korzeniowski,Dance For Me Wallis,W.E. - Music From The Motion Picture,Male/Male,2012,Soundtrack/Original Film/TV Music/General Film Music,Serious/Melodramatic,Medium Tempo/Medium/80s
456239149,M83,Do It Try It,Junk,Mixed/Mixed Group,2016,Alternative a Punk/Indie Rock/Dream Pop,Yearning/Energetic Yearning,Medium Tempo/Medium Fast/110s
456239148,M83,Go! (Featuring Mai Lan),Junk,Mixed/Mixed Group,2016,Alternative a Punk/Indie Rock/Dream Pop,Brooding/Dreamy Brooding,Medium Tempo/Medium Slow/60s
456239147,Ingrid Michaelson,Die Alone,Girls And Boys,Female/Female,2006,Pop/Western Pop/Adult Alternative Pop,Yearning/Sensitive / Exploring,Medium Tempo/Medium Fast/110s
456239145,Whitey,People,Saturday Night Ate Our Lives,Male/Male,2012,Alternative a Punk/Indie Rock/Post-Punk Revival,Cool/Dark Groovy,Medium Tempo/Medium Fast/110s
456239144,Fool's Garden,Reason,25 Miles To Kissimmee,Male/Male Group,2004,Pop/Western Pop/Adult Alternative Pop,Brooding/Evocative / Intriguing,Medium Tempo/Medium/80s
456239143,The Kinks,Sunny Afternoon [Stereo],Face To Face [Disc 2],Male/Male Group,1966,Rock/60's Rock/British Invasion,Urgent/Dark Urgent,Medium Tempo/Medium Fast/120s
456239142,Panivalkova,Крейзі Нікіта,Панівалькова,"",0,Alternative a Punk/Alternative/Alternative Rock,Energizing/Edgy / Sexy,Medium Tempo/Medium Fast/100s
456239141,Manowar,Die For Metal,Gods Of War,Male/Male Group,2007,Rock/Metal/Power Metal,Aggressive/Aggressive Power,Medium Tempo/Medium/70s
456239139,Katie Melua,All Over The World,Secret Symphony,Female/Female,2012,Pop/Western Pop/Adult Contemporary,Sensual/Soft Soulful,Medium Tempo/Medium/60s
456239138,Egor Grushin,Essential,Once,"",2016,Classical/Other Classical/General Classical,Brooding/Dreamy Brooding,Medium Tempo/Medium/60s
456239136,Esthetic Education,Crucify,Werewolf,"",2007,Rock/Mainstream Rock/General Mainstream Rock,Urgent/Energetic Anxious,Medium Tempo/Medium Fast/90s
456239135,Egor Grushin,Kaisermarsch,Dominicano,"",2015,Alternative a Punk/Alternative/Alternative Rock,Melancholy/Wistful / Forlorn,Medium Tempo/Medium Slow/60s
456239134,Egor Grushin,Beginning,Dominicano,"",2015,Alternative a Punk/Alternative/Alternative Rock,Melancholy/Light Melancholy,Medium Tempo/Medium/60s
456239132,Визбор V.S. Хутас,Мюнхгаузен,Земляника,"",2015,Pop/Western Pop/Pop Vocal,Cool/Dark Groovy,Medium Tempo/Medium/80s
456239131,Red Hot Chili Peppers,The Getaway,The Getaway,Male/Male Group,2016,Alternative a Punk/Alternative/Alternative Rock,Yearning/Sensitive / Exploring,Medium Tempo/Medium Fast/110s
456239130,Zee Avi,Honey Bee,Zee Avi,Female/Female,2009,Alternative a Punk/Indie Rock/Indie Pop,Sentimental/Tender / Sincere,Medium Tempo/Medium/80s
456239128,Stateless,Bloodstream,Stateless,Male/Male Group,2007,Alternative a Punk/Indie Rock/Post-Modern Art Music,Sensual/Intimate,Medium Tempo/Medium/70s
456239124,Red Hot Chili Peppers,Johnny Kick A Hole In The Sky,Mother's Milk,Male/Male Group,1989,Alternative a Punk/Alternative/Funk Metal,Excited/Loud Celebratory,Medium Tempo/Medium Fast/120s
456239122,Kadebostany,Walking With A Ghost,Pop Collection,Mixed/Mixed Group,2013,Alternative a Punk/Indie Rock/Indie Pop,Sophisticated/Smoky / Romantic,Medium Tempo/Medium Slow/60s
456239119,Snow Patrol,The Weight Of Love,Fallen Empires,Male/Male Group,2011,Alternative a Punk/Brit Rock/Brit Rock,Brooding/Alienated / Brooding,Medium Tempo/Medium Fast/120s
456239117,Rich Aucoin,Brian Wilson Is A.L.i.V.E. (All Living Instantly Vanquish Everything),We're All Dying To Live (Public Publication EP/Over The Top LP),Male/Male,2011,Alternative a Punk/Indie Rock/Indie Pop,Urgent/Dark Pop,Medium Tempo/Medium Fast/120s
456239116,f(x),좋아해도 되나요 (...Is It OK?),Hot Summer,Female/Female Group,2011,Pop/Korean Pop/K-Pop,Yearning/Energetic Yearning,Medium Tempo/Medium Fast/120s
456239114,Low Roar,I'Ll Keep Coming,0,Male/Male Group,2014,Alternative a Punk/Indie Rock/Post-Modern Art Music,Brooding/Dreamy Brooding,Medium Tempo/Medium/70s
456239111,The Puppini Sisters,Wuthering Heights,Betcha Bottom Dollar,Female/Female Group,2006,Jazz/Jazz Vocals/Jazz Vocals,Sophisticated/Suave / Sultry,Medium Tempo/Medium Slow/60s
456239110,Material,Life Vest,Everything I Want To Say,Male/Male Group,2013,Alternative a Punk/Indie Rock/No Wave,Defiant/Heavy Brooding,Medium Tempo/Medium/80s
456239108,Florence + The Machine,Seven Devils,Ceremonials,Mixed/Mixed Group,2011,Alternative a Punk/Alternative/Alternative Singer-Songwriter,Defiant/Heavy Brooding,Medium Tempo/Medium Slow/50s
456239107,Florence + The Machine,What The Water Gave Me,Ceremonials,Mixed/Mixed Group,2011,Alternative a Punk/Alternative/Alternative Singer-Songwriter,Brooding/Dreamy Brooding,Medium Tempo/Medium Slow/60s
456239106,Florence + The Machine,You've Got The Love,Lungs,Mixed/Mixed Group,2009,Alternative a Punk/Alternative/Alternative Singer-Songwriter,Empowering/Powerful / Heroic,Medium Tempo/Medium Fast/110s
456239104,KC a The Sunshine Band,Get Down Tonight,The Best Of KC a The Sunshine Band,Male/Male Group,1990,Electronica/Disco/Disco,Cool/Dark Groovy,Medium Tempo/Medium Fast/110s
456239103,Yann Tiersen,Summer 78,Good Bye Lenin!,Male/Male,2003,Soundtrack/Original Film/TV Music/General Film Music,Brooding/Dreamy Brooding,Medium Tempo/Medium Slow/50s
456239099,Various Artists,Is It Too Late Featuring Lena Belgart [Classic Piano Mix],Airport Lounge Vol. 2,"",2014,Electronica/Downtempo Lounge a Ambient/Ambient Electronica,Romantic/Dramatic / Romantic,Medium Tempo/Medium Slow/50s
456239098,Francesca Michielin,Nessun Grado Di Separazione,Di20are,Female/Female,2016,Pop/European Pop/Mediterranean Pop,Yearning/Energetic Yearning,Medium Tempo/Medium/70s
456239094,Halsey,Control,Badlands [Deluxe],Female/Female,2015,Electronica/Electronica Mainstream/Pop Electronica,Melancholy/Sad / Soulful,Medium Tempo/Medium Slow/60s
456239093,Diana Vickers,The Boy Who Murdered Love,Songs From The Tainted Cherry Tree,Female/Female,2010,Pop/Western Pop/Adult Alternative Pop,Brooding/Dreamy Brooding,Medium Tempo/Medium Slow/60s
456239091,Coldplay,Square One,XaY,Male/Male Group,2005,Alternative a Punk/Brit Rock/Brit Rock,Brooding/Dreamy Brooding,Medium Tempo/Medium/80s
456239087,Duke Dumont,Ocean Drive,Ocean Drive,Male/Male,2015,Electronica/House/Deep House,Energizing/Edgy / Sexy,Medium Tempo/Medium Fast/110s
456239086,Rafferty,Apple Pie,Apple Pie [Single],"",2016,Pop/Western Pop/Pop Vocal,Aggressive/Dark Hard Beat,Medium Tempo/Medium Fast/110s
456239082,Stanislav Artemyev,Time,Creatio,"",2015,Alternative a Punk/Alternative/Alternative Rock,Tender/Romantic / Lyrical,Medium Tempo/Medium/70s
456239075,Woodkid,The Deer,I Love You [Single],Male/Male,2013,Alternative a Punk/Indie Rock/Indie Pop,Serious/Thrilling,Medium Tempo/Medium Fast/120s
456239074,Rihanna,Towards The Sun,"Towards The Sun (From The ""Home"" Soundtrack)",Female/Female,2015,Urban/Contemporary RaB/Soul/Urban Crossover,Brooding/Dreamy Brooding,Medium Tempo/Medium/80s
456239071,Sneaker Pimps,Low Place Like Home,Becoming X,Mixed/Mixed Group,1997,Electronica/Downtempo Lounge a Ambient/Trip Hop,Energizing/Edgy / Sexy,Medium Tempo/Medium/80s
456239070,New Order,Elegia,Low-Life,Mixed/Mixed Group,1985,Alternative a Punk/Synth Pop/Synth Pop,Peaceful/Pastoral / Serene,Medium Tempo/Medium Slow/50s
456239067,Rob Dougan,There's Only Me,Furious Angels,Male/Male,2002,Electronica/Dance a Club/Club Dance,Brooding/Alienated / Brooding,Medium Tempo/Medium Fast/100s
456239065,Ramona Falls,Spore,Prophet,Mixed/Mixed Group,2012,Alternative a Punk/Indie Rock/General Indie Rock,Brooding/Dreamy Brooding,Medium Tempo/Medium/70s
456239062,Jason Mraz,Plane,Mr. A-Z,Male/Male,2005,Pop/Western Pop/Adult Alternative Pop,Sophisticated/Smoky / Romantic,Medium Tempo/Medium Slow/60s
456239061,Mutemath,You Are Mine,Mutemath,Male/Male Group,2006,Alternative a Punk/Alternative/Alternative Rock,Melancholy/Light Melancholy,Medium Tempo/Medium/70s
456239059,Alizée,Moi... Lolita,Gourmandises,Female/Female,2000,Pop/European Pop/French Pop,Urgent/Dark Pop Intensity,Medium Tempo/Medium Fast/100s
456239058,Puggy,When You Know,Something You Might Like,Male/Male Group,2009,Pop/Western Pop/Adult Alternative Pop,Urgent/Energetic Anxious,Medium Tempo/Medium Fast/120s
456239055,Julie Thompson With Dragon a Jontron,Loved (Radio Edit),Loved,"",2014,Electronica/Dance a Club/Club Dance,Excited/Euphoric Energy,Medium Tempo/Medium Fast/120s
456239054,DOROTHY,Raise Hell,Rockisdead,Female/Female Duo,2016,Alternative a Punk/Alternative/Alternative Dance,Defiant/Heavy Brooding,Medium Tempo/Medium/80s
456239052,Astor Piazzolla,Libertango,Libertango,Male/Male,1974,Other/Latin Traditional/Tango,Brooding/Evocative / Intriguing,Medium Tempo/Medium Fast/90s
456239051,Erlend Øye,Estate,Estate,Male/Male,2015,Alternative a Punk/Indie Rock/Indie Pop,Gritty/Depressed / Lonely,Medium Tempo/Medium/60s
456239049,Heidevolk,Deemstering,Uit Oude Grond,Male/Male Group,2012,Rock/Metal/Black Metal,Somber/Enigmatic / Mysterious,Medium Tempo/Medium/60s
456239048,Carpenter Brut,Le Perv,EP I,Male/Male,2014,Alternative a Punk/Synth Pop/Synth Pop,Energizing/Heavy Beat,Medium Tempo/Medium Fast/120s
456239047,Carpenter Brut,Escape From Midwich Valley,EP I,Male/Male,2014,Alternative a Punk/Synth Pop/Synth Pop,Defiant/Heavy Brooding,Medium Tempo/Medium Fast/90s
456239039,Hooverphonic,Amalfi,Reflection,Mixed/Mixed Group,2013,Electronica/Downtempo Lounge a Ambient/General Downtempo,Empowering/Dramatic Emotion,Medium Tempo/Medium/60s
456239037,Pete Doherty,Arcady,Grace/Wastelands,Male/Male,2009,Alternative a Punk/Indie Rock/General Indie Rock,Gritty/Sober / Determined,Medium Tempo/Medium Fast/90s
456239035,Caravan Palace,Violente Valse,Caravan Palace,Mixed/Mixed Group,2008,Electronica/Electronica Fusion/Ethno-Lounge Electronica,Brooding/Dreamy Brooding,Medium Tempo/Medium Slow/60s
456239034,Caravan Palace,Dragons,Caravan Palace,Mixed/Mixed Group,2008,Electronica/Electronica Fusion/Ethno-Lounge Electronica,Excited/Upbeat Pop Groove,Medium Tempo/Medium Fast/120s
456239033,Caro Emerald,The Wonderful In You,The Shocking Miss Emerald,Female/Female,2013,Jazz/Jazz Vocals/Jazz Vocals,Easygoing/Friendly,Medium Tempo/Medium/70s
456239031,The Hoosiers,Goodbye Mr A,The Trick To Life,Male/Male Group,2007,Alternative a Punk/Indie Rock/Indie Pop,Brooding/Energetic Melancholy,Medium Tempo/Medium Fast/90s
456239030,The Hoosiers,Worried About Ray,The Trick To Life,Male/Male Group,2007,Alternative a Punk/Indie Rock/Indie Pop,Brooding/Energetic Melancholy,Medium Tempo/Medium/80s
456239029,The Hoosiers,Cops And Robbers,The Trick To Life,Male/Male Group,2007,Alternative a Punk/Indie Rock/Indie Pop,Urgent/Energetic Anxious,Medium Tempo/Medium Fast/90s
456239026,She a Him,Why Do You Let Me Stay Here?,Volume One,Mixed/Mixed Duo,2008,Alternative a Punk/Indie Rock/Indie Pop,Upbeat/Soulful / Easygoing,Medium Tempo/Medium Fast/110s
456239025,Die Antwoord,Gucci Coochie,Mount Ninji And Da Nice Time Kid,Mixed/Mixed Group,2016,Urban/Western Hip-Hop/Rap/Conscious Hip-Hop/Rap,Defiant/Attitude / Defiant,Medium Tempo/Medium/60s
456239024,The Velvet Underground,Louise,Squeeze,Mixed/Mixed Group,1972,Alternative a Punk/New Wave Rock/New Wave Rock,Cool/Dark Groovy,Medium Tempo/Medium Fast/100s
456239023,Iyeoka,Simply Falling,Say Yes Evolved,Female/Female,2014,Urban/Contemporary RaB/Soul/Urban AC,Yearning/Energetic Yearning,Medium Tempo/Medium Fast/110s
456239022,Palast Orchester Mit Seinem Sänger Max Raabe,Original Charleston,TanzGala,"",1997,Other/Data a Other/Data a Other,Easygoing/Charming / Easygoing,Medium Tempo/Medium Fast/90s
456239019,Крихітка,Без імені,Без імені,"",2015,Rock/Mainstream Rock/General Mainstream Rock,Brooding/Energetic Melancholy,Medium Tempo/Medium Fast/120s
443991926,Explosions In The Sky,Magic Hours,How Strange Innocence,Male/Male Group,2000,Alternative a Punk/Indie Rock/Post-Rock,Melancholy/Light Melancholy,Medium Tempo/Medium/60s
443985873,Metric,Soft Rock Star,Grow Up and Blow Away,Mixed/Mixed Group,2007,Alternative a Punk/Indie Rock/Post-Punk Revival,Excited/Upbeat Pop Groove,Medium Tempo/Medium/80s
443980448,Amanda Palmer,Astronaut,Who Killed Amanda Palmer,Female/Female,2008,Alternative a Punk/Indie Rock/Indie Pop,Brooding/Alienated / Brooding,Medium Tempo/Medium Fast/100s
443750086,The Maccabees,Mary,Colour It In,Male/Male Group,2007,Alternative a Punk/Indie Rock/General Indie Rock,Urgent/Energetic Anxious,Medium Tempo/Medium/80s
443450694,Hedged,Every Time I Call,Serving Time,"",2008,Rock/Mainstream Rock/General Mainstream Rock,Defiant/Heavy Brooding,Medium Tempo/Medium/70s
435603463,KONAMI,Shot Down in Flames,SILENT HILL ZERO ORIGINAL SOUNDTRACK,Unknown/Other,2008,Soundtrack/Game Music/Game Music,Defiant/Heavy Brooding,Medium Tempo/Medium/70s
435569630,Monarchy,Living Without You,Abnocto,Male/Male Duo,2015,Electronica/House/General House,Urgent/Energetic Anxious,Medium Tempo/Medium Fast/120s
433697977,Laura Marling,My Manic And I,Alas I Cannot Swim,Female/Female,2008,Alternative a Punk/Alternative Folk/Alternative Folk,Sophisticated/Smoky / Romantic,Medium Tempo/Medium/80s
432650002,Parov Stelar,Booty Swing,The Princess: The Vinyl Collection 2010 - 2012,Male/Male,2012,Electronica/Electronica Fusion/Ethno-Lounge Electronica,Urgent/Dark Pop Intensity,Medium Tempo/Medium Fast/110s
432602349,Parov Stelar,Catgroove,Coco Pt. 2,Male/Male,2009,Electronica/Electronica Fusion/Ethno-Lounge Electronica,Energizing/Arousing Groove,Medium Tempo/Medium Fast/120s
432517617,Caravan Palace,Lone Digger,<I°_°I>,Mixed/Mixed Group,2015,Electronica/Electronica Fusion/Ethno-Lounge Electronica,Energizing/Arousing Groove,Medium Tempo/Medium Fast/120s
432067240,Young The Giant,Cough Syrup,Young The Giant,Male/Male Group,2010,Alternative a Punk/Alternative/Alternative Rock,Empowering/Powerful / Heroic,Medium Tempo/Medium/60s
431790277,Tarja Turunen,In For A Kill,What Lies Beneath [Disc 1],Female/Female,2010,Rock/Metal/Progressive Metal,Defiant/Heavy Brooding,Medium Tempo/Medium Fast/90s
431724224,Alice Francis,Shoot Him Down (Parov Stelar Radio Version),Shoot Him Down (The Parov Stelar Versions),Female/Female,2012,Electronica/Electronica Fusion/Ethno-Lounge Electronica,Energizing/Edgy / Sexy,Medium Tempo/Medium Fast/120s
431719462,Caravan Palace,Jolie Coquine,Caravan Palace,Mixed/Mixed Group,2008,Electronica/Electronica Fusion/Ethno-Lounge Electronica,Energizing/Edgy / Sexy,Medium Tempo/Medium Fast/120s
431369393,Vince Giordano's Nighthawks,Sweet Man,Quality Shout,Male/Male Group,1993,Jazz/Big Band a Swing/Big Band,Lively/Playful / Swingin',Medium Tempo/Medium Fast/110s
431140244,Yann Tiersen,Rue Des Cascades,C'Etait Ici [Disc 1],Male/Male,2002,Soundtrack/Original Film/TV Music/General Film Music,Melancholy/Wistful / Forlorn,Medium Tempo/Medium/60s
430933182,Caro Emerald,Pack Up The Louie (Caravan Palace Remix),The Shocking Miss Emerald,Female/Female,2016,Jazz/Jazz Vocals/Jazz Vocals,Energizing/Edgy / Sexy,Medium Tempo/Medium Fast/110s
430376085,Die Form,Cantique,Best Of XXX [Disc 2],Mixed/Mixed Duo,2008,Alternative a Punk/Goth/Goth,Brooding/Dreamy Brooding,Medium Tempo/Medium/60s
430306806,Dirty Youth,The One,Gold Dust,"",2015,Rock/Mainstream Rock/General Mainstream Rock,Urgent/Energetic Anxious,Medium Tempo/Medium Fast/120s
429447048,Rushnychok (Рушничок),Moon and the Stars - Місяць і зіроньки,Rushnychok Vol. 5,"",2012,Traditional/Other Traditions/General World,Romantic/Heartfelt Passion,Medium Tempo/Medium/70s
428750491,Flagrant Fowl,"Feist's ""Gatekeeper"" (Pocketknife's Faded Beach Towel Remix)",Tambourine Dream,"",2007,Electronica/Trance/Trance,Urgent/Dark Pop,Medium Tempo/Medium Fast/120s
428704221,Tarja Turunen,Victim Of Ritual,Colours In The Dark,Female/Female,2013,Rock/Metal/Progressive Metal,Brooding/Evocative / Intriguing,Medium Tempo/Medium Slow/60s
428693587,Tarja Turunen,Never Enough,Colours In The Dark,Female/Female,2013,Rock/Metal/Progressive Metal,Rowdy/Confident / Tough,Medium Tempo/Medium Fast/120s
428691497,Tarja Turunen,I Walk Alone (Live At Teatro El Círculo Rosario Argentina/2012),Act 1 (Live At Teatro El Círculo Rosario Argentina/2012) [Disc 1],Female/Female,2012,Rock/Metal/Progressive Metal,Brooding/Evocative / Intriguing,Medium Tempo/Medium/70s
428510526,Radiohead,Let Down,OK Computer,Male/Male Group,1997,Alternative a Punk/Brit Rock/Brit Rock,Yearning/Energetic Dreamy,Medium Tempo/Medium Fast/100s
427975967,Chaos Chaos,Do You Feel It?,Committed to the Crime,Female/Female Duo,2014,Rock/Adult Alternative Rock/Adult Alternative Rock,Cool/Cool Confidence,Medium Tempo/Medium/60s
427085610,Corde Oblique,Cantastorie,Volonta d'Arte,"",2008,Traditional/Country/General Country,Melancholy/Wistful / Forlorn,Medium Tempo/Medium Slow/50s
426321858,The Prodigy,The Day Is My Enemy,The Day Is My Enemy,Male/Male Group,2015,Electronica/Electronica Mainstream/Big Beat,Aggressive/Aggressive Power,Medium Tempo/Medium Fast/100s
426321071,Of Monsters And Men,Thousand Eyes,Beneath The Skin,Mixed/Mixed Group,2015,Alternative a Punk/Alternative Folk/Alternative Folk,Somber/Enigmatic / Mysterious,Medium Tempo/Medium Slow/50s
425702571,The Radio Dept.,Strange Things Will Happen,Lesser Matters,Male/Male Group,2004,Alternative a Punk/Indie Rock/Dream Pop,Romantic/Heartfelt Passion,Medium Tempo/Medium/60s
425243254,O. Children,Ruins,Ruins [Single],"",2010,Alternative a Punk/Indie Rock/General Indie Rock,Defiant/Heavy Brooding,Medium Tempo/Medium Fast/120s
425073146,Nik Page,Voices from Outer Space,Rocketqueen,"",2009,Pop/Western Pop/Pop Vocal,Defiant/Heavy Brooding,Medium Tempo/Medium/80s
424458901,Kaleida,Think,Think,Female/Female Duo,2015,Electronica/Electronica Mainstream/Pop Electronica,Sensual/Dreamy Pulse,Medium Tempo/Medium/60s
424444859,Archive,Bullets,Controlling Crowds,Mixed/Mixed Group,2009,Electronica/Downtempo Lounge a Ambient/Trip Hop,Brooding/Evocative / Intriguing,Medium Tempo/Medium/80s
423646791,The Mamas a The Papas,Words Of Love,16 Greatest Hits,Mixed/Mixed Group,1970,Pop/Western Pop/Folk Pop,Upbeat/Soulful / Easygoing,Medium Tempo/Medium Fast/110s
423494427,Low,Step,The Great Destroyer,Mixed/Mixed Group,2005,Alternative a Punk/Indie Rock/Slowcore,Brooding/Alienated / Brooding,Medium Tempo/Medium Fast/110s
421344736,The Poppy Family,There's No Blood in Bone,A Good Thing Lost: 1968-1973,Mixed/Mixed Group,1996,Rock/60's Rock/Psychedelic Pop,Fiery/Dark Sparkling Lyrical,Medium Tempo/Medium Fast/100s
420190821,Parov Stelar,Hurt,Coco Pt. 1,Male/Male,2009,Electronica/Electronica Fusion/Ethno-Lounge Electronica,Urgent/Dark Pop,Medium Tempo/Medium Fast/100s
420170885,Elizaveta,Meant,Beatrix Runs,Female/Female,2012,Alternative a Punk/Indie Rock/Indie Pop,Brooding/Dreamy Brooding,Medium Tempo/Medium/70s
419631257,Kila,Dusty Wine Bottle,The Best Of Kila,"",2009,Traditional/Other Traditions/General World,Romantic/Dramatic / Romantic,Medium Tempo/Medium/70s
419625466,2CELLOS,The Trooper (Overture),Celloverse,Male/Male Duo,2015,Classical/Classical Crossover/Classical Crossover Instrumental,Rowdy/Ramshackle / Rollicking,Medium Tempo/Medium Fast/90s
419622461,Tiamat,Love In Chains,Prey,Male/Male Group,2003,Rock/Metal/Gothic Metal,Brooding/Alienated / Brooding,Medium Tempo/Medium Fast/90s
419619487,The Mamas a The Papas,Dancing In The Street,16 Greatest Hits,Mixed/Mixed Group,1970,Pop/Western Pop/Folk Pop,Excited/Loud Celebratory,Medium Tempo/Medium Fast/120s
419608365,Karpatt,Des Idées,Dans D'Beaux Draps,Male/Male Group,2005,Pop/European Pop/Chanson,Cool/Dark Groovy,Medium Tempo/Medium/80s
417977485,Manowar,Warriors Of The World United,Warriors Of The World,Male/Male Group,2002,Rock/Metal/Power Metal,Aggressive/Aggressive Power,Medium Tempo/Medium/80s
416259986,Demi Lovato,Cool For The Summer,Confident [Deluxe Edition],Female/Female,2015,Pop/Western Pop/Dance Pop,Urgent/Energetic Anxious,Medium Tempo/Medium Fast/110s
416484045,Flёur,Тёплые Коты,Эйфория,Female/Female Group,2008,Rock/Metal/Gothic Metal,Fiery/Passionate Rhythm,Medium Tempo/Medium Fast/90s
414963202,The Neighbourhood,Afraid,I Love You.,Male/Male Group,2013,Alternative a Punk/Indie Rock/Indie Pop,Defiant/Heavy Brooding,Medium Tempo/Medium/80s
414946310,UNKLE,When Things Explode (Featuring Ian Astbury),War Stories,Male/Male Group,2007,Electronica/Downtempo Lounge a Ambient/Trip Hop,Brooding/Dreamy Brooding,Medium Tempo/Medium/70s
414942060,The Radio Dept.,It's Personal,Pet Grief,Male/Male Group,2006,Alternative a Punk/Indie Rock/Dream Pop,Somber/Enigmatic / Mysterious,Medium Tempo/Medium Slow/60s
414568356,Low Roar,Friends Make Garbage (Good Friends Take It Out),Low Roar,Male/Male Group,2007,Alternative a Punk/Indie Rock/Post-Modern Art Music,Yearning/Sensitive / Exploring,Medium Tempo/Medium Slow/60s
414550755,Matthew Sweet,Lost My Mind,100% Fun,Male/Male,1995,Rock/Power Pop/Power Pop,Brooding/Energetic Melancholy,Medium Tempo/Medium Slow/50s
414548485,Poe,Haunted,Haunted,Female/Female,2000,Alternative a Punk/Alternative/Alternative Singer-Songwriter,Yearning/Energetic Yearning,Medium Tempo/Medium/80s
410625158,She Makes War,In This Boat,Little Battles,Female/Female,2012,Alternative a Punk/Alternative/Alternative Singer-Songwriter,Brooding/Dreamy Brooding,Medium Tempo/Medium/80s
410286555,Mylène Farmer,Pourvu Qu'elles Soient Douces,Les Mots,Female/Female,2001,Pop/European Pop/French Pop,Gritty/Sober / Determined,Medium Tempo/Medium Fast/90s
410107241,Genitorturers,Kabangin' All Night,Blackheart Revolution,Mixed/Mixed Group,2009,Rock/Metal/Industrial Metal,Aggressive/Dark Hard Beat,Medium Tempo/Medium/80s
408688668,Powerwolf,Sanctified with Dynamite,Blood of the Saints,Male/Male Group,2011,Rock/Metal/Power Metal,Defiant/Heavy Brooding,Medium Tempo/Medium/80s
