id,artist,title,album_title,artist_type,album_year,genre,mood,tempo
408415423,Tim Minchin,Confessions,Ready For This ?,Male/Male,2009,Other/Comedy/Comedy,Gritty/Sober / Determined,Medium Tempo/Medium/60s
408407908,a-ha,Objects In The Mirror,Cast In Steel,Male/Male Group,2015,Alternative a Punk/New Wave Pop/New Wave Pop,Brooding/Energetic Melancholy,Medium Tempo/Medium Fast/110s
408407893,Muse,City Of Delusion,Black Holes And Revelations,Male/Male Group,2006,Alternative a Punk/Alternative/Alternative Rock,Defiant/Heavy Brooding,Medium Tempo/Medium Fast/120s
408407849,Muse,Stockholm Syndrome,Absolution,Male/Male Group,2003,Alternative a Punk/Alternative/Alternative Rock,Defiant/Heavy Brooding,Medium Tempo/Medium Fast/120s
407082834,She a Him,Why Do You Let Me Stay Here?,Volume One,Mixed/Mixed Duo,2008,Alternative a Punk/Indie Rock/Indie Pop,Upbeat/Soulful / Easygoing,Medium Tempo/Medium Fast/110s
406209921,Kylie Minogue,Confide In Me,Kylie Minogue,Female/Female,1994,Pop/Western Pop/Dance Pop,Fiery/Fiery Groove,Medium Tempo/Medium Fast/100s
402596312,Muse,Starlight,Black Holes And Revelations,Male/Male Group,2006,Alternative a Punk/Alternative/Alternative Rock,Defiant/Heavy Brooding,Medium Tempo/Medium Fast/120s
402592190,Muse,Bliss,Origin Of Symmetry,Male/Male Group,2001,Alternative a Punk/Alternative/Alternative Rock,Defiant/Heavy Brooding,Medium Tempo/Medium Fast/120s
402588376,Muse,New Born,Origin Of Symmetry,Male/Male Group,2001,Alternative a Punk/Alternative/Alternative Rock,Brooding/Alienated / Brooding,Medium Tempo/Medium/70s
402587741,Muse,Feeling Good,Origin Of Symmetry,Male/Male Group,2001,Alternative a Punk/Alternative/Alternative Rock,Brooding/Evocative / Intriguing,Medium Tempo/Medium/70s
400471362,Dead Man's Bones,In The Room Where You Sleep,Dead Man's Bones,Male/Male Duo,2009,Alternative a Punk/Indie Rock/Indie Pop,Somber/Enigmatic / Mysterious,Medium Tempo/Medium/60s
400411047,Tim Minchin,Canvas Bags,Ready For This ?,Male/Male,2009,Other/Comedy/Comedy,Empowering/Powerful / Heroic,Medium Tempo/Medium/80s
399990386,Tim Minchin,Dark Side,Ready For This ?,Male/Male,2009,Other/Comedy/Comedy,Urgent/Energetic Anxious,Medium Tempo/Medium Fast/120s
399959269,Tim Minchin,Ten Foot Cock a A Few Hundred Virgins,Darkside,Male/Male,2005,Other/Comedy/Comedy,Sophisticated/Intimate Bittersweet,Medium Tempo/Medium/80s
399958221,Tim Minchin,The Good Book,Ready For This ?,Male/Male,2009,Other/Comedy/Comedy,Rowdy/Ramshackle / Rollicking,Medium Tempo/Medium Fast/120s
399611759,Hot As Sun,Mother I'm Alive,Night Time Sound Desire,Female/Female Duo,2013,Alternative a Punk/Indie Rock/Dream Pop,Brooding/Dreamy Brooding,Medium Tempo/Medium Slow/50s
398964026,Blondie,Call Me,Live,Mixed/Mixed Group,1999,Alternative a Punk/New Wave Pop/New Wave Pop,Brooding/Energetic Melancholy,Medium Tempo/Medium/80s
397023478,Metronomy,Love Letters,Love Letters,Mixed/Mixed Group,2014,Alternative a Punk/Synth Pop/Synth Pop,Fiery/Passionate Rhythm,Medium Tempo/Medium Fast/120s
397002727,Cœur De Pirate,Oceans Brawl,Roses,Female/Female,2015,Pop/European Pop/Chanson,Brooding/Evocative / Intriguing,Medium Tempo/Medium/80s
396815761,Cat Stevens,Morning Has Broken,Teaser And The Firecat,Male/Male,1971,Pop/Western Pop/Folk Pop,Sentimental/Tender / Sincere,Medium Tempo/Medium/60s
396285169,Disturbed,Save Our Last Goodbye,Immortalized [Deluxe Edition],Male/Male Group,2015,Rock/Metal/Nu-Metal,Defiant/Heavy Brooding,Medium Tempo/Medium Fast/90s
395987519,Isaac Shepard,Sprinkle to Rain,Swept Away,"",2005,Alternative a Punk/Alternative/Alternative Rock,Romantic/Dramatic / Romantic,Medium Tempo/Medium/70s
395476165,a-ha,Forest Fire,Cast In Steel,Male/Male Group,2015,Alternative a Punk/New Wave Pop/New Wave Pop,Yearning/Energetic Yearning,Medium Tempo/Medium/80s
395300829,Fabrizio Paterlini,Veloma,Fragments Viandanze,Male/Male,0,Other/New Age/New Acoustic,Tender/Romantic / Lyrical,Medium Tempo/Medium/70s
393851786,DJ Vadim,Beyond Thought,U.S.S.R. Reconstruction,Male/Male,2005,Electronica/Downtempo Lounge a Ambient/Ambient Electronica,Sensual/Dreamy Pulse,Medium Tempo/Medium/70s
393698569,Mydy Rabycad,Drowning,Let Your Body Move,Mixed/Mixed Group,2013,Electronica/Electronica Fusion/Ethno-Lounge Electronica,Excited/Euphoric Energy,Medium Tempo/Medium Fast/120s
393215675,Stanislav Artemyev,Manifestation,Manifestation,"",2014,Other/Data a Other/Data a Other,Sentimental/Lyrical Sentimental,Medium Tempo/Medium/60s
393177486,Stanislav Artemyev,Gust (Orchestral),Manifestation,"",2014,Other/Data a Other/Data a Other,Romantic/Dramatic / Romantic,Medium Tempo/Medium/60s
393175421,Stanislav Artemyev,Gust (Instrumental),Manifestation,"",2014,Other/Data a Other/Data a Other,Sentimental/Lyrical Sentimental,Medium Tempo/Medium Slow/50s
393063159,Apocalyptica,How Far - (Vocals Marta Jandová),Apocalyptica - Special Edition,Male/Male Group,2005,Rock/Metal/Progressive Metal,Defiant/Heavy Brooding,Medium Tempo/Medium Fast/100s
393063154,Apocalyptica,Faraway,Reflections,Male/Male Group,2003,Rock/Metal/Progressive Metal,Romantic/Dramatic / Romantic,Medium Tempo/Medium/70s
392277104,Dead Man's Bones,Lose Your Soul,Dead Man's Bones,Male/Male Duo,2009,Alternative a Punk/Indie Rock/Indie Pop,Brooding/Alienated / Brooding,Medium Tempo/Medium Fast/120s
392069873,Disturbed,Never Wrong,Immortalized [Deluxe Edition],Male/Male Group,2015,Rock/Metal/Nu-Metal,Defiant/Hard Dark Excitement,Medium Tempo/Medium Fast/100s
391828382,Portishead,Elysium,Portishead,Mixed/Mixed Group,1997,Electronica/Downtempo Lounge a Ambient/Trip Hop,Urgent/Energetic Anxious,Medium Tempo/Medium/80s
390637627,DRC Music,Lingala (feat. Bokatola System and Evala Litongo),Kinshasa One Two,Mixed/Mixed Group,2011,Pop/Western Pop/World Pop Fusion,Energizing/Heavy Beat,Medium Tempo/Medium Fast/120s
390390135,Everything But The Girl,Missing (Todd Terry Mix),E.B.T.G. (Acoustic Collection),Mixed/Mixed Duo,0,Pop/Western Pop/Adult Contemporary,Energizing/Abstract Beat,Medium Tempo/Medium Fast/120s
390389299,ATB,Missing,Future Memories,Male/Male,2009,Electronica/Trance/Trance,Sensual/Dreamy Pulse,Medium Tempo/Medium Slow/60s
389277478,Metronomy,Trouble,The English Riviera,Mixed/Mixed Group,2011,Alternative a Punk/Synth Pop/Synth Pop,Brooding/Dreamy Brooding,Medium Tempo/Medium/70s
389225487,Bethel Music,This Is What You Do,The Loft Sessions,Mixed/Mixed Group,2012,Other/Religious/Christian Alt-Rock,Brooding/Dreamy Brooding,Medium Tempo/Medium/70s
388554389,Florence + The Machine,Rabbit Heart (Raise It Up),Lungs,Mixed/Mixed Group,2009,Alternative a Punk/Alternative/Alternative Singer-Songwriter,Excited/Upbeat Pop Groove,Medium Tempo/Medium Fast/110s
388467990,Max Frost,White Lies,White Lies,Male/Male,2013,Pop/Western Pop/Urban Crossover: Pop,Rowdy/Driving Dark Groove,Medium Tempo/Medium/80s
388030549,M83,I Need You,Divergent: Original Motion Picture Soundtrack,Mixed/Mixed Group,2014,Alternative a Punk/Indie Rock/Dream Pop,Brooding/Dreamy Brooding,Medium Tempo/Medium/70s
388013037,The Funk Junkeez,I Love It Loud (Injected Mix),Injected,Male/Male Group,1995,Alternative a Punk/Alternative/Funk Metal,Aggressive/Aggressive Power,Medium Tempo/Medium Fast/100s
388004650,Muse,Exo-Politics,Black Holes And Revelations,Male/Male Group,2006,Alternative a Punk/Alternative/Alternative Rock,Defiant/Heavy Brooding,Medium Tempo/Medium Fast/120s
387566042,Revolver,Get Around Town,Music For A While,Male/Male Group,2009,Alternative a Punk/Indie Rock/Indie Pop,Gritty/Strumming Yearning,Medium Tempo/Medium Fast/90s
387556732,Florence + The Machine,Queen Of Peace,How Big How Blue How Beautiful,Mixed/Mixed Group,2015,Alternative a Punk/Alternative/Alternative Singer-Songwriter,Brooding/Energetic Melancholy,Medium Tempo/Medium Fast/120s
387544556,System Of A Down,This Cocaine Makes Me Feel Like I'm On This Song,Mezmerize,Male/Male Group,2005,Rock/Metal/Nu-Metal,Defiant/Hard Dark Excitement,Medium Tempo/Medium Fast/100s
387440364,BarlowGirl,Never Alone,BarlowGirl,Female/Female Group,2005,Other/Religious/Christian Rock a Metal,Defiant/Heavy Brooding,Medium Tempo/Medium Fast/90s
386970688,Robbie Williams,The Road To Mondalay,The Best Of,Male/Male,0,Pop/Western Pop/Adult Contemporary,Gritty/Strumming Yearning,Medium Tempo/Medium Fast/90s
386479824,Ilya Beshevli,Night Forest,Night Forest,"",2014,Other/Data a Other/Data a Other,Tender/Romantic / Lyrical,Medium Tempo/Medium Slow/60s
381719795,Of Monsters And Men,Crystals,Beneath The Skin,Mixed/Mixed Group,2015,Alternative a Punk/Alternative Folk/Alternative Folk,Yearning/Sensitive / Exploring,Medium Tempo/Medium/60s
380743679,Belasco,Chloroform,61,Male/Male Group,2007,Alternative a Punk/Alternative/Alternative Rock,Brooding/Alienated / Brooding,Medium Tempo/Medium Fast/90s
380676405,She Wants Revenge,Rachael,This Is Forever,Male/Male Duo,2007,Alternative a Punk/Indie Rock/Post-Punk Revival,Brooding/Alienated / Brooding,Medium Tempo/Medium/70s
380288822,Mini Mansions,Vertigo (Featuring Alex Turner),The Great Pretenders,Male/Male Group,2015,Alternative a Punk/Indie Rock/Neo-Psychedelic,Brooding/Dreamy Brooding,Medium Tempo/Medium/80s
380287413,VAST,Turquoise,Nude,Male/Male Group,2006,Rock/70's Rock/Neo-Prog Rock,Urgent/Energetic Anxious,Medium Tempo/Medium Fast/110s
379976684,a-ha,Stop! And Make Your Mind Up,Hunting High And Low [Disc 2],Male/Male Group,1985,Alternative a Punk/New Wave Pop/New Wave Pop,Stirring/Jubilant / Soulful,Medium Tempo/Medium/70s
379594105,Hybrid,Disappear Here,Disappear Here,Mixed/Mixed Group,2010,Electronica/Techno/Classic Techno,Sensual/Dreamy Pulse,Medium Tempo/Medium Slow/60s
375841169,Metronomy,The Look,The English Riviera,Mixed/Mixed Group,2011,Alternative a Punk/Synth Pop/Synth Pop,Fiery/Dark Sparkling Lyrical,Medium Tempo/Medium/80s
375370981,Exgf,We Are The Hearts,We Are The Hearts,Mixed/Mixed Group,2015,Alternative a Punk/Synth Pop/Synth Pop,Brooding/Dreamy Brooding,Medium Tempo/Medium/60s
375137308,The Pretty Reckless,Make Me Wanna Die,Light Me Up,Mixed/Mixed Group,2010,Alternative a Punk/Alternative/Alternative Rock,Urgent/Energetic Anxious,Medium Tempo/Medium Fast/90s
373293053,Two Door Cinema Club,Sun,Beacon,Male/Male Group,2012,Alternative a Punk/Synth Pop/Synth Pop,Urgent/Dark Pop Intensity,Medium Tempo/Medium Fast/90s
372863777,Eels,Fresh Blood,Hombre Lobo,Male/Male Group,2009,Alternative a Punk/Indie Rock/General Indie Rock,Brooding/Alienated / Brooding,Medium Tempo/Medium Fast/90s
372588201,Vivienne Mort,Г.Г.П.Т.К.Н.,Театр Pipinó,"",2014,Pop/Western Pop/Pop Vocal,Sophisticated/Smoky / Romantic,Medium Tempo/Medium Slow/60s
372576222,Yeah Yeah Yeahs,Dull Life,It's Blitz,Mixed/Mixed Group,2009,Alternative a Punk/Indie Rock/Post-Punk Revival,Urgent/Dark Pop Intensity,Medium Tempo/Medium Fast/100s
372574980,I Monster,Daydream In Blue,neveroddoreven,Male/Male Duo,2004,Electronica/Downtempo Lounge a Ambient/General Downtempo,Sensual/Dreamy Pulse,Medium Tempo/Medium/70s
372347361,Eels,Flyswatter,Daisies Of The Galaxy,Male/Male Group,2000,Alternative a Punk/Indie Rock/General Indie Rock,Cool/Wary / Defiant,Medium Tempo/Medium Slow/60s
371170069,Sid Vicious,C'mon Everybody,Too Fast To Live...,Male/Male Group,2004,Alternative a Punk/Punk/Old School Punk,Brooding/Evocative / Intriguing,Medium Tempo/Medium/80s
371119058,Temples,The Guesser,Sun Structures,Male/Male Group,2014,Alternative a Punk/Indie Rock/Neo-Psychedelic,Yearning/Energetic Yearning,Medium Tempo/Medium Slow/60s
370687398,Elina Born a Stig Rästa,Goodbye To Yesterday,Goodbye To Yesterday,Mixed/Mixed Duo,2015,Pop/Western Pop/Pop Vocal,Yearning/Energetic Yearning,Medium Tempo/Medium/60s
369427667,Lorraine Hunt Drew Minter Etc. Nicholas McGegan: Philharmonia Baroque Orchestra UC Berkeley Chamber Chorus,Handel: Theodora HWV 68 - Act 1: Racks Gibbets Sword a Fire,Handel: Theodora [Disc 1],"",2006,Classical/Other Classical/General Classical,Stirring/Invigorating / Joyous,Medium Tempo/Medium Fast/120s
368158745,Lorde,Tennis Court,Pure Heroine,Female/Female,2013,Alternative a Punk/Synth Pop/Synth Pop,Cool/Wary / Defiant,Medium Tempo/Medium Fast/90s
367198897,The Daydream Club,Soundwaves Of Gold,Found,"",2013,Alternative a Punk/Alternative/Alternative Rock,Gritty/Strumming Yearning,Medium Tempo/Medium/70s
366446166,The Weepies,Fancy Things,Sirens,Mixed/Mixed Duo,2015,Alternative a Punk/Alternative Folk/Alternative Folk,Gritty/Gritty / Soulful,Medium Tempo/Medium Slow/60s
366429233,Kaiser Chiefs,I Predict A Riot,Employment,Male/Male Group,2005,Alternative a Punk/Indie Rock/General Indie Rock,Urgent/Energetic Anxious,Medium Tempo/Medium/80s
366277867,The Vaccines,Dream Lover,English Graffiti,Male/Male Group,2015,Alternative a Punk/Indie Rock/General Indie Rock,Brooding/Alienated / Brooding,Medium Tempo/Medium Fast/90s
366275979,Brandon Flowers,Can't Deny My Love,The Desired Effect,Male/Male,2015,Alternative a Punk/Alternative/Alternative Singer-Songwriter,Urgent/Energetic Anxious,Medium Tempo/Medium Fast/110s
366275400,Spector,Bad Boyfriend,Moth Boys,"",2015,Alternative a Punk/Alternative/Alternative Rock,Upbeat/Happy / Soulful,Medium Tempo/Medium/80s
364994186,Take That,Rule The World,Beautiful World,Male/Male Group,2006,Pop/Western Pop/Teen Boy Band,Yearning/Energetic Yearning,Medium Tempo/Medium/80s
364662053,Sophie Hunger,Shape,Monday's Ghost,Female/Female,2008,Pop/European Pop/German Pop,Sophisticated/Smoky / Romantic,Medium Tempo/Medium/60s
363774712,Flowing Tears,Razorbliss,Razorbliss,Mixed/Mixed Group,2004,Rock/Metal/Gothic Metal,Defiant/Heavy Brooding,Medium Tempo/Medium Fast/100s
363769167,Emilie Autumn,Juliet,Enchant,Female/Female,2001,Alternative a Punk/Indie Rock/Indie Pop,Yearning/Energetic Yearning,Medium Tempo/Medium/70s
362662244,Florence + The Machine,What Kind Of Man,How Big How Blue How Beautiful,Mixed/Mixed Group,2015,Alternative a Punk/Alternative/Alternative Singer-Songwriter,Yearning/Energetic Yearning,Medium Tempo/Medium Fast/110s
362602332,Yeah Yeah Yeahs,Gold Lion,Show Your Bones,Mixed/Mixed Group,2006,Alternative a Punk/Indie Rock/Post-Punk Revival,Urgent/Energetic Anxious,Medium Tempo/Medium/80s
361116288,Hurts,Miracle,Exile,Male/Male Duo,2013,Pop/Western Pop/Adult Alternative Pop,Yearning/Energetic Yearning,Medium Tempo/Medium/80s
360477706,Emilie Autumn,Liar (Machine Mix by Dope Stars Inc.),Liar/Dead Is The New Alive (Double Feature EP),Female/Female,2006,Alternative a Punk/Indie Rock/Indie Pop,Defiant/Heavy Brooding,Medium Tempo/Medium Fast/120s
360223754,Queens Of The Stone Age,Everybody Knows That You Are Insane,Lullabies To Paralyze,Male/Male Group,2005,Rock/Hard Rock/Stoner Rock,Defiant/Heavy Brooding,Medium Tempo/Medium Fast/90s
357696528,The Exies,Ugly,Head For The Door,Male/Male Group,2004,Alternative a Punk/Alternative/Alternative Rock,Urgent/Energetic Anxious,Medium Tempo/Medium/80s
356285727,Keane,Somewhere Only We Know,Hopes a Fears,Male/Male Group,2004,Alternative a Punk/Brit Rock/Brit Rock,Yearning/Energetic Yearning,Medium Tempo/Medium/80s
353453366,Kasabian,Goodbye Kiss,Velociraptor!,Male/Male Group,2011,Alternative a Punk/Brit Rock/Brit Rock,Yearning/Bittersweet Pop,Medium Tempo/Medium Fast/120s
353252149,大黒摩季,Return To My Love,BACK BEATs #1,Female/Female,1995,Pop/Japanese Pop/J-Pop,Fiery/Fiery Groove,Medium Tempo/Medium Fast/110s
353245637,Ramona Falls,Fingerhold,Prophet,Mixed/Mixed Group,2012,Alternative a Punk/Indie Rock/General Indie Rock,Urgent/Energetic Anxious,Medium Tempo/Medium/80s
353244057,Ramona Falls,I Say Fever,Intuit,Mixed/Mixed Group,2009,Alternative a Punk/Indie Rock/General Indie Rock,Brooding/Alienated / Brooding,Medium Tempo/Medium Fast/100s
351186959,Anberlin,The Runaways,Never Take Friendship Personal,Male/Male Group,2005,Alternative a Punk/Alternative/Alternative Rock,Defiant/Heavy Brooding,Medium Tempo/Medium/80s
350908045,Depeche Mode,Broken,Delta Machine,Male/Male Group,2013,Alternative a Punk/Synth Pop/Synth Pop,Brooding/Energetic Melancholy,Medium Tempo/Medium Fast/120s
350132857,Axel Rudi Pell,Long Way to Go,Into The Storm,Male/Male,2014,Rock/Metal/Power Metal,Defiant/Heavy Brooding,Medium Tempo/Medium Slow/60s
347705824,Edward Sharpe a The Magnetic Zeros,Home,Up From Below,Mixed/Mixed Group,2009,Alternative a Punk/Alternative Folk/Alternative Folk,Empowering/Idealistic / Stirring,Medium Tempo/Medium Fast/110s
347702507,Of Monsters And Men,From Finner,My Head Is An Animal,Mixed/Mixed Group,2012,Alternative a Punk/Alternative Folk/Alternative Folk,Brooding/Dreamy Brooding,Medium Tempo/Medium Slow/60s
347695514,Alvvays,Party Police,Alvvays,Mixed/Mixed Group,2014,Alternative a Punk/Indie Rock/Indie Pop,Brooding/Dreamy Brooding,Medium Tempo/Medium Slow/60s
347540406,Justice,D.A.N.C.E.,Cross,Male/Male Duo,2007,Electronica/House/General House,Energizing/Edgy / Sexy,Medium Tempo/Medium Fast/110s
346761208,Ingrid Michaelson,Time Machine,Lights Out,Female/Female,2014,Pop/Western Pop/Adult Alternative Pop,Urgent/Energetic Anxious,Medium Tempo/Medium Fast/90s
345397823,The Kooks,Melody Maker,Listen [Bonus Tracks],Male/Male Group,2014,Alternative a Punk/Indie Rock/Indie Pop,Gritty/Sober / Determined,Medium Tempo/Medium/70s
344868698,Stereophonics,In A Moment,Graffiti On The Train,Male/Male Group,2013,Alternative a Punk/Brit Rock/Brit Rock,Rowdy/Confident / Tough,Medium Tempo/Medium Fast/90s
344110144,Red,Falling Sky,of Beauty and Rage,Male/Male Group,2015,Other/Religious/Christian Alt-Rock,Defiant/Heavy Brooding,Medium Tempo/Medium Fast/120s
343103339,Друга Рiка,Sam sobi ostriv (Сам собі острів),Rekordy (Рекорди),Male/Male Group,2005,Rock/Mainstream Rock/General Mainstream Rock,Yearning/Energetic Yearning,Medium Tempo/Medium/80s
342128570,Roxette,Real Sugar,Room Service,Mixed/Mixed Duo,2001,Rock/70's Rock/Classic Pop-Rock,Excited/Upbeat Pop Groove,Medium Tempo/Medium Fast/120s
340988548,Black Label Society,Mass Murder Machine,1919 Eternal,Male/Male Group,2002,Rock/Metal/Thrash Metal,Rowdy/Confident / Tough,Medium Tempo/Medium Fast/110s
340808093,The Maneken,Magic Of The Moment,PORTRAIT,Male/Male,2014,Alternative a Punk/Indie Rock/Indie Pop,Fiery/Fiery Groove,Medium Tempo/Medium Fast/100s
340807669,Различные Исполнители,Дела Людей Которые Были До Нас,Рок Сейшн,"",1999,Rock/70's Rock/Classic Pop-Rock,Sensual/Sensual Groove,Medium Tempo/Medium/70s
340807216,Muse,Butterflies a Hurricanes,Absolution,Male/Male Group,2003,Alternative a Punk/Alternative/Alternative Rock,Somber/Enigmatic / Mysterious,Medium Tempo/Medium Slow/50s
340635977,Lorde,Team,Pure Heroine,Female/Female,2013,Alternative a Punk/Synth Pop/Synth Pop,Excited/Euphoric Energy,Medium Tempo/Medium Fast/100s
340629278,Ellie Goulding,Burn,Halcyon Days,Female/Female,2013,Electronica/Electronica Mainstream/Pop Electronica,Energizing/Edgy / Sexy,Medium Tempo/Medium/80s
340110553,Ellie Goulding,Stay Awake,Halcyon Days,Female/Female,2013,Electronica/Electronica Mainstream/Pop Electronica,Urgent/Dark Pop,Medium Tempo/Medium/80s
339194891,No Doubt,It's My Life,The Singles 1992-2003,Mixed/Mixed Group,1992,Alternative a Punk/Alternative/Alternative Pop,Urgent/Dark Pop,Medium Tempo/Medium Fast/120s
339098499,Shunsuke Kida,Penetrator,Demon's Souls Soundtrack,"",2009,Soundtrack/Original Film/TV Music/General Film Music,Serious/Serious / Cerebral,Medium Tempo/Medium Fast/110s
339095472,Shunsuke Kida,Phalanx,Demon's Souls Soundtrack,"",2009,Soundtrack/Original Film/TV Music/General Film Music,Serious/Thrilling,Medium Tempo/Medium Fast/120s
338921982,Various Artists,Electricity,Nu Disco,Male/Male Duo,2013,Pop/Western Pop/Adult Alternative Pop,Energizing/Edgy / Sexy,Medium Tempo/Medium Fast/110s
338914381,Аквариум,Город Золотой,Grand Collection: Аквариум,Male/Male Group,2001,"",Sentimental/Tender / Sincere,Medium Tempo/Medium Slow/60s
338221449,Madonna,Hung Up,Confessions On A Dance Floor,Female/Female,2005,Pop/Western Pop/Dance Pop,Excited/Euphoric Energy,Medium Tempo/Medium Fast/120s
337715161,Velojet,I Follow My Heart,This Quiet Town,Mixed/Mixed Group,2007,Alternative a Punk/Indie Rock/Indie Pop,Defiant/Heavy Brooding,Medium Tempo/Medium/70s
337604523,Hans Zimmer,Main Theme [Rain Man],The Wings Of A Film: The Music Of Hans Zimmer,Male/Male,2001,Soundtrack/Original Film/TV Music/General Film Music,Romantic/Dramatic / Romantic,Medium Tempo/Medium Slow/50s
336253380,Ramona Falls,Melectric,Intuit,Mixed/Mixed Group,2009,Alternative a Punk/Indie Rock/General Indie Rock,Empowering/Idealistic / Stirring,Medium Tempo/Medium Fast/100s
335746018,Boy Kill Boy,Promises,Stars And The Sea,Male/Male Group,2008,Alternative a Punk/Indie Rock/Post-Punk Revival,Defiant/Heavy Brooding,Medium Tempo/Medium/70s
335733641,Fall Out Boy,Irresistible,American Beauty / American Psycho,Male/Male Group,2015,Alternative a Punk/Emo a Hardcore/Emo,Defiant/Heavy Brooding,Medium Tempo/Medium/80s
335732979,Superchick,Hey Hey,Rock What You Got,Mixed/Mixed Group,2008,Other/Religious/Christian Alt-Rock,Rowdy/Driving Dark Groove,Medium Tempo/Medium Fast/120s
335710848,Echosmith,Cool Kids,Talking Dreams,Mixed/Mixed Group,2013,Alternative a Punk/Indie Rock/Indie Pop,Yearning/Energetic Yearning,Medium Tempo/Medium/60s
335478978,Maroon 5,Animals,V,Male/Male Group,2014,Pop/Western Pop/Adult Alternative Pop,Cool/Wary / Defiant,Medium Tempo/Medium Slow/60s
334990273,The Constellations,Perfect Day,Southern Gothic,Mixed/Mixed Group,2010,Alternative a Punk/Alternative/Alternative Rock,Sensual/Dreamy Pulse,Medium Tempo/Medium/70s
333420690,米津玄師,Black Sheep,diorama,Male/Male,2012,Rock/Japanese Rock/Japanese Rock,Defiant/Heavy Brooding,Medium Tempo/Medium/80s
333409382,ProleteR,April Showers,Curses from Past Times EP,Male/Male Duo,2011,Electronica/Electronica Fusion/Ethno-Lounge Electronica,Cool/Dark Groovy,Medium Tempo/Medium Fast/90s
332144513,Michael Kiske a Amanda Somerville,Silence,Silence,"",2010,Rock/Metal/Heavy Metal,Defiant/Heavy Brooding,Medium Tempo/Medium Fast/120s
331669958,The Vamps,What About Love,Meet The Vamps [Bonus Tracks],Male/Male Group,2014,Pop/Western Pop/Teen Pop,Defiant/Heavy Brooding,Medium Tempo/Medium Fast/100s
331666103,Sad Alice Said,Open Your Eyes,Open Your Eyes (Single),"",2011,Rock/Metal/Heavy Metal,Brooding/Dreamy Brooding,Medium Tempo/Medium Slow/60s
331600288,Eicca Toppinen,Evil Ground,Music For The Movie Black Ice,"",2007,Pop/Western Pop/Pop Vocal,Defiant/Heavy Brooding,Medium Tempo/Medium Fast/90s
331588406,Rave The Reqviem,The Svlphvry Void,Rave the Reqviem,"",2014,Alternative a Punk/Alternative/Alternative Rock,Aggressive/Chaotic / Intense,Medium Tempo/Medium Fast/110s
331575739,Marie Laforêt,Ivan Boris Et Moi,Talents Du Siecle,Female/Female,2001,Pop/European Pop/French Pop,Brooding/Evocative / Intriguing,Medium Tempo/Medium/60s
331548840,Gotthard,I Know You Know,Need To Believe [Bonus Track],Male/Male Group,2009,Rock/Mainstream Rock/General Mainstream Rock,Defiant/Heavy Brooding,Medium Tempo/Medium/80s
331543654,KT Tunstall,Black Horse And The Cherry Tree,Eye To The Telescope,Female/Female,2004,Pop/Western Pop/Adult Alternative Pop,Rowdy/Driving Dark Groove,Medium Tempo/Medium Fast/100s
331542170,KT Tunstall,Saving My Face,Drastic Fantastic,Female/Female,2007,Pop/Western Pop/Adult Alternative Pop,Brooding/Dreamy Brooding,Medium Tempo/Medium Slow/60s
331458126,Delain,Your Body Is A Battleground,The Human Contradiction (Deluxe Version),Mixed/Mixed Group,2014,Rock/Metal/Progressive Metal,Defiant/Heavy Brooding,Medium Tempo/Medium Fast/120s
331442861,Boston,Let Me Take You Home Tonight,Boston,Male/Male Group,1976,Rock/70's Rock/Classic Rock,Empowering/Idealistic / Stirring,Medium Tempo/Medium/70s
330547818,Reamonn,Sometimes,Wish,Male/Male Group,2006,Rock/Adult Alternative Rock/Adult Alternative Rock,Urgent/Energetic Anxious,Medium Tempo/Medium Fast/90s
329382612,The Hardkiss,Stones,Stones and Honey,Mixed/Mixed Group,2014,Electronica/Electronica Mainstream/Pop Electronica,Sophisticated/Smoky / Romantic,Medium Tempo/Medium/70s
328647239,Nick Cave a The Bad Seeds,We Came Along This Road,No More Shall We Part,Male/Male Group,2001,Alternative a Punk/Indie Rock/Original Post-Punk,Melancholy/Light Melancholy,Medium Tempo/Medium Slow/60s
328377681,Noel Gallagher's High Flying Birds,Let The Lord Shine A Light On Me,Noel Gallagher's High Flying Birds,Male/Male Group,2011,Alternative a Punk/Alternative/Alternative Pop,Brooding/Dreamy Brooding,Medium Tempo/Medium/70s
328249276,Darling Violetta,A smaller god,Parlour,Mixed/Mixed Group,2003,Alternative a Punk/Alternative/Alternative Rock,Defiant/Heavy Brooding,Medium Tempo/Medium/80s
328208660,Сергей Трофимов,Я Теперь Буду Верен тебе (Посвящается Супруге),Следующая Остановка,Male/Male,2007,Pop/European Pop/Eastern European Pop,Sophisticated/Smoky / Romantic,Medium Tempo/Medium Slow/60s
328180916,Vivienne Mort,Сліди маленьких рук,Театр Pipinó,"",2014,Pop/Western Pop/Pop Vocal,Sophisticated/Smoky / Romantic,Medium Tempo/Medium Slow/60s
327893791,Vivienne Mort,Лети,Лети,"",2014,Pop/Western Pop/Pop Vocal,Gritty/Strumming Yearning,Medium Tempo/Medium/70s
327891786,Various Artists,Ми - Хлопці З Бандерштадту,Я Вернувся Домів,"",2011,Rock/Mainstream Rock/General Mainstream Rock,Aggressive/Dark Hard Beat,Medium Tempo/Medium Fast/120s
326940888,Various Artists,Towards The Within,Voce: Music From Women Of The World,"",1999,Pop/Easy Listening/Other Easy Listening,Serious/Hypnotic Rhythm,Medium Tempo/Medium/70s
326923295,Dead Can Dance,In The Kingdom Of The Blind,The Serpent's Egg,Mixed/Mixed Duo,1988,Alternative a Punk/Indie Rock/Dream Pop,Romantic/Dramatic / Romantic,Medium Tempo/Medium/80s
326911922,Various Artists,Towards The Within,Voce: Music From Women Of The World,"",1999,Pop/Easy Listening/Other Easy Listening,Serious/Hypnotic Rhythm,Medium Tempo/Medium/70s
